index,genre,filename,year,old_index,source1,source2,sentence1,sentence2,score
967,main-captions,MSRvid,2012,699,none,none,A man is chopping butter into a container.,A woman is cutting shrimps.,0.6
2964,main-news,MSRpar,2012,18,none,none,They were at Raffles Hospital over the weekend for further evaluation.,"They underwent more tests over the weekend, and are now warded at Raffles Hospital.",3.2
1499,main-captions,images,2015,7,none,none,Three children stand on or near a fence.,The three children are standing on and by a fence.,4.6
2785,main-news,MSRpar,2012,509,none,none,"He was voluntarily castrated in 2001, an operation he contends removed his ability to become sexually aroused.","DeVries, who was voluntarily castrated in August 2001, has said the surgery took away his ability to become sexually aroused.",4.5
854,main-captions,MSRvid,2012,526,none,none,A woman is reading a lifestyle magazine.,A woman is slicing a meat into pieces.,0.5
3883,main-news,headlines,2013,168,none,none,Five killed in China building collapse,At least 20 killed in Syria Saturday,0.2
5221,main-news,headlines,2015,669,none,none,"Obama condemns Egypt violence, cancels military exercises",Pakistan condemns violence in Egypt,0.8
1012,main-captions,images,2014,17,none,none,A kid jumping a ledge with a bike.,A black and white cat playing with a blanket.,0.0
843,main-captions,MSRvid,2012,513,none,none,Girls are walking on the stage.,Women models are walking down a catwalk.,2.6
5246,main-news,headlines,2015,725,none,none,Royal Hoax DJ Takes Action Against Station,Taliban bombs US base in Afghanistan,0.0
456,main-captions,MSRvid,2012,689,none,none,A boy is crawling into a dog house.,A cat is playing on the floor.,0.0
431,main-captions,MSRvid,2012,645,none,none,A woman is slicing meat with a knife.,A man is spreading out dough.,0.417
1709,main-captions,images,2015,640,none,none,A golden dog is running on the grass.,The large beige dog is running through the grass.,3.4
219,main-captions,MSRvid,2012,322,none,none,A man is shooting a gun.,A man is spitting.,0.0
1410,main-captions,images,2014,608,none,none,An orange kitten lay on a leather couch.,Young couple sitting on a black couch.,0.8
5545,main-news,headlines,2015,1485,none,none,Rebels kill 21 civilians in Syria Alawite village,Bomb kills 18 civilians in Afghanistan,1.2
314,main-captions,MSRvid,2012,472,none,none,A dog lies on his back on a wooden floor.,A dog is laying on the floor.,4.0
3918,main-news,headlines,2013,206,none,none,Two NATO soldiers killed in Afghanistan,NATO Soldier Killed in Afghan Blast,3.6
204,main-captions,MSRvid,2012,298,none,none,A woman holds a kangaroo.,A woman is picking up a kangaroo.,3.25
1983,main-captions,images,2015,1456,none,none,Two people are walking through some water.,Two girls are walking by a tree in front of a brick building.,1.2
514,main-captions,MSRvid,2012,38,none,none,A man is playing a keyboard.,A man plays a keyboard.,5.0
5605,main-news,headlines,2016,428,Europe Media Monitor (http://emm.newsbrief.eu),Europe Media Monitor (http://emm.newsbrief.eu),Spain approves new restrictive abortion law,Spanish government approves tight restrictions on abortion,5.0
5395,main-news,headlines,2015,1104,none,none,"Four civilians, three NATO soldiers killed in Afghanistan",Three NATO soldiers killed in Afghanistan,3.4
1024,main-captions,images,2014,38,none,none,A group of people sitting around a table with food on it.,A group of people sit around a table with food and beer.,4.0
487,main-captions,MSRvid,2012,740,none,none,A woman is adding sauce to some food.,A person is cutting leaves.,0.2
4269,main-news,headlines,2013,647,none,none,"Syrian forces bombard Homs, Russia warns of civil war","Syrian forces bombard Homs, Lavrov arrives for talks",2.6
4433,main-news,headlines,2014,109,none,none,Mugabe declared winner of disputed elections,Zimbabwe: Mugabe declared winner in disputed vote,4.0
3025,main-news,MSRpar,2012,104,none,none,"Their leader, Abu Bakr al-Azdi, turned himself in in June; his deputy was killed in a recent shootout with Saudi forces.","Their leader, Abu Bakr al-Azdi, surrendered in June; his deputy was killed in a shoot-out with Saudi forces recently.",5.0
2832,main-news,MSRpar,2012,577,none,none,"""Government bonds sold off sharply after Greenspan told Congress on Tuesday that the U.S. economy """"could very well be embarking on a period of extended growth"""".""","""Greenspan told Congress on Tuesday the U.S. economy """"could very well be embarking on a period of sustained growth"""".""",3.2
1384,main-captions,images,2014,568,none,none,Two brown horses standing in a green meadow.,A brown horse stands in tall grass.,2.6
630,main-captions,MSRvid,2012,199,none,none,A woman is swimming.,A man is spitting.,0.0
1188,main-captions,images,2014,275,none,none,A line outside of a bookstore on a street.,The yellow motorcycle is parked on the street.,0.4
4737,main-news,headlines,2014,483,none,none,"Philippines, rebels reach wealth-sharing deal",Philippines and rebels reach 'wealth deal',5.0
2223,main-forum,deft-forum,2014,223,none,none,You should put scientists on a pedestal.,Why do people like you put scientist on a pedestal?,3.4
3128,main-news,MSRpar,2012,266,none,none,"In an E-mail statement to the Knoxville News Sentinel, Shumaker said, ''I am not giving any consideration to resignation.","""I am not giving any consideration to resignation,"""" Shumaker said in a statement.""",4.0
95,main-captions,MSRvid,2012,138,none,none,Two boys are driving.,Two bays are dancing.,0.6
1419,main-captions,images,2014,624,none,none,Boy laying on couch with dog.,The boy is lying on a couch with a puppy.,4.4
5145,main-news,headlines,2015,485,none,none,Egypt poll: 98 per cent vote 'yes' for new constitution,Egypt holding key vote on constitution,2.4
4307,main-news,headlines,2013,698,none,none,Bank of England's Paul Tucker tainted by Libor mess,Bank of England deputy denies ordering rate-rigging,2.8
200,main-captions,MSRvid,2012,294,none,none,Someone is feeding a animal.,Someone is playing a piano.,0.0
2997,main-news,MSRpar,2012,63,none,none,The company didn't detail the costs of the replacement and repairs.,But company officials expect the costs of the replacement work to run into the millions of dollars.,2.0
3299,main-news,MSRpar,2012,536,none,none,"Thanks to the euro's rise against the Japanese currency, the dollar was at 117.24 yen, well above the overnight 10-month low of 116 yen.","The euro's rise against the yen and speculation of Japanese intervention helped the dollar firm to 117.25 yen , well above a 10-month low of 116 yen hit on Thursday.",4.25
3412,main-news,MSRpar,2012,696,none,none,"""A 32-count indictment """"strikes at one of the very top targets in the drug trafficking world,"""" U.S. Attorney Marcos Jimenez said.""","""The newly unsealed 32-count indictment alleges money laundering and conspiracy and """"strikes at one of the very top targets in the drug-trafficking world,"""" Jiménez said.""",3.5
2210,main-forum,deft-forum,2014,210,none,none,Unless it's different in different countries?,"So, short form, yes, it probably is different in different countries.",3.6
5468,main-news,headlines,2015,1294,none,none,Car bomb kills 20 in northwest Syria,Car bomb kills 40 in northwest Pakistan,1.2
1247,main-captions,images,2014,365,none,none,Two women are posing for the camera and giving the thumbs up sign.,Two smiling young women giving the thumbs up sign.,4.4
4927,main-news,headlines,2014,718,none,none,Thai opposition protesters begin Bangkok shutdown,Thai protesters launch Bangkok 'shutdown',4.8
429,main-captions,MSRvid,2012,642,none,none,The woman is pencilling on eye shadow.,The girl is using an eye pencil on her eyelid.,2.8
5216,main-news,headlines,2015,661,none,none,Cricket-England v Australia fourth test scoreboard,"Cricket-England 155-4 v Australia, fourth test - tea",4.0
5262,main-news,headlines,2015,771,none,none,Search ends for missing asylum-seekers,Search narrowed for missing man,1.4
2360,main-forum,deft-forum,2014,360,none,none,Is it possible his home was affected and the school was not?,"Sure, it is possible his home was affected, but not the school.",3.2
2833,main-news,MSRpar,2012,579,none,none,"For Kathy Nicolo (Jennifer Connelly), the house means stability and family.",Kathy Nicolo (Jennifer Connelly) is desperate that her family not find out that her life has fallen apart.,2.0
3895,main-news,headlines,2013,181,none,none,Arkansas Supreme Court strikes down execution law,Arkansas Justices Strike Down Death Penalty,4.6
580,main-captions,MSRvid,2012,127,none,none,A man is carrying another man over his shoulder.,A man is carrying someone on his shoulder.,3.25
5618,main-news,headlines,2016,573,Europe Media Monitor (http://emm.newsbrief.eu),Europe Media Monitor (http://emm.newsbrief.eu),"Hagel, Dempsey face Congress over defense budget","""Hagel laments """"political"""" changes to US defence budget""",4.0
3295,main-news,MSRpar,2012,531,none,none,"""It was a final test before delivering the missile to the armed forces.",State radio said it was the last test before the missile was delivered to the armed forces.,4.0
3296,main-news,MSRpar,2012,532,none,none,"Your withdrawal from our country is inevitable, whether it happens today or tomorrow, and tomorrow will come soon.""""""","""Your withdrawal from our country is inevitable, whether it happens today or tomorrow, added the voice, which signed off giving the date as """"mid-September.""""""",3.5
5344,main-news,headlines,2015,965,none,none,Queen visits Britain's new prince,Queen meets Britain's new baby prince,5.0
4855,main-news,headlines,2014,628,none,none,"White House, defense contractors discuss harm of automatic spending cuts","White House, defense firms discuss automatic spending cuts",4.4
4728,main-news,headlines,2014,471,none,none,UK confirms fears over Syria's chemical weapons,End 'near' for Syria's chemical weapons,1.4
963,main-captions,MSRvid,2012,693,none,none,A dog is running around a yard.,A black pet dog runs around in the garden of a house.,3.2
2804,main-news,MSRpar,2012,539,none,none,"The epidemic began in November in the mainland's Guangdong province, but the People's Republic of China refused to report truthfully about its spread for four months.","The PRC epidemic began in Guandong province in November, but the Communist Party government refused to report truthfully about its spread for four months.",4.25
2476,main-news,MSRpar,2012,45,none,none,"Earlier this month, RIM had said it expected to report second-quarter earnings of between 7 cents and 11 cents a share.",Excluding legal fees and other charges it expected a loss of between 1 and 4 cents a share.,1.2
2629,main-news,MSRpar,2012,284,none,none,"This is extraordinarily fast, said Matt Geller, an analyst at CIBC World Markets.","""They are actually going to record sales for Velcade this year,"""" said Matt Geller, an analyst at CIBC World Markets.""",2.25
1968,main-captions,images,2015,1393,none,none,A dog running along the beach.,Boy and girl running along the beach.,1.4
3347,main-news,MSRpar,2012,608,none,none,He and his colleagues attributed some of the communication gap to doctors feeling pressed for time.,He attributed some of the communication gap to doctors feeling pressed for time; patients cited discomfort discussing financial issues.,3.4
2752,main-news,MSRpar,2012,457,none,none,"Miodrag Zivkovic, of the Liberal Alliance of Montenegro, won 31 percent of the vote, while the independent Dragan Hajdukovic got 4 percent.","A pro-independence radical, Miodrag Zivkovic, of the Liberal Alliance, came in second with 31 percent of the vote.",3.0
2984,main-news,MSRpar,2012,47,none,none,"The Food and Drug Administration rejected ImClone's 2001 application to sell Erbitux, citing shoddy research.","The U.S. Food and Drug Administration rejected ImClone's original application in December 2001, saying the trial had been sloppily conducted.",2.8
1350,main-captions,images,2014,515,none,none,A kitchendiner with papers laying on the blue clothed dining table.,A small kitchen and a cluttered table with a blue table cloth.,3.4
1869,main-captions,images,2015,1136,none,none,A brown dog is running through green grass.,A brown dog is running though a river.,2.4
733,main-captions,MSRvid,2012,343,none,none,A cat is playing.,A woman is playing flute.,0.25
5160,main-news,headlines,2015,516,none,none,At least 11 killed in India building collapse,At Least 66 Killed in Bomb Blasts in Iraq,0.6
345,main-captions,MSRvid,2012,515,none,none,A boy is making some dance steps.,A boy is pouring something from a pitcher.,0.4
877,main-captions,MSRvid,2012,563,none,none,The person is removing the scales from the fish.,A person is descaling a fish.,5.0
4274,main-news,headlines,2013,652,none,none,US Afghanistan general linked to Petraeus scandal,Senior US general linked to Petraeus scandal,3.8
4003,main-news,headlines,2013,315,none,none,Mali's President Hands in Resignation,Mali's President Formally Resigns,4.6
5615,main-news,headlines,2016,538,Europe Media Monitor (http://emm.newsbrief.eu),Europe Media Monitor (http://emm.newsbrief.eu),Egypt imposes state of emergency after 95 people killed,Egypt announces one-month state of emergency nationwide,3.0
4216,main-news,headlines,2013,583,none,none,China mine accident kills 10,China truck accident kills 20,1.6
3690,main-news,deft-news,2014,240,none,none,the european union and the united states have frozen al-qadi's assets.,the western governments include the united states and france.,0.4
3038,main-news,MSRpar,2012,120,none,none,"In April, it had forecast operating earnings in the range of 60 to 80 cents a share.",Kodak expects earnings of 5 cents to 25 cents a share in the quarter.,1.0
4415,main-news,headlines,2014,88,none,none,Manning sentenced to 35 years in prison,"Ariel Castro sentenced to 1,000 years in prison",0.4
1974,main-captions,images,2015,1409,none,none,A young boy plays in a red ball pit.,A laughing boy lies on a pit of blue balls.,3.0
1032,main-captions,images,2014,48,none,none,A white sheep on a hillside looking at the camera.,The skinny cows are standing on the grass.,1.2
1652,main-captions,images,2015,471,none,none,A black dog is walking on the grass with a stick in it's mouth.,A boy holds a net with a snake in it close to the ground.,0.0
3184,main-news,MSRpar,2012,364,none,none,No. 2 HP saw its Unix server sales dropped 3.6 percent to $1.36 billion.,HP fell to second place with server sales growing 0.4 percent to $2.9 billion.,2.333
5450,main-news,headlines,2015,1240,none,none,President Obama reveals plans to withdraw troops from Afghanistan by 2016,US Government Shutdown: Obama tells Republicans to lift threat to US economy if they want talks,0.8
211,main-captions,MSRvid,2012,311,none,none,A man is slicing a potato into pieces.,A man is cutting a potato.,4.2
3769,main-news,headlines,2013,22,none,none,Three Tibetans self-immolate in western China: report,7 Tibetans self-immolate in China,2.4
428,main-captions,MSRvid,2012,641,none,none,The turtle followed the fish.,A sea turtle is hunting for fish.,3.0
388,main-captions,MSRvid,2012,588,none,none,A man is hugging someone.,A man is taking a picture.,0.4
1152,main-captions,images,2014,221,none,none,A man rides a large black motorbike.,A child sits in a large black leather chair.,0.0
2453,main-news,MSRpar,2012,6,none,none,"Darren Dopp, a Spitzer spokesman, declined to comment late Thursday.","John Heine, a spokesman for the commission in Washington, declined to comment on Mr. Spitzer's criticism.",1.4
3696,main-news,deft-news,2014,246,none,none,the part of the purpose of the united states plan is to increase pressure on north korea.,the united states and the allies of the united states believe iran is pursuing nuclear arms.,0.8
2046,main-forum,deft-forum,2014,46,none,none,"Z stalked him down, then shot him.","""You claimed Zimmerman """" Stalked him down, then shot him """".""",3.0
2737,main-news,MSRpar,2012,438,none,none,Congress twice before passed similar restrictions only to see President Bill Clinton veto them.,"Congress twice passed similar bills, but then-President Clinton vetoed them both times.",4.6
4314,main-news,headlines,2013,707,none,none,Dozens dead in Taliban resort attack,'India police name 3 Iranians in embassy attack',0.4
2677,main-news,MSRpar,2012,358,none,none,Tamil parties blame the Liberation Tigers of Tamil Eelam (LTTE) for these killings.,The government wanted to revive talks with the Liberation Tigers of Tamil Eelam (LTTE) to discuss the interim structure.,1.75
3532,main-news,deft-news,2014,82,none,none,"detainees to be accused of homicide, criminal collaboration, kidnapping and the funding of terrorism and include members of the military and police.","iguaran stated that the detainees will be accused of homicide, criminal collaboration, kidnappings and the funding of terrorism.",3.25
2315,main-forum,deft-forum,2014,315,none,none,They're looking at each other!,Why are they looking at each other like that ?!?!,2.8
3053,main-news,MSRpar,2012,143,none,none,A tropical storm rapidly developed in the Gulf of Mexico Sunday and was expected to hit somewhere along the Texas or Louisiana coasts by Monday night.,A tropical storm rapidly developed in the Gulf of Mexico on Sunday and could have hurricane-force winds when it hits land somewhere along the Louisiana coast Monday night.,4.0
4813,main-news,headlines,2014,578,none,none,"Bombs kill two people, wound dozens at Boston Marathon",Only two bombs found in Boston Marathon attack,2.2
2090,main-forum,deft-forum,2014,90,none,none,"I said it wasn't a person, in the legal sense.","If it isn't a person, then WTF is it?",2.0
563,main-captions,MSRvid,2012,102,none,none,Someone is pouring oil into a skillet.,Someone is pouring milk into a blender.,1.6
2313,main-forum,deft-forum,2014,313,none,none,Ive watched kids play.,I like watching kids play.,2.2
5187,main-news,headlines,2015,587,none,none,Russian Prime Minister On Second Day Of Crimea Visit,Russia warns against setting preconditions for Syria,0.8
1798,main-captions,images,2015,900,none,none,A dog wearing a green sweater and a backpack walking on snow.,A small dog wearing a green sweater and a backpack walks through snow.,4.4
1545,main-captions,images,2015,176,none,none,a dog is running across the sand with a stick in it's mouth.,A dog is running through a creek with a stick in its mouth.,3.6
802,main-captions,MSRvid,2012,455,none,none,A woman cuts a pineapple.,A woman is slicing a pineapple into pieces.,4.0
3379,main-news,MSRpar,2012,651,none,none,More than 100 police officers were involved in the busts that were the culmination of a two-year operation investigating the cocaine importing and money laundering gang.,More than 100 officers launched the London raids in the final phase of a two-year operation investigating a cocaine and money laundering ring.,4.0
3540,main-news,deft-news,2014,90,none,none,lavrov has told us secretary of state condoleezza rice that russia remains open to dialogue.,u.s. secretary of state condoleezza rice demanded russia withdraw its forces.,2.8
4968,main-news,headlines,2015,33,none,none,Death toll from Philippine earthquake rises to 185,Death toll from Philippines quake rises to 144,3.6
4286,main-news,headlines,2013,666,none,none,Syrian forces move to retake Aleppo,Syrian Regime Bids To Retake City Of Aleppo,4.4
779,main-captions,MSRvid,2012,416,none,none,A tiger trys to climb the wall.,A lion is trying to climb up over a wall.,3.0
1599,main-captions,images,2015,315,none,none,A young boy jumps into a pool with outstretched arms.,A dog jumps into a backyard pool.,1.2
1811,main-captions,images,2015,946,none,none,A woman standing in front of trees and smiling.,A man is walking by trees in front of the city skyline.,2.0
5386,main-news,headlines,2015,1070,none,none,Chinese shares close higher Tuesday,Chinese stocks close lower Thursday,1.6
2999,main-news,MSRpar,2012,65,none,none,"I felt that if I disagreed with Rosie too much I would lose my job, she said.","""Cavender did say: """"I felt that if I disagreed with Rosie too much I would lose my job.""""""",3.25
3404,main-news,MSRpar,2012,686,none,none,Mr. Sweeney outlined plans for the campaign in a speech last night in Philadelphia at the annual meeting of the American Political Science Association.,Sweeney was to outline plans for the campaign in a speech on Saturday night at the annual meeting of the American Political Science Association.,3.5
1790,main-captions,images,2015,872,none,none,A person holding a net is standing in the water.,A black woman and two black children are sitting in a thatched tent.,0.6
5446,main-news,headlines,2015,1232,none,none,Boston bombing suspect to appear in court,Boston bombing suspect buried,1.2
2586,main-news,MSRpar,2012,224,none,none,"Based on a separate survey of households, the unemployment rate fell in August to 6.1 percent from 6.2 percent.","Labor Department analysts discounted a slight improvement in the national unemployment rate, which fell in August to 6.1 percent from 6.2 percent.",3.75
5448,main-news,headlines,2015,1238,none,none,Obama announces creation of twin manufacturing hubs,US stocks retreat on manufacturing data,0.4
4151,main-news,headlines,2013,499,none,none,Clinton ready to fight for Obama,Clinton a tough act for Obama to follow,1.0
279,main-captions,MSRvid,2012,415,none,none,A woman is riding a horse on a beach.,A man is carrying another man on his back.,0.4
1679,main-captions,images,2015,537,none,none,two puppies playing around in the grass,Two dogs are wrestling in the grass.,4.0
3553,main-news,deft-news,2014,103,none,none,paris is the capital of france.,lima is the capital of,0.6
4293,main-news,headlines,2013,677,none,none,US drone strike kills 5 militants in Pakistan,Drone strike kills four suspected militants in Pakistan,3.0
4639,main-news,headlines,2014,359,none,none,Obama Praises Mandela 'Inspiration',Obama hails Mandela's inspiration effect,4.8
1506,main-captions,images,2015,25,none,none,The two dogs are running on the grass.,Two dogs are playing in the grass.,4.4
689,main-captions,MSRvid,2012,281,none,none,A man with glasses is talking.,A man in a library is talking.,3.25
4624,main-news,headlines,2014,341,none,none,Three Afghans killed in suicide attack,Three Afghans dead in new blast at US base in east Afghanistan,3.6
980,main-captions,MSRvid,2012,714,none,none,The doctor was helping the patient.,Doctors are trying to revive a man.,2.8
1138,main-captions,images,2014,201,none,none,A women sitting in a chair at Christmas holding make up.,A train sitting on the tracks in a train yard.,0.0
3571,main-news,deft-news,2014,121,none,none,the cfe is very important for european security.,the cfe is a cornerstone of european security.,5.0
5209,main-news,headlines,2015,645,none,none,Kim Jong-un Executed His 'Worse Than a Dog' Uncle,NKorea executes Kim Jong Un' uncle,3.5
4382,main-news,headlines,2014,42,none,none,Schumacher in a coma after ski accident,Michael Schumacher still in a coma fighting for his life following skiing accident,4.0
2074,main-forum,deft-forum,2014,74,none,none,Dr. Neander's revised version.,"""Neander's revised version""""?""",4.0
5206,main-news,headlines,2015,638,none,none,More rain hampers Indian flood rescue,US tourist gang-raped in northern India: Police,0.4
118,main-captions,MSRvid,2012,175,none,none,A man is riding on a horse.,A man is talking on a phone.,1.0
4019,main-news,headlines,2013,337,none,none,Nine killed in gun attack in Pakistan,Five million citizens get unofficial salary in Ukraine,0.0
2702,main-news,MSRpar,2012,390,none,none,Mr Howard said he also had faith in the system under which Hicks could be tried.,"Mr Howard also said yesterday that Hicks would be fairly treated, saying he had faith in the US justice system.",4.5
1917,main-captions,images,2015,1254,none,none,A girl in a pink dress rides her bike along a white picket fence.,A girl in a red dress rides her bike in front of a white fence.,4.0
521,main-captions,MSRvid,2012,47,none,none,A man is playing a guitar.,A man is playing a piano.,2.0
3772,main-news,headlines,2013,25,none,none,"Quartet calls on Israelis, Palestinians to end irritants",Occupation to confiscate 30 dunums of Palestinian land in Deir Estia,1.4
5438,main-news,headlines,2015,1214,none,none,North Korea's Kim hails execution of powerful uncle,North Korean intrigue: The execution of power,2.6
47,main-captions,MSRvid,2012,70,none,none,A man is cutting up a potato.,A man is cutting up carrots.,2.375
2837,main-news,MSRpar,2012,585,none,none,"The priest, the Rev. John F. Johnston, 64, of 35th Avenue in Jackson Heights, was charged with aggravated harassment and criminal possession of a weapon.","The Rev. John Johnston, 64, was charged with aggravated harassment in the phone call case and with criminal possession of a weapon, according to a police statement.",3.75
3877,main-news,headlines,2013,159,none,none,"Man, 19, quizzed over teen murder",Man quizzed over Megan-Leigh murder,3.8
820,main-captions,MSRvid,2012,481,none,none,A young boy sings and plays a guitar.,A kid plays the guitar.,3.25
586,main-captions,MSRvid,2012,133,none,none,Two boys on a couch are playing video games.,Two boys are playing a video game.,4.0
624,main-captions,MSRvid,2012,192,none,none,A man is riding a motorcycle on the highway.,A man is riding a motorcycle.,3.5
3636,main-news,deft-news,2014,186,none,none,the bill proposing the new law allowing the use of space programs for defense was already approved by the lower house of japan's government last week.,the bill for the new law was already approved by the japanese government's lower house last week.,3.4
4061,main-news,headlines,2013,386,none,none,Red Cross worker killed in Pakistan,Kidnapped UK aid worker killed in Pakistan,2.2
2404,main-forum,deft-forum,2014,404,none,none,I am not the one claiming the right to decide over another woman's body.,You want others to decide over a woman body.,2.8
