index,genre,filename,year,old_index,source1,source2,sentence1,sentence2,score
1776,main-captions,images,2015,842,none,none,Two girls playing with people and flowers behind them.,Two young girls wearing skirts are playing in a garden.,3.2
927,main-captions,MSRvid,2012,636,none,none,A cat and a ferret are playing.,A ferret and kitten play together.,4.25
4257,main-news,headlines,2013,630,none,none,Agribusiness: Mad cow disease found in California,USDA Confirms Case of Mad Cow Disease in California,4.2
930,main-captions,MSRvid,2012,640,none,none,A dog is driving a car.,A guy is talking into a microphone.,0.0
1101,main-captions,images,2014,140,none,none,A white Apple computer sits on the beige carpeting of a bedroom.,An Apple computer sitting on the floor.,3.6
4568,main-news,headlines,2014,275,none,none,Purge sends chilling message to North Korea's elite,Purge of Kim uncle sends chilling message to North Korea’s elite,4.0
3936,main-news,headlines,2013,231,none,none,Salvador Dali painting snatched from New York gallery,Salvador Dali painting snatched in NYC,4.6
5077,main-news,headlines,2015,303,none,none,"Teenage girl killed in east London Shereka Marsh was shot in the neck, police say",Hackney shooting: Teenager Shereka Marsh 'bled to death after being shot in neck',4.6
4721,main-news,headlines,2014,461,none,none,Israel green-lights 1500 settler homes,"Israel unveils 1,800 more settler homes",3.2
988,main-captions,MSRvid,2012,729,none,none,A man is opening a package containing headphones.,A woman is riding a horse.,0.0
5387,main-news,headlines,2015,1073,none,none,India Ink: Image of the Day: July 2,India Ink: Image of the Day: March 4,3.0
382,main-captions,MSRvid,2012,582,none,none,The man is putting chicken into the container.,A man is putting foods in a box.,2.5
4973,main-news,headlines,2015,48,none,none,German envoy optimistic about Iran-G5+1 talks,Iran 'cautiously optimistic' about future nuclear talks,1.4
1659,main-captions,images,2015,488,none,none,A boy in black waves his arms while other people are behind him on a field.,a man in a black shirt is roller blading past a bench in the city.,0.4
4344,main-news,headlines,2013,744,none,none,Hurricane Sandy makes landfall in southeastern Jamaica: NHC,Hurricane Sandy reaches Jamaica,3.0
4249,main-news,headlines,2013,621,none,none,Profiles of Egypt's main presidential candidates,Second day of Egyptian presidential election,1.2
2921,main-news,MSRpar,2012,703,none,none,"IAC's stock closed yesterday down $2.81, or 7.6 percent, at $34.19.","InterActiveCorp's shares closed at $34.19, down $2.81, or 7.6 percent on the Nasdaq Stock Market.",4.5
1127,main-captions,images,2014,180,none,none,Sail boat sailing on the water.,Sail boat floating on the blue water.,4.2
3488,main-news,deft-news,2014,38,none,none,french energy and transport company alstom may sign a contract to build a high-speed rail link between beijing and shanghai.,alstom may sign a contract to build a high-speed rail link between beijing and shanghai.,4.0
392,main-captions,MSRvid,2012,594,none,none,A person is adding food in a pan.,A woman puts rice into a pan.,3.0
729,main-captions,MSRvid,2012,338,none,none,The boy played his trumpet.,A boy is playing the trumpet.,4.4
5296,main-news,headlines,2015,851,none,none,Israel approves release of first group of Palestinian prisoners ahead of peace talks,Syrian opposition confirms participation in peace talks,1.0
4825,main-news,headlines,2014,593,none,none,"6.3-magnitude quake hits Honshu, Japan: CENC",Magnitude-6.0 quake jolts Santa Cruz Islands: CENC,1.8
867,main-captions,MSRvid,2012,546,none,none,A dog is pawing at a fly in the carpet before it.,The dog played with a bug on the carpet.,3.6
5039,main-news,headlines,2015,215,none,none,Tehelka editor embroiled in sex assault scam,Tehelka editor steps down after allegations of sexual misconduct,4.2
2827,main-news,MSRpar,2012,570,none,none,Luzerne County District Attorney David Lupas told a news conference Monday that authorities were ``continuing to make significant progress'' in the case.,"""No charges have been filed in those deaths, but Luzerne County District Attorney David Lupas said authorities were """"continuing to make significant progress"""" in the case.""",3.4
2592,main-news,MSRpar,2012,235,none,none,"Several relatives of Australian victims of the attack were in court to witness the proceedings, but few Balinese attended the trial.","Several relatives of Australian victims of the attack sat in the front row of the court, but few Balinese attended the trial.",4.6
317,main-captions,MSRvid,2012,477,none,none,An elderly woman is pouring oil into a frying pan.,A tied man is putting into water.,0.0
5249,main-news,headlines,2015,736,none,none,"Iran, world powers begin new round of nuclear talks","Iran, world powers pledge new nuclear talks",4.2
2722,main-news,MSRpar,2012,418,none,none,"With the power back on, state workers headed back to their jobs Friday morning.","Pataki said if power was restored, state workers would be back on the job Friday morning.",2.6
613,main-captions,MSRvid,2012,172,none,none,A boy whacks a man with a sword.,A boy spanks a man with a plastic sword.,3.333
2757,main-news,MSRpar,2012,466,none,none,"When police removed the four from the home, they weighed 136 pounds combined.",Each boy weighed less than 50 pounds when they were removed from the home Oct. 10.,3.0
4191,main-news,headlines,2013,550,none,none,Teenager and father killed in crash,Three killed in horror crash are named,1.6
30,main-captions,MSRvid,2012,47,none,none,A man is riding a mechanical bull.,A man rode a mechanical bull.,4.0
740,main-captions,MSRvid,2012,351,none,none,"A woman tosses a cat in the air, and the cat hangs off a rod on the ceiling.",A person throws a cat in the air and it grabs onto the ceiling.,3.5
5555,main-news,headlines,2016,44,Europe Media Monitor (http://emm.newsbrief.eu),Europe Media Monitor (http://emm.newsbrief.eu),U.N. rights chief presses Egypt on Mursi detention,UN Rights Chief Presses Egypt on Morsi Detention,5.0
4649,main-news,headlines,2014,369,none,none,Crowds Gather in Bethlehem for Christmas,"Oh, little town of Bethlehem — for real",2.0
4619,main-news,headlines,2014,336,none,none,US State Department faulted over Benghazi,State Dept security chief resigns after Benghazi,2.4
2643,main-news,MSRpar,2012,307,none,none,"Analysts' consensus estimate from Thomson First Call was for a loss of $2.08 a share, excluding one-time items.",The estimate of analysts surveyed by Thomson First Call was for a loss of $2.75 a share.,2.5
2027,main-forum,deft-forum,2014,27,none,none,"Funny, I thought the same thing about some math.",And here I thought I knew me some math.,2.2
5343,main-news,headlines,2015,961,none,none,Dozens injured in Connecticut train collision,Indian minister killed in head-on collision,0.2
1783,main-captions,images,2015,859,none,none,a red and white race car racing on a dirt racetrack.,A person is riding a dirt bike in a race on a dirt track.,1.4
481,main-captions,MSRvid,2012,727,none,none,Two cartoon rabbits are kissing.,A rabbit is kissing another rabbit.,3.8
1412,main-captions,images,2014,613,none,none,A subway train pulling into the station.,A white train pulling into a station.,3.6
1925,main-captions,images,2015,1291,none,none,A young men jumps off rocks into a lake.,A young man in red swimming trunks jumped off a large rock into the water.,4.0
1937,main-captions,images,2015,1322,none,none,Two black and white dogs are playing together outside.,Two children and a black dog are playing out in the snow.,1.0
2295,main-forum,deft-forum,2014,295,none,none,I think you are missing the point with entrepreneurs.,Again I think you are missing the point on the Twain quote.,0.8
4246,main-news,headlines,2013,618,none,none,Four seriously injured in M23 motorway crash,Four injured in motorway crash,3.6
2248,main-forum,deft-forum,2014,248,none,none,I don't like flavored beers.,I don't like many flavored drinks.,3.0
5230,main-news,headlines,2015,697,none,none,Algerian president in France for medical tests,Algerian president in France for medical tests after minor stroke,3.6
5521,main-news,headlines,2015,1430,none,none,"Heavy smog hits north China city, flights cancelled","Heavy Smog Hits North China City, Flights Canceled",5.0
2109,main-forum,deft-forum,2014,109,none,none,How long after the obliteration should the kid return to school?,How long after the obliteration should it no longer bother the kid?,3.0
4446,main-news,headlines,2014,125,none,none,Israeli envoys summoned over settlement plans,Britain summons Israeli envoy over settlements,2.5
5451,main-news,headlines,2015,1241,none,none,"US, NATO Raise Doubts Russia Pulled Back from Ukraine Border","No Sign of Russian Withdrawal From Ukraine Border, Official Says",2.6
972,main-captions,MSRvid,2012,704,none,none,Someoen is cooking onions.,A man is swinging nunchucks.,0.0
4889,main-news,headlines,2014,672,none,none,Egypt set to lure Gulf investors,Egypt seeks to lure investors ...,3.4
1307,main-captions,images,2014,447,none,none,A orange and white cat asleep on a leather chair.,A orange and white cat laying on a blanket in a black leather chair.,4.0
796,main-captions,MSRvid,2012,444,none,none,A boy played a keyboard.,A person is playing a piano keyboard.,3.2
130,main-captions,MSRvid,2012,192,none,none,A man is climbing a rope.,A man climbs up a rope.,5.0
2674,main-news,MSRpar,2012,353,none,none,"Shares of San Diego-based Jack In The Box closed at $21.49, up 78 cents, or 3.8 percent, on the New York Stock Exchange.","Shares of Tampa-based Outback Steakhouse Inc. closed at $44.50, up $1.78, or 4.2 percent, on the New York Stock Exchange.",1.6
3456,main-news,deft-news,2014,6,none,none,fulvio berghella stated that the digital worm named sq hell was particularly virulent and replicated itself at the rate of 8000 times an hour.,fulvio berghella stated that the digital worm named sq hell has a very high capacity to replicate itself and the digital worm named sq hell is slowing down the poste italiane computer network and making some computers inoperable.,3.6
5505,main-news,headlines,2015,1390,none,none,Egypt's Muslim Brotherhood Refuses to Back Down,Egyptian court sentences Muslim Brotherhood leader to life in prison,1.4
2005,main-forum,deft-forum,2014,5,none,none,go figure You're asking me to prove a negative?,You're asking me to prove a negative?,4.6
4377,main-news,headlines,2014,33,none,none,23 killed in Iraq car bombings,10 killed in Iraq bomb attack,1.6
3003,main-news,MSRpar,2012,71,none,none,"Last year, he made an unsuccessful bid for the Democratic nomination for governor.","He ran last year for the Democratic nomination for Texas governor, but lost the primary to multimillionaire Tony Sanchez.",3.25
2494,main-news,MSRpar,2012,75,none,none,"Aspen Technology's shares dropped 74 cents, or 23 percent, to close at $2.48 on the Nasdaq.","In afternoon trading, Aspen's shares were off 89 cents or more than 27 percent at $2.33 per share.",2.2
3559,main-news,deft-news,2014,109,none,none,arms smugglers and drug cartels must be eliminated from southeast asia.,arms smugglers and drug cartels abet terrorists.,2.8
4452,main-news,headlines,2014,134,none,none,Google launches internet-beaming balloons,Google 'are playing international tax game',1.0
3239,main-news,MSRpar,2012,449,none,none,"Republicans had pledged to complete a Medicare drug package by August, then extended the deadline to Oct. 17, and they are still working on it.","Republicans had pledged to complete a Medicare drug package by August, then extended it to Oct. 17.",4.75
363,main-captions,MSRvid,2012,542,none,none,The little boy is singing and playing the guitar.,A baby is playing a guitar.,2.8
3193,main-news,MSRpar,2012,381,none,none,"When fully operational, the facility is expected to employ up to 1,000 people.","The plant would employ 1,000 people when fully built out, the company said.",4.0
2575,main-news,MSRpar,2012,209,none,none,Sendmail said the system can even be set up to permit business-only usage.,"The product can be instructed to permit business-only use, according to Sendmail.",5.0
1884,main-captions,images,2015,1177,none,none,Two girls with ponytails ride an amusement park ride.,A young girl is on a ride at an amusement park.,3.0
1688,main-captions,images,2015,561,none,none,A dog with big ears is holding a small stick in it's mouth.,A puppy with big ears chewing on a stick.,3.8
3805,main-news,headlines,2013,69,none,none,Middle East: Israel: Hamas Leader Convicted,Middle East: Iraq: 17 Prisoners Escape in Kirkuk,0.8
3120,main-news,MSRpar,2012,256,none,none,"The Standard & Poor's 500 index advanced 6.48, or 0.7 per cent, to 990.51.","The broader Standard & Poor's 500 Index .SPX rose 6.48 points, or 0.66 percent, to 990.51.",4.75
4188,main-news,headlines,2013,547,none,none,Not so Super Tuesday for Mitt Romney,Romney leads Santorum in GOP Super Tuesday contests,1.6
4946,main-news,headlines,2014,739,none,none,"Two Earthquakes Hit Northwest China, 11 Dead",Twin quakes kill 89 in China,2.4
4622,main-news,headlines,2014,339,none,none,Syria must destroy chemical weapons,Libya ‘destroys last chemical weapons’,2.4
2396,main-forum,deft-forum,2014,396,none,none,We are all vessels filled with many wonders.,Jingle Bell Rock by Bobby Helm We are all vessels filled with many wonders.,3.0
1124,main-captions,images,2014,174,none,none,A lamb stands near two tiny animals.,A sheep standing near her children.,1.4
3869,main-news,headlines,2013,150,none,none,Syria urges refugees to return,Syria's tenuous truce takes hold,1.0
2872,main-news,MSRpar,2012,644,none,none,The findings were published in the July 1 issue of the Annals of Internal Medicine.,The findings are being published today in the Annals of Internal Medicine.,3.8
3499,main-news,deft-news,2014,49,none,none,the osce meeting lasted two days.,the osce meeting was held in madrid.,1.8
5185,main-news,headlines,2015,582,none,none,G7 'to intensify Russia sanctions',Ukraine Fears Russian Invasion,0.6
2462,main-news,MSRpar,2012,23,none,none,"AAA spokesman Jerry Cheske said prices may have affected some plans, but cheap hotel deals mitigated the effect.","AAA spokesman Jerry Cheske said prices might have affected some plans, but cheap hotel deals made up for it.",5.0
4321,main-news,headlines,2013,717,none,none,Sachin Tendulkar is sworn in as Indian senator,MP Sachin Tendulkar says no to govt bungalow,1.6
1600,main-captions,images,2015,319,none,none,A girl holds up a yellow balloon animal.,A child holds a yellow balloon.,4.0
4122,main-news,headlines,2013,460,none,none,Attack on Nato base in Afghanistan kills 15,Aid workers freed in Afghanistan raid,1.0
2970,main-news,MSRpar,2012,27,none,none,Squyres is principal investigator for the Athena payload - a collection of science instruments carted by each rover.,"Steve Squyres, a Cornell University scientist, is principal investigator for the missions' science instruments.",4.2
3941,main-news,headlines,2013,237,none,none,French Socialist Party wins parliament victory,French Socialists win absolute parliament majority,3.8
350,main-captions,MSRvid,2012,522,none,none,Raccoons are eating.,A man is eating.,1.5
251,main-captions,MSRvid,2012,376,none,none,A girl is playing a flute.,A band is playing on a stage.,1.286
667,main-captions,MSRvid,2012,250,none,none,Someone is frying meat.,Someone is playing paino.,0.25
5304,main-news,headlines,2015,869,none,none,Ukraine hosts ‚Äėunity talks‚Äô,Pope hits out at ‚Äėwar to sell arms‚Äô in Syria,0.0
4189,main-news,headlines,2013,548,none,none,Putin sworn in as Russian growth falters,Putin sworn in as Russia's president for 6 years,2.4
2424,main-forum,deft-forum,2014,424,none,none,Bush gets zero credit for the budget under him.,"And, Obama gets zero credit for the budget under him.",1.8
5520,main-news,headlines,2015,1427,none,none,Venezuela expels three U.S. diplomats,Venezuela Expels 3 U.S. Diplomats,5.0
650,main-captions,MSRvid,2012,231,none,none,A monkey is brushing a bull dog.,A monkey brushes a dog.,4.2
2078,main-forum,deft-forum,2014,78,none,none,Jane wants me to ask the helpful party guest to pay for it.,I can't believe she is asking YOU to ask the helpful party guest for money!,2.2
3823,main-news,headlines,2013,93,none,none,Rebel fighters 'capture' Syrian soldiers,Free Syrian Army captures Syrian officers,3.2
2187,main-forum,deft-forum,2014,187,none,none,"That's not the Moloch scene, though.",This is the Moloch scene.,2.4
2616,main-news,MSRpar,2012,266,none,none,But the justices ruled that the police supervisor who repeatedly questioned Martinez did not violate his Fifth Amendment rights in doing so.,But the justices ruled that the police supervisor who repeatedly questioned Mr Martinez as he screamed in pain did not violate his Fifth Amendment rights.,3.75
2250,main-forum,deft-forum,2014,250,none,none,any woman that wants birth control can get it.,Any woman that wants and abortion can get one.,1.6
3026,main-news,MSRpar,2012,105,none,none,"After Freitas' opening statement, King County Superior Court Judge Charles Mertel recessed trial until after the Thanksgiving weekend.",King County Superior Court Judge Charles Mertel will then recess the trial until Monday.,3.0
4909,main-news,headlines,2014,697,none,none,"Five dead, 40 missing in Canada train disaster","8 dead, 11 missing in SW China landslide",0.6
612,main-captions,MSRvid,2012,171,none,none,A person is playing the keyboard.,A boy is playing a key-board.,4.0
1734,main-captions,images,2015,707,none,none,A dog has it's head inside a red and green gift bag.,A pet playfully investigates the contents of a gift bag.,3.8
2221,main-forum,deft-forum,2014,221,none,none,Has Annie ever used her sexuality like that?,One word: Zombies Has Annie ever used her sexuality like that?,3.8
4630,main-news,headlines,2014,349,none,none,Pistorius officer dropped from case,Pistorius officer on attempted murder charges,2.2
4653,main-news,headlines,2014,373,none,none,Guinea votes in long-delayed legislative poll,Equatoguineans vote in legislative polls,3.4
334,main-captions,MSRvid,2012,499,none,none,A woman is slicing octopus.,A man is playing the guitar.,0.0
1379,main-captions,images,2014,561,none,none,a close up of a small cactus in a pot.,a close up of a woman holding a white puppy.,0.8
4324,main-news,headlines,2013,721,none,none,Yahoo! to name Google's Mayer as CEO: report,Yahoo names Google exec Mayer as CEO,4.2
2776,main-news,MSRpar,2012,492,none,none,General Jeffrey said he would donate his military pension to charity for the period he was in office at Yarralumla.,Maj-Gen Jeffery said he would give his military pension to charity while he served at Yarralumla.,4.727
3209,main-news,MSRpar,2012,408,none,none,Forecasters said warnings might go up for Cuba later Thursday.,Watches or warnings could be issued for eastern Cuba later on Thursday.,4.0
534,main-captions,MSRvid,2012,61,none,none,A man is crying.,A man is screaming.,3.0
5182,main-news,headlines,2015,577,none,none,Uganda's president signs anti-gay bill,Uganda's president signs harsh anti-gay law,4.2
5029,main-news,headlines,2015,183,none,none,Easy Rider star Karen Black dies aged 74,Easy Rider Actress Karen Black Dies Of Cancer,4.2
4543,main-news,headlines,2014,241,none,none,"Delhi Gang Rape Suspect 'Beaten, Poisoned'",Delhi gang-rape verdict deferred again,1.8
1360,main-captions,images,2014,530,none,none,A black and white cow in a pen with hay.,A black and white cat lies in the dirt.,0.4
606,main-captions,MSRvid,2012,162,none,none,A man is shooting a gun.,A man is slicing a bun.,0.8
2853,main-news,MSRpar,2012,613,none,none,"Evacuation went smoothly, although passengers weren't told what was going on, Hunt said.","Passengers were evacuated smoothly, although they were not told what was going on, he said.",4.4
5368,main-news,headlines,2015,1029,none,none,Westgate mall attackers spent four months planning in Nairobi,"Westgate attackers spent four months planning in Nairobi, says official",4.6
5745,main-news,headlines,2016,1465,Europe Media Monitor (http://emm.newsbrief.eu),Europe Media Monitor (http://emm.newsbrief.eu),Dozens of Egyptians hostages taken by Libyan terrorists as revenge for airstrikes,Egyptian boat crash death toll rises as more bodies found in Nile,0.0
4617,main-news,headlines,2014,334,none,none,"Andy Murray deserves knighthood, David Cameron says",David Cameron: Andy Murray deserves a knighthood,5.0
3436,main-news,MSRpar,2012,731,none,none,"Benchmark Treasury 10-year notes gained 17/32, yielding 4.015 percent.","The benchmark 10-year note was recently down 17/32, to yield 4.067 percent.",2.75
4305,main-news,headlines,2013,695,none,none,"Civilian, defector killed in Syria, says NGO",Syria gunmen kill three Syrian officers: NGO,1.0
4991,main-news,headlines,2015,91,none,none,3 Suspects Taken Into Custody in Boston Bombing Case,Boston police say 3 taken into custody in Marathon bombing,4.8
1325,main-captions,images,2014,478,none,none,A large cruise ship in harbor with trees behind.,A cruise ship docked at a coast.,3.4
4541,main-news,headlines,2014,239,none,none,Gunmen Kill 11 Foreign Tourists in Pakistan,Gunmen kill 11 foreign climbers in Pakistan,4.0
3759,main-news,headlines,2013,9,none,none,"Sachin Tendulkar says I'm not God, I'm Sachin",Sachin Tendulkar scores cricket's first 100th century,0.8
4052,main-news,headlines,2013,374,none,none,Mandela released from hospital,Israeli president released from hospital,1.2
418,main-captions,MSRvid,2012,629,none,none,The woman is seasoning the oil.,A woman is pouring ingredients in a bowl.,1.4
297,main-captions,MSRvid,2012,443,none,none,A woman is cutting a cucumber.,A man is playing a guitar.,0.0
2527,main-news,MSRpar,2012,130,none,none,"""Cmdr. Rod Gibbons, an academy spokesman, said, """"The academy is shocked and saddened.""",Naval Academy spokesman Cmdr. Rod Gibbons said: ``Today's announcement came as a surprise.,3.25
1857,main-captions,images,2015,1098,none,none,Four kids holding hands jump into a swimming pool.,Four dogs playing in the snow.,0.0
488,main-captions,MSRvid,2012,744,none,none,Three children are eating their food.,The deer jumped over the fence.,0.0
3057,main-news,MSRpar,2012,150,none,none,Meningitis is an infection of the spinal cord fluid and the tissue around the brain.,Meningitis is an infection of the fluid in a person's spinal cord and around the brain.,4.6
5300,main-news,headlines,2015,860,none,none,Cleveland Kidnapper Ariel Castro Found Hanged in Prison Cell,Cleveland kidnapper Ariel Castro found hanging in his cell,5.0
3836,main-news,headlines,2013,109,none,none,4 killed in shrine bombing in northwest Pakistan,12 killed in U.S. drone strike in NW Pakistan,0.8
4306,main-news,headlines,2013,697,none,none,Taiwan rattled by strong earthquake,China rocked by twin earthquakes,1.2
5669,main-news,headlines,2016,947,Europe Media Monitor (http://emm.newsbrief.eu),Europe Media Monitor (http://emm.newsbrief.eu),Iran's parliament backs nuclear deal,Iran hardliners attack nuclear deal,1.0
1510,main-captions,images,2015,36,none,none,Man riding a bicycle down a narrow path.,A man riding a unicycle down a paved road,2.6
3787,main-news,headlines,2013,46,none,none,Abbas to lead Palestinian unity government,Abbas proposed as PM in interim unity government,4.0
4235,main-news,headlines,2013,606,none,none,U.N. to take up Syria resolution,UN Assembly to Vote on Syria Resolution,3.6
1465,main-captions,images,2014,696,none,none,Two cows standing in a large field.,The cow is grazing in a field.,2.8
557,main-captions,MSRvid,2012,93,none,none,A man is playing the guitar.,A man is playing the drums.,1.556
3662,main-news,deft-news,2014,212,none,none,russia ratified the amended version of the treaty.,russia ratified the amended treaty.,5.0
121,main-captions,MSRvid,2012,179,none,none,A man is playing a piano.,A man is playing a flute.,2.0
4700,main-news,headlines,2014,435,none,none,Islamists kill 21 in suicide attacks in Niger,Car bombs kill 20 in Turkish town near Syrian border,1.0
1194,main-captions,images,2014,289,none,none,a black and white photo of a cat lying down.,A black and white image of a cat laying on a rug.,4.2
3813,main-news,headlines,2013,80,none,none,Rimsha Masih released on bail,Mandela released from hospital,0.0
2131,main-forum,deft-forum,2014,131,none,none,"So, you actually believe every word of what Terral wrote?","GL, Terral Hi Corn: So, you actually believe every word of what Terral wrote?",4.2
3782,main-news,headlines,2013,40,none,none,Moscow protesters demand Vladimir Putin's resignation,Moscow protest against Vladimir Putin smaller and quieter,1.8
2254,main-forum,deft-forum,2014,254,none,none,I think you need to reread what I wrote.,You need to reread what I wrote.,5.0
501,main-captions,MSRvid,2012,23,none,none,A woman is cutting an onion.,A woman is cutting through an onion.,5.0
622,main-captions,MSRvid,2012,190,none,none,The man erased what the other man had on the board.,The man erased the work on the board.,3.0
198,main-captions,MSRvid,2012,292,none,none,A herd of deer are crossing the street.,A herd of caribou are crossing a road.,3.0
3011,main-news,MSRpar,2012,85,none,none,"Linda Saunders pleaded guilty in federal court to six charges, including extortion, money laundering and conspiracy.",Former Phipps aides Linda Saunders and Bobby McLamb have both pleaded guilty to federal charges including extortion.,2.75
5356,main-news,headlines,2015,993,none,none,Official of Malaysia Airlines briefs relatives of missing flight passengers about search progress,Malaysia Airlines investigating co-pilot on missing flight,1.0
946,main-captions,MSRvid,2012,665,none,none,An animal is walking.,A woman is applying eye makeup.,0.0
3887,main-news,headlines,2013,173,none,none,Boris Johnson re-elected London mayor,Johnson re-elected London mayor,3.8
1058,main-captions,images,2014,81,none,none,Group of horses grazing in grassy field.,A group of horses grazing in a field.,4.6
