Quality,#1 ID,#2 ID,#1 String,#2 String
0,1853205,1854204,"He really left us with a smile on his face and no last words , daughter Linda Hope said ."," He really left us with a smile on his face and no last words ... He gave us each a kiss and that was it ,  she said ."
0,898957,898897," We are confident that this issue will be behind us by mid-year ,  said Nestle spokesman Francois Perroud , who declined to comment further ."," We are confident that this issue will be behind us by midyear ,  said Nestlé spokesman Francois Perroud ."
0,453448,453574,"The 30-year bond US30YT = RR grew 1-3 / 32 for a yield of 4.30 percent , down from 4.35 percent late Wednesday .","At 11 a.m. ( 1500 GMT ) , the 10-year note US10YT = RR was up 11 / 32 for a yield of 3.36 percent from 3.40 percent Wednesday ."
1,2412871,2412758,"Other changes in the plan refine his original vision , Libeskind said .","Many of the changes are improvements to the original plan , Libeskind said ."
1,786554,786522,Mr. Grassley and Mr. Baucus rejected any disparity in drug benefits .,Grassley and Baucus said they had rejected that approach in their plan .
