Quality,#1 ID,#2 ID,#1 String,#2 String
1,1793282,1793115,Researchers found that people 65 and older who had fish once a week had a 60 % lower risk of Alzheimer 's than those who never or rarely ate fish .,"Older people who eat fish at least once a week could cut their risk of Alzheimer 's by more than half , a study suggests ."
1,1583419,1583736," We have found the smoking gun ,  investigating board member Scott Hubbard said ."," We have found the smoking gun ,  said Hubbard , director of NASA 's Ames Research Center in California ."
0,750991,751125,Chairman Michael Powell and FCC colleagues at the Wednesday hearing .,FCC chief Michael Powell presides over hearing Monday .
0,1853409,1854181,"""U.S. President George W. Bush said """" the nation lost a great citizen """" with Hope 's death ."""," The nation lost a great citizen ,  U.S. President George W. Bush said Monday ."
1,2895172,2895264,"Shadrin said Khodorkovsky 's aircraft was approached by officers identifying themselves as members of the FSB intelligence service , the domestic successor to the Soviet KGB .",Shadrin said Khodorkovsky 's aircraft was approached by officers identifying themselves as members of the FSB domestic intelligence service .
1,425412,425310,The survey that found it covered only a narrow slice of the sky .,The survey which uncovered the star only covered a narrow slice of the sky .
1,758278,758048,Congress twice before passed similar restrictions only to see President Bill Clinton veto them .,"Congress twice passed similar bills , but then-President Clinton vetoed them both times ."
1,1390306,1390412,"""It is a national concern that will touch virtually every American , """" Abraham said .""","""The impact of natural-gas shortages """" will touch virtually every American , """" Energy Secretary Spencer Abraham warned yesterday ."""
1,1909331,1909408," This deal makes good sense for both companies ,  said Brian L. Halla , National 's chairman , president and CEO ."," This deal makes sense for both companies ,  Halla said in a prepared statement ."
0,2634670,2634777,"It reports a mailing list of 50,000 and support from about 500 congregations and 50 bishops .",The group has the support of about 215 churches and an estimated 25 bishops .
1,861118,861396,Those searches have not found stockpiles of chemical and biological weapons or significant evidence of a nuclear weapons program .,"Alleged stockpiles of chemical and biological weapons have not turned up , nor has significant evidence of a nuclear-weapons program ."
0,820382,820723,Only 12 of the last 30 attempts to reach Mars have succeeded ( two are in transit ) .,"Of about 30 attempts to reach Mars , only 12 missions have succeeded ."
1,102054,101828,He faces 25 years in prison when he is sentenced in federal court July 7 .,He faces an additional 25 years in prison on the federal charges when he is sentenced July 7 .
1,2815885,2815848,Southwest said it had already inspected its fleet of 385 aircraft and found no additional suspicious items .,Southwest said it completed inspections of its entire fleet of 385 aircraft and found no additional items .
0,2678208,2678191,This Palm OS smart phone is the last product the company will release before it becomes a part of palmOne .,This was almost certainly its last full quarter before the company becomes a part of Palm .
1,2733221,2733357,"Joan B. Kroc , the billionaire widow of McDonald 's Corp. founder Ray Kroc , died Sunday after a brief bout with brain cancer .","Joan B. Kroc , the billionaire widow of McDonald 's founder Ray Kroc known for her philanthropy , died Sunday of brain cancer ."
1,3261229,3261252,"The arrests came two days after Ken Livingstone , the London Mayor , claimed police and security services had foiled four terrorist attacks on the capital .",London Mayor Ken Livingstone announced over the weekend that police and security services had foiled four terrorist attacks on the capital .
0,2082785,2082239,"Ottawa police reported 23 cases of looting , along with two deaths possibly attributed to the outage - a pedestrian hit by a car and a fire victim .","In Canada 's capital of Ottawa , police reported two deaths possibly linked to the power outage — a pedestrian hit by a car and a fire victim ."
1,1801777,1801802,"The charges came after the federal government prohibited the sheik from speaking with the media and imposed special measures restricting his access to mail , the telephone and visitors .","The charges came after the federal government imposed special administrative measures restricting the sheik 's access to mail , the telephone and visitors and prohibiting him from speaking with the media ."
1,3209548,3209513,""" Here 's what happened : I go to their Web site and start complaining to them , would you please , please , please stop bothering me ,  he said . """""""," I go to their website and start complaining to them , would you please , please , please stop bothering me ,  Mr. Booher told a reporter ."
1,66486,66500,He took batting practice on the field for the second time Tuesday since his opening-day injury .,"Jeter , who dislocated his left shoulder in a collision March 31 , took batting practice on the field for the first time Monday ."
1,3253370,3253092,"State wildlife officials have concluded that the fluorescent zebra fish from Florida poses no danger , and they have recommended that the state exempt it from the ban .","State wildlife officials have concluded that the Florida-grown fluorescent zebra fish poses no danger , and they have recommended that it be exempted from the state 's ban ."
1,1123031,1122968,"In Nigeria alone , the report said , as many as 1 million women may be living with the condition .","In Nigeria alone , the report estimated that between 100,000 and 1 million girls and women are suffering from the condition ."
1,1499177,1499012,"About two decades ago , U.S. District Court Judge Walter Rice and others decided to protect and polish what remained .","Then , about two decades ago , U.S. District Court Judge Walter Rice , the Aviation Trail group and others made a decision to protect and polish what remained ."
1,3335514,3335455,"AN inquest into the car crash that killed Princess Diana will be held January 6 , the royal family 's coroner announced overnight .","Inquests into the deaths of Diana , Princess of Wales and Dodi Fayed will be formally opened in the New Year , the Royal Family 's coroner announced yesterday ."
0,1066386,1066809,"Blair has said there is not ' ' a shred of truth ' ' in allegations the government manipulated evidence , and has resisted calls for a full public inquiry .",Blair has said there is not ``a shred of truth ' ' in allegations that the government manipulated evidence about Iraq 's weapons programs .
1,1671677,1671691,"""Furthermore , with the target fed funds rate at 1 percent , """" substantial further conventional easings could be implemented if the FOMC judged such policy actions warranted . """""""," Furthermore , with the target funds rate at 1 per cent , substantial further conventional easings could be implemented if the FOMC judged such policy actions warranted ,  he said ."
1,1389351,1389586,"A U.S. Court of Appeals Thursday ruled that Microsoft ( Quote , Company Info ) does not have to carry the Java programming language in its Windows operating system .",A federal appeals court on Thursday overturned a judge 's order that would have forced Microsoft to include competitor Sun Microsystems ' Java software in its Windows operating system .
1,61559,61668,Treasurys long-range plan is to provide retail buyers of all Treasury securities the ability to manage their holdings online in a single account .,The Treasury said wants to give retail buyers of all Treasury securities the ability eventually to manage holdings online in a single account .
0,3171466,3171578," The flu season has had an earlier onset than we 've seen in many years ,  said Julie Gerberding , director of the Centers for Disease Control and Prevention in Atlanta .","""We 're seeing some very high levels of widespread flu infections in some places , """" said Dr. Julie Gerberding , director of the federal Centers for Disease Control and Prevention ."""
1,1620264,1620507," At this point , Mr. Brando announced : ' Somebody ought to put a bullet '  through her head , the motion continued .","""Brando said that """" somebody ought to put a bullet """" through her head , according to the defense ."""
1,2226559,2226541,"The high Saturday is expected to be about 92 degrees , and it will likely drop to 90 degrees Sunday and Monday .",The high today will be about 92 degrees and will drop to 90 degrees Sunday and Monday .
0,222569,222647,"Shares of Berkeley , California-based Xoma dropped $ 1.49 or 27 percent , to $ 4 in Instinet trading .","Shares in Berkeley-based Xoma lost 77 cents , or 14 percent , to close at $ 4.72 each in trading on the Nasdaq Stock Market ."
1,735679,735698,"""The industry is working with the FDA """" to get firm answers and not just speculation , """" he told Reuters Health .""","""Companies are working with the FDA and academics """" to try and get some firm answers and not just speculation , """" Jarman said ."""
1,2934300,2934243,"Last week , the executive committee of the Board of Trustees issued a no-confidence vote in Goldin .",But last week the executive committee of the board of trustees gave him a vote of no confidence .
1,2250594,2250465,Who will succeed Mr. O 'Neill at Hyundai is not clear .,There is no clear successor for Mr. O 'Neill at Hyundai .
1,2240263,2240744,But labor leaders said it was often difficult for these Americans to join a union because many employers fought organizing efforts .,But labor leaders say it is often hard for these people to join a union because many employers aggressively fight organizing efforts .
1,986931,986600,"""The draft statement said progress on the nuclear issue and the pending trade deal were """" interdependent , indissociable and mutually reinforcing elements """" .""","""They said progress towards resolving the nuclear issue and progress in the trade talks were """" interdependent , essential and mutually reinforcing elements of EU-Iran relations """" ."""
0,1091577,1091178,"Further out the curve , the benchmark 10-year note US10YT = RR shed 25 / 32 in price , taking its yield to 3.26 percent from 3.17 percent .","Early Wednesday , the benchmark 10-year US10YT = RR had lost 16 / 32 in price , driving its yield up to 3.33 percent from 3.26 percent late Tuesday ."
1,701798,701818,"AMC has since asked the experienced Fluor company of the US to produce a detailed costing of the project , but the report is still two weeks away .",AustMag has since asked the experienced US company Fluor to produce a detailed costing of the project but the report is still two weeks away .
1,2281720,2281824,"PC-related products were the strongest sellers , with microprocessors up 5.6 percent and DRAMs up 8.2 percent , the SIA said .","In July , PC-related products were the strongest sector with microprocessors up 5.6 per cent and DRAMs up 8.2 per cent over June ."
0,3060432,3060469,A beauty contest to be held in Italy next week may be the first for pixel-perfect pin-ups .,A new beauty contest kicking off in Italy next week will give pixel-perfect pin-ups the chance to steal sultry Sophia 's sex-symbol status .
0,785613,785760," I started crying and yelling at him , ' What do you mean , what are you saying , why did you lie to me ? ' ","Gulping for air , I started crying and yelling at him , ' What do you mean ?"
1,1355591,1355674," This sale is part of our efforts to simplify our Foodservice Products business and improve its cost structure ,  Multifoods chairman and chief executive officer Gary Costley said ."," This sale is part of our efforts to simplify our Foodservice Products business and improve its cost structure ,  chairman and CEO Gary Costley said in a statement ."
1,2949057,2949004,Mr. Bush has credited the Dallas pastor with helping to inspire the idea of using federal dollars to fund faith-based programs .,He has credited Dr. Evans with helping to inspire the idea of federal financing for faith-based programs .
1,3419191,3419297,"General Huweirini , who has worked closely with the US , was wounded in the shooting on December 4 , US officials said .","Huweirini , who has worked closely with U.S. officials , was wounded in an attack Dec. 4 , the U.S. officials said ."
0,1591358,1591381,Hoy confirmed the woman 's age Tuesday and said she has left on vacation with her family .,"Hoy confirmed the woman 's age Tuesday and said she was on vacation with her family , but is expected to return this week ."
1,1041293,1041421,The company has said it plans to restate its earnings for 2000 through 2002 .,"The company had announced in January that it would have to restate earnings for 2002 , 2001 and perhaps 2000 ."
1,2716850,2716882,"It will be the first handset to ship with the Smartphone 2003 version of Microsoft 's ( Nasdaq : MSFT ) Windows Mobile software , the mobile operator said .","According to the company , it will be the first handset to ship with the Smartphone 2003 version of Microsoft 's ( Nasdaq : MSFT ) Windows Mobile software ."
1,2467980,2467938,"Massachusetts is one of 12 states that does not have the death penalty , having abolished capital punishment in 1984 .","Massachusetts is one of 12 states without the death penalty , having abolished it in 1984 ."
0,2580240,2579902,""" And if there is a leak out of my administration ,  he added , """" I want to know who it is .""","""He added , """" There 's just too many leaks in Washington , and if there is a leak out of my administration , I want to know who it is ."""
0,1810937,1810983,Dotson was taken to Chester River Hospital Center where he stayed overnight .,Dotson was taken to an area hospital for a psychiatric evaluation .
0,1765897,1765755,"Violence persisted , with a U.S. soldier killed early Saturday while guarding a bank in west Baghdad .","A U.S. soldier was killed in the early hours Saturday while guarding a bank in west Baghdad , and another American serviceman died Friday ."
1,1013480,1013210,We think they have the right to choose .," We think PeopleSoft customers deserve the right to choose ,  Ellison said ."
1,578807,578726,"Teenagers at high schools where condoms were available were no more likely to have sex than other teens , a study published Wednesday finds .","Teen-agers at high schools where condoms are available are no more likely to have sex than other teens , a study says ."
0,3009814,3009757,"Bo Hitchcock , Levin 's attorney , declined to comment Friday .","Hitchcock has declined to comment on the case , as has Levin ."
1,2173504,2173632,"""In a statement , the company said both bids would allow Vivendi to """" maintain a substantial minority interest in a U.S. media corporation with excellent growth potential . """"""","""It also added that both proposals would allow Vivendi Uni to maintain """" a substantial minority interest in a U.S. media corporation with excellent growth potential . """""""
1,775197,775031,"Investigators were searching his home in Muenster in the presence of his wife when news of his death came , prosecutor Wolfgang Schweer told The Associated Press .",A prosecutor said investigators were searching his home in Muenster in the presence of his wife when news of his death arrived .
1,532719,532702,"Quattrone , 47 , was highly influential at Credit Suisse First Boston during the tech bubble .","Quattrone , 47 , was highly influential working in the Palo Alto office of Credit Suisse First Boston during the tech bubble ."
1,3453247,3452798,GBI spokesman John Bankhead said the murder scenes showed that the killer was very methodical .,"""Georgia Bureau of Investigation spokesman John Bankhead said the crime scenes indicated that the killer was """" very methodical . """""""
1,1257820,1257777,"Tyco later said the loan had not been forgiven , and Swartz repaid it in full , with interest , according to his lawyer , Charles Stillman .","Tyco has said the loan was not forgiven , but that Swartz fully repaid it with interest , according to his lawyer , Charles Stillman ."
1,2222013,2222000,"In other words , Cablevision is obligated to pay for YES Network 's lawsuit against Time Warner Cable .","Ironically , Cablevision will be footing the bill for YES ' lawsuit against Time Warner Cable ."
1,1499006,1499172,"A grassy field and asphalt island , topped with an ATM , sit where Orville Wright once developed a split airplane wing , tinkered with cars and even built toys .","Orville Wright 's laboratory was once there - where he developed a split airplane wing , tinkered with cars and even built toys ."
1,1759675,1759745," The investigation appears to be focused on certain accounting practices common to the interactive entertainment industry , with specific emphasis on revenue recognition ,  Activision said in an SEC filing .","""According to the company filings , the investigation """" appears to be focused on certain accounting practices common to the interactive entertainment industry , with specific emphasis on revenue recognition . """""""
1,2209112,2209391,"The league said it is not taking a position on whether Governor Gray Davis should be recalled in the Oct. 7 voting , and will not endorse a replacement candidate .",The group said it is not taking a position on whether Davis should be recalled and will not endorse a replacement candidate .
0,845113,845201,"Foreigners board helicopters for evacuation from the European Union compound in Monrovia , Liberia , on Monday .","French troops defend a group of foreigners as they board helicopters for evacuation from the European Union compound in Monrovia , Liberia ."
1,3053580,3053552,"On Wednesday , the total of National Guard and Reserve members called to active duty worldwide stood at 154,603 .","As of yesterday , the total number of National Guard and Reserve troops called to duty worldwide stood at 154,603 ."
1,1480802,1481397,"Car volume fell 8 per cent , while light truck sales -- which include vans , pickups and SUVs -- rose 2.7 per cent .","Car volume was down 8 percent , while light truck sales--which include vans , pickups and SUVs--rose 2.7 percent ."
0,462816,462552,"Earlier Friday , Taiwan reported 55 new cases but no new deaths .","Yesterday , Taiwan reported 65 new cases , its biggest one-day increase yet ."
0,2180623,2180775,Staff writer Dave Michaels contributed to this report .,Staff writers Frank Trejo and Robert Ingrassia contributed to this report .
1,2949437,2949407,"The report was found Oct. 23 , tucked inside an old three-ring binder not related to the investigation .",The report was found last week tucked inside a training manual that belonged to Hicks .
1,728030,727944,"""Cmdr. Rod Gibbons , an academy spokesman , said , """" The academy is shocked and saddened .""",Naval Academy spokesman Cmdr. Rod Gibbons said : ``Today 's announcement came as a surprise .
1,2515695,2515725,His harsh criticism of PLO chairman Yasser Arafat led to his books being banned for a time by the Palestinian Authority .,"His harsh criticism of the PLO 's chairman , Yasser Arafat , saw the Palestinian Authority ban his books for a time ."
0,3075284,3075402,"""Gore said while the Patriot Act made some needed changes , it has """" turned out to be , on balance , a terrible mistake . """""""," Nevertheless , I believe the Patriot Act has turned out to be , on balance , a terrible mistake . "
1,1396810,1396798,"""The answer , the group said , would be to """" create a format that can be used by all devices but can accommodate other formats . """"""",The DHWG says it will instead create a format that can be used by all devices but can accommodate other formats .
1,2521519,2521624,"""This deterioration of security compounds when nearly all computers rely on a single operating system subject to the same vulnerabilities the world over , """" Geer added .""", The deterioration of security compounds when nearly all computers rely on a single operating system subject to the same vulnerabilities the world over . 
0,195800,196144,""" If it ain 't broke , don 't fix it ,  said Senate Minority Leader Tom Daschle , D-S.D. """" I don 't see much broken . """""""," If it ain 't broke , don 't fix it ,  said Senate Minority Leader Tom Daschle , a South Dakota Democrat ."
1,2225652,2225503,"The other 18 people in the building , including Harrison 's ex-girlfriend , were not injured , police spokesman Don Aaron said .","The other 18 people inside the building - two visitors and 16 employees , including Harrison 's ex-girlfriend - escaped unharmed , Aaron said ."
0,1087794,1087906,"Shares of EDS gained $ 1.49 , or 6.6 percent , to $ 23.999 early Wednesday on the New York Stock Exchange .","Shares were off 30 cents , or 1.3 percent , at $ 22.58 on Tuesday on the New York Stock Exchange ."
1,3137979,3137950,"SARS , the deadly respiratory disease first detected in China last November , gave the agency its first real test of a new state-of-the-art emergency operations center .","And SARS , the deadly respiratory disease first detected in China last November , tested the agency 's new state-of-the-art emergency operations center ."
1,262374,262921,"His plan would cost more than $ 200 billion annually , which Gephardt would pay for by repealing Bush 's tax cuts .",His plan would cost over $ 200 billion annually and be paid for by repealing Bush 's tax cuts .
0,1674994,1675024,AMD will own a 60 percent interest in the new company and Fujitsu owns 40 percent .,"Fujitsu will own 40 percent of the company , which will be headquartered in Sunnyvale , Calif ."
1,2331916,2331805,"Ruffner , 45 , doesn 't yet have an attorney in the murder charge , authorities said .","Ruffner , 45 , does not have a lawyer on the murder charge , authorities said ."
0,2365740,2365690,"Senate President Pro Tempore Robert D. Garton , R-Columbus , said he spoke with Kernan not long before the oath of office ceremony .","Senate President Pro Tempore Robert D. Garton , R-Columbus , said he 'll miss the governor 's civility most ."
1,1272006,1271919,"Taylor 's aides warn an abrupt departure could trigger more chaos , a view shared by many in Liberia and , in private , even by mediators .","His aides warn an abrupt departure could trigger more bloodshed , a view shared by many in Liberia ."
1,3416800,3416661,Gov. Don Carcieri said the ruling shows that state taxation laws apply on the tribe 's sales activities .,Gov. Don Carcieri said the ruling shows that state taxation laws apply to any tribal activity .
0,2646742,2646642,He has a preliminary hearing Thursday to determine whether he 'll stand trial .,The question is whether there will be a hearing to determine if Bryant will stand trial .
0,1181157,1180896,"The technology-laced Nasdaq Composite Index .IXIC gave up 3.88 points , or 0.24 percent , to 1,644.76 .","The broader Standard & Poor 's 500 Index < .SPX > added 0.99 points , or 0.1 percent , at 995.69 ."
0,138066,137972, But I do question the motives of a deskbound president who assumes the garb of a warrior for the purposes of a speech . ,"""Byrd , speaking from the Senate floor , said he questioned """" the motives of a deskbound president who assumes the garb of a warrior for purposes of a speech . """""""
0,222621,222514,"Shares of Genentech , a much larger company with several products on the market , rose more than 2 percent .","Shares of Xoma fell 16 percent in early trade , while shares of Genentech , a much larger company with several products on the market , were up 2 percent ."
1,1628068,1628145,"Gilroy police and FBI agents described Gehring as cooperative , but said Saturday that he had revealed nothing about what had happened to the children .","Saturday , officials in California described Gehring as cooperative — but said he has revealed nothing about what has happened to the children ."
1,1167820,1168134,His opinion contradicts one issued in 1992 by then-Attorney General Bob Stephan .,Kline 's legal opinion differs from the interpretation issued by former Attorney General Bob Stephan in 1992 .
0,490219,490021,"The city index outperformed the Dow Jones industrial average , which fell 0.9 percent for the week .","The blue-chip Dow Jones industrial average .DJI tacked on 97 points , or 1.14 percent , to 8,699 ."
1,2898540,2898554,A postal distribution center where four anthrax-laced letters passed through two years ago was fumigated with chlorine dioxide gas as crews wound up the decontamination process this weekend .,Workers cleaning up a postal distribution center where four letters laced with anthrax had passed through two years ago planned to complete the fumigation operation early Sunday .
0,3107641,3107862,"Nursing schools turned away more than 5,000 qualified applicants in the past year because of shortages of faculty and classroom space .","The American Association of Nursing Colleges reported that schools turned away more than 5,000 qualified applicants last year ."
0,786531,786685,"From that point until costs reached $ 5,300 , the individual would pay 100 percent of the bill .","Above that , Medicare would pay 90 percent of all drug costs ."
1,2529776,2529858,He said the district had been waiting for the subpoenas and had always planned to comply once it received them .,Mr. Caramore said the district waited for the subpoenas and planned to cooperate with the investigation .
1,356759,356778,"""The Interior Minister , Al Mustapha Sahel , said the investigation """" points to a group that has been arrested recently """" , an apparent reference to Djihad Salafist .""","""Moroccan Interior Minister Al Mustapha Sahel told state-run 2M television late Saturday the investigation """" points to a group that has been arrested recently """" an apparent reference to Salafist Jihad ."""
