Quality,#1 ID,#2 ID,#1 String,#2 String
0,556143,556050," That obligation to pay rent continues unabated notwithstanding the heinous attacks of Sept . 11 and the destruction of 1 World Trade Center ,  the suit says ."," That obligation to pay rent continues unabated notwithstanding the heinous attacks of 11 September ,  the suit says ."
1,3372296,3372332,"For the full 12-month period ending June 30 , advanced services lines of all technology types increased by 56 percent .","For the full year period ending June 30 , 2003 , high-speed lines increased by 45 percent ."
1,2869052,2869113,The discovery was published yesterday in the New England Journal of Medicine .,They appear in the Oct. 23 issue of The New England Journal of Medicine .
1,1808482,1808598,And two key shuttle program leaders were out of town during the flight .,The newspaper also reported that two key leaders were out of town during part of Columbia 's flight .
1,1478919,1478601,"""The U.S. government and private technology experts warned Wednesday that hackers plan to attack thousands of Web sites Sunday in a loosely co-ordinated """" contest """" that could disrupt Internet traffic .""","""THE US government and private technology experts have warned that hackers plan to attack thousands of websites on Sunday in a loosely co-ordinated """" contest """" that could disrupt Internet traffic ."""
1,3113886,3113811,"But while Microsoft 's share of the low-end server software market has increased since the EU 's investigation started five years ago , the firm has denied anti-competitive practices are to blame .","Microsoft 's share of the low-end server software market has increased since the probe started five years ago , but the firm denied anti-competitive practices were the reason for this ."
0,849568,849504,"The identical rovers will act as robotic geologists , searching for evidence of past water .","The rovers act as robotic geologists , moving on six wheels ."
0,487684,487726,The euro tagged another record high against the dollar on Tuesday as demand for higher-yielding euro-based assets overshadowed solid U.S. economic data .,The euro ros further into record territory on Tuesday as demand for higher-yielding euro-based assets overshadowed U.S. economic data showing rising consumer confidence and a strong housing market .
1,2183969,2183948,"""While JI has undoubted links with al-Qaeda , the relationship """" may be less one of subservience ... than of mutual advantage and reciprocal assistance """" .""","""While JI has undoubted links with the terrorist group al-Qaeda , the report says the relationship """" may be less one of subservience . . . than of mutual advantage and reciprocal assistance """" ."""
1,833170,833200,"Doris Brasher , who owns a grocery store near the police station , said many in the close-knit town knew the men who were killed .","Doris Brasher , who owns a grocery store on Highway 96 , said many in the close-knit town knew the three men who were killed ."
0,2108705,2108831,Yucaipa owned Dominick 's before selling the chain to Safeway in 1998 for $ 2.5 billion .,Yucaipa bought Dominick 's in 1995 for $ 693 million and sold it to Safeway for $ 1.8 billion in 1998 .
1,3344358,3344339,Penn Traffic filed for Chapter 11 reorganization at the end of May .,Penn Traffic entered chapter 11 bankruptcy reorganization May 30 .
0,2932499,2932655,"The Pentagon , saying that Boykin requested it , is investigating his remarks .",The Pentagon has begun an official investigation into Boykin 's remarks .
1,3294368,3294400,Among the proposals is one for Zimbabwe to have the opportunity to rejoin the 54-member body before the next CHOGM meeting in two years .,Among the proposals being considered is for Zimbabwe to have the opportunity to rejoin the 54-member body before the next Commonwealth Heads of Government meeting in two years .
0,1687491,1687417,"Sen. Bob Graham , Florida Democrat , raised $ 2 million after getting a late start .","Further back , Sen. Bob Graham of Florida reported about $ 1.7 million on hand ."
1,2494381,2494531,The FTC also asked the judge to suspend his ruling pending its appeal .,The FTC asked the court Wednesday to block the ruling and filed for an appeal .
0,472952,472535,"But Mitsubishi Tokyo Financial ( JP : 8306 : news , chart , profile ) declined 3,000 yen , or 0.65 percent , to 456,000 yen .","Sumitomo Mitsui Financial ( JP : 8316 : news , chart , profile ) was down 2.5 percent at 198,000 yen ."
0,3093463,3093383,"Fifty-seven percent were Hispanic , 10 % were Asian , 7 % were Black , 16 % were Caucasian , and 10 % were of other ethnicity .","Haskell said 57 percent were Hispanic , 10 percent Asian , 7 percent black and 16 percent white ."
1,1550874,1550974,"There were no plans to build permanent US bases in Africa , Pentagon officials said .","There are no plans to build permanent U.S. bases in Africa , Defense Department officials say ."
1,3171851,3171879,"""The answer is clearly yes , """" said Dr. Larry Norton , deputy physician-in- chief for breast cancer programs at Memorial Sloan-Kettering Cancer Center .""","""The answer is clearly yes , """" said Dr. Larry Norton , deputy physician-in-chief for breast-cancer programs at Memorial Sloan-Kettering Cancer Center in New York City ."""
1,163189,163240,"A total of 17 cases have been confirmed in the southern city of Basra , the Organization said .",A total of 17 confirmed cases of cholera were reported yesterday by the World Health Organisation in the southern Iraqi city of Basra .
1,2694821,2694682," You know I have always tried to be honest with you and open about my life ,  Limbaugh , 52 , said during a stunning admission aired nationwide ."," You know I have always tried to be honest with you and open about my life ,  Limbaugh said Friday on his program ."
0,205145,204942,"Miodrag Zivkovic , of the Liberal Alliance of Montenegro , won 31 percent of the vote while the independent Dragan Hajdukovic got four percent .","Miodrag Zivkovic , the leader of the pro-independence opposition Liberal Alliance , came in second with 31 percent of the vote ."
1,1474104,1474149,"One of the company 's employees was hospitalized in critical condition at Lee Memorial Hospital in Fort Myers , said hospital administrative assistant Alex Reichert .",One of the employees who survived the blast and fire was hospitalized in critical condition in Fort Myers .
0,2373715,2373669,"Water management officials in Florida were worried about some of the already-swollen rivers and lakes , because a direct hit from a hurricane could cause severe flooding .",Water management officials in Florida were worried about the storm 's possible effect on some of their already-swollen rivers and lakes .
1,2277401,2277378,"Last year , Cuban officials said none of nearly two dozen nominated Cuban musicians received U.S. visas on time to attend the Grammys in Los Angeles .",Cuban officials said that last year none of about two dozen nominated Cuban musicians received U.S. visas in time to attend the Latin Grammys .
1,3187846,3187778,Its keywords are supported by Chinese language Web portals .,"Chinese language Web portals also support 3721 keywords , the Web site said ."
0,1077014,1077138,"""Glover said the killer used a """" peculiar slipknot """" on the ligature he used to strangle some of the victims .""","Glover said the killer used a ``peculiar slipknot , ' ' including a coaxial cable and an extension cord , to strangle some of the victims ."
1,3254507,3254576,U.S. same-store sales last months at Tim Hortons rose 8.8 per cent .,Tim Hortons ' same-store sales in Canada rose by 6.7 per cent .
1,702468,702500," Dan brings to Coca-Cola enormous experience in managing some of the world 's largest and most familiar brands ,  Heyer said in a statement .","""In a statement , Heyer said , """" Dan brings to Coca-Cola enormous experience in managing some of the world 's largest and most familiar brands ."""
1,2343284,2343320,"""The ISM noted that """" with the exception of March 2003 , growth in business activity has been reported by ISM members every month beginning with February 2002 . """""""," With the exception of March 2003 , growth in business activity has been reported by ISM members every month beginning with February 2002 ,  the Arizona-based group said ."
1,1023571,1023460,"Peck died peacefully at his Los Angeles home early Thursday with his wife of 48 years , Veronique , by his side .","Peck , who was 87 , died peacefully at his Los Angeles home last Thursday with his French-born wife of 48 years , Veronique , at his side ."
1,1284150,1284173,"The new Finder puts a user 's folders , hard drive , network servers , iDisk and removable media in one location , providing one-click access .","Panther 's redesigned Finder navigation tool puts a user 's favourite folders , hard drive , network servers , iDisk and removable media in one location ."
1,2377287,2377246," Spring has arrived in Estonia -- we 're back in Europe ,  Prime Minister Juhan Parts told a news conference on Sunday ."," Spring has arrived in Estonia - we 're back in Europe ,  Juhan Parts , prime minister , told a news conference last night ."
1,3189862,3189927,"Had the creditors turned down the bailout plan , LG Group might have been forced to close down its credit card business .","If the creditors turn down the bailout plan , LG Group may have to closedown its card business ."
0,1990238,1990281,"About 1,417 schools statewide receive Title I money .",That applies only to schools that get federal Title I money .
1,2461332,2461355," Everyone who has a cell phone wishes they had a better one ,  Huang said .","""They have a cell phone and everybody that has a cell phone wishes they had a better one . """""""
1,907751,907588,The Nets and the Spurs are crossing new frontiers of offensive ineptitude while causing their high-scoring American Basketball Association forefathers to cringe .,The Nets and the San Antonio Spurs are crossing new frontiers of offensive ineptitude while embarrassing their high-scoring ABA forefathers .
1,1786751,1786721,The settlement includes $ 4.1 million in attorneys ' fees and expenses .,Plaintiffs ' attorneys would get $ 4.1 million of the settlement .
1,2481604,2481631,"Calvin Hollins Jr . ' s attorney , Thomas Royce , has repeatedly said his client had no link with the company that owned and operated E2 .","The lawyer for Hollins Jr . , Thomas Royce , has said his client had no link to the company that owned and operated E2 ."
1,2204002,2204069," This is , I think , a very seminal moment in our agency 's history ,  Mr O 'Keefe said ."," I think we are at a seminal moment in the history of this agency ,  he said ."
1,579975,579810,The DVD-CCA then appealed to the state Supreme Court .,The DVD CCA appealed that decision to the U.S. Supreme Court .
0,3010408,3010442,Gillespie sent a letter to CBS President Leslie Moonves asking for a historical review or a disclaimer .,Republican National Committee Chairman Ed Gillespie issued a letter Friday to CBS Television President Leslie Moonves .
1,421009,421091,"State media said there were at least 770 dead and over 5,600 injured .","The latest toll given by officials to state media was 643 dead and over 4,600 injured ."
1,3118767,3118719,"""Daughter Renee Jackson said she often made """" huge pots of , like , beans and rice with , like , meat and casseroles """" for the whole family .""","Their biological daughter Renee Jackson , 29 , said she made huge pots of beans and rice , and meat and casseroles ."
1,1982137,1982082,"Hormone replacement therapy that combines estrogen and progestin doubles a woman 's risk of breast cancer , a British study of more than a million women has found .","A major British study has added to the evidence that hormone replacement therapy increases the risk of breast cancer , especially when women receive a combination of estrogen and progestin ."
1,3088719,3088344,"Jacob has pushed consolidation for years , but he has said many communities , especially rural ones , have opposed it .","Jacob has pushed consolidation for years but said it has been opposed by many communities , especially rural ones ."
1,2270117,2270197,A judge ordered the child placed in state custody Aug. 8 .,"On Aug. 8 , Juvenile Court Judge Robert Yeates ordered that Parker be placed in protective custody ."
0,3386414,3386441,"In Lytle Creek Canyon , a 4-foot-high mud flow crossed a road , trapping a car .","In Lytle Creek Canyon , the rain caused several mudslides , including a 4-foot-high flow across a road that trapped a car ."
1,2726643,2726697,British-born astronaut Michael Foale is about to fly into space to take up his post as commander of the International Space Station .,British-born astronaut Michael Foale is on his way to take command of the international space station .
1,1862940,1862654,"The Association of South East Asian Nations groups Brunei , Cambodia , Indonesia , Laos , Malaysia , Myanmar , the Philippines , Singapore , Thailand , and Vietnam .","ASEAN comprises Brunei , Cambodia , Indonesia , Laos , Malaysia , Myanmar , the Philippines , Singapore , Thailand and Vietnam ."
0,363199,362925,"Investors were askingwhether other banks , some of which are still being audited , could be dealt with in the same way .","Other Japanese banks , some of which are still being audited , could face similar scrutiny ."
0,283606,283689,"The staged scene , covering several acres , featured smashed cars and buses , ruined buildings , scattered debris and spot fires .","Smashed cars and buses , ruined buildings , scattered debris and spot fires added to the realism ."
1,397102,397138,"""At last week 's meeting with U.S. President George W. Bush , Roh said inter-Korean exchanges would be """" conducted in light of developments on the North Korean nuclear issue . """"""","""The two leaders said inter-Korean exchanges would be """" conducted in light of developments on the North Korean nuclear issue """" ."""
0,633766,633873,"The Dow Jones industrial average < .DJI > rose 98.74 points , or 1.12 percent , to 8,949.00 .","The city index outperformed the Dow Jones industrial average , which rose 2.9 percent during the four-day trading week ."
0,1467048,1466992,"""The 2000 Democratic platform supported """" the full inclusion of gay and lesbian families in the life of the nation . """"""","""The Democrat 's 2000 platform didn 't explicitly support gay marriages but backed """" the full inclusion of gay and lesbian families into the life of the nation . """""""
1,69689,69610,"During the fiscal second quarter , Cisco earned $ 991 million , or 14 cents a share , on sales of $ 4.7 billion .","Cisco reported earnings of $ 987 million , or 14 cents a share , on revenue of $ 4.62 billion for the quarter ending in April ."
0,822527,822661,"""The street-racing sequel """" 2 Fast 2 Furious """" won the pole position at the box office , taking in an estimated $ 52.1 million in its opening weekend .""","""The PG-13 sequel """" 2 Fast 2 Furious """" raked in an estimated $ 52.1 million during its opening weekend , jumping over last weekend 's catch , """" Finding Nemo . """""""
0,130006,130268,"Some 175 million shares traded on the Big Board , a 7 percent increase from the same time a week ago .","Some 1.6 billion shares traded on the Big Board , a 17 percent increase over the three-month daily average ."
1,3182444,3182413,The United States and Britain are seeking backing at the United Nations for their agenda to hand over power to Iraqis .,"At the United Nations , the United States and Britain are seeking backing for their agenda to hand over power to Iraqis ."
0,342112,342381,"The Modesto Bee and NBC were notified their calls had been intercepted , Goold said .",Journalists were not the only people notified that their phone calls had been intercepted .
0,1528413,1528275,"Sunnis make up 77 percent of Pakistan 's population , Shiites 20 percent .",About 80 percent of Pakistan 's 140 million people are Sunnis .
0,2141865,2141906,A federal judge ruled that the monument violated the law and ordered it removed .,The federal courts have ruled that the monument violates the constitutional ban against state-established religion .
1,403034,402965,Two Atlanta companies that have not been accused of wrongdoing -- Delta Air Lines Inc. and the Home Depot -- were mentioned as having excessive pay packages for its CEOs .,Two Atlanta-based companies that have not been accused of wrongdoing -- Delta Air Lines and Home Depot -- were also mentioned by witnesses as having excessive pay packages for CEOs .
0,1151081,1151065,The company 's chief executive retired and chief financial officer resigned .,"A third executive , chief operating officer David Glenn was fired ."
0,1313226,1312848,"Mallard 's friend , Clete Jackson , and his cousin , Herbert Tyrone Cleveland , pleaded guilty last year to dumping Biggs ' body .","That night Jackson and his cousin , Herbert Tyrone Cleveland , went with Mallard to her house ."
1,881726,882002,He was arrested less than two kilometres from where he allegedly kidnapped her after brutally beating her mother and brother .,He was arrested less than 1km from where he allegedly kidnapped Jennette Tamayo after beating her mother and brother .
1,1057430,1057549,"At his sentencing , Avants had tubes in his nose and a portable oxygen tank beside him .","Avants , wearing a light brown jumpsuit , had tubes in his nose and a portable oxygen tank beside him ."
1,2694905,2694831,"Law enforcement sources who spoke on condition of anonymity confirmed that Limbaugh was being investigated by the Palm Beach County , Fla . , state attorney 's office .","Law enforcement officials confirmed that Limbaugh was being investigated by the Palm Beach County , Fla . , state attorney 's office ."
1,3062259,3062441,"In a major setback to consumers , a federal judge granted the government 's request Thursday to shut down a company that helps customers buy cheaper prescription drugs from Canada .","A federal judge Thursday granted a request by the Food and Drug Administration to shut down Rx Depot , a popular Internet company that sells cheaper prescription drugs from Canada ."
1,2095812,2095797,"The news comes after Drax 's American owner , AES Corp. AES.N , last week walked away from the plant after banks and bondholders refused to accept its restructuring offer .","Last week its American owners , AES Corp , walked away from the plant after banks and bondholders refused to accept its financial restructuring offer ."
0,2146802,2146689,Police official S.K. Tonapi told Reuters at least 40 people had been killed and more than 100 wounded .,State interior ministry spokesman Vasant Pitke told Reuters that at least 42 people had been killed and 112 injured .
0,3361268,3361194,The Senate 's proposal will need the support of the Democrat-led Assembly and Pataki to become law .,"Even if the Senate approves the proposals , they would require the support of the Democrat-led Assembly and Gov. George Pataki to become law ."
1,214550,214034,"The judge ordered the unsealing yesterday at the request of several news agencies , including The Seattle Times , The Associated Press and the Seattle Post-Intelligencer .","The depositions were made public yesterday at the request of the P-I , The Seattle Times and The Associated Press ."
1,2727213,2727379,The consensus estimate of analysts polled by Thomson First Call called for a profit of $ 1.70 per share .,"Analysts polled by Reuters Research , a unit of Reuters Group Plc , on average forecast profit of $ 1.69 per share ."
1,1840006,1840048,Randall Simon singled to right for the second run .,Randall Simon followed with an RBI single to right .
1,1655915,1655425,"Not only is this the oldest known planet , it 's also the most distant .",Astronomers have found the oldest and most distant planet known in the universe .
0,3444261,3444335,GREAT train robber Ronnie Biggs was fighting for life last night after a massive heart attack .,Great Train Robber Ronnie Biggs was back in jail tonight after being treated in hospital for pneumonia .
1,1114356,1114165,"According to the 2000 Census , Long Beach 's Hispanic or Latino population was listed at 35.8 percent .","According to the Census Bureau , the Hispanic population increased by 9.8 percent from the April 2000 census figures ."
1,2852505,2852372,"""He adds : """" She started beating me with her hands about the head until I ran into the other room . """""""," She started beating me with her hands about the head until I ran into the other room ,  Mr Gest says of one incident ."
0,1901007,1901069,"In Britain , temperatures threatened to top the 37.1 C ( 98.8 F ) all-time high .",Western and southwestern Germany were expected to see temperatures hit 38 C ( 100.4 F ) .
1,361380,361266,The per-share earnings were 4 cents per share higher than the expectations of analysts surveyed by Thomson First Call .,That was 4 cents higher than the expectations of analysts surveyed by Thomson First Call .
1,1464126,1464107,But he added group performance would improve in the second half of the year and beyond .,De Sole said in the results statement that group performance would improve in the second half of the year and beyond .
1,1804153,1803716,Officials said one provision in the Senate-passed measure accounted for $ 40 billion over 10 years in the CBO calculation .,The budget office said one provision of the Senate bill accounted for $ 40 billion of the cost .
1,1238164,1238199,TSMC also accused Syndia of trying to interfere with its customer relationships .,"TSMC feels that Syndia 's actions are designed to interfere with TSMC 's customer relationships , the company said ."
0,1417843,1418003,"Dennehy , 21 , hasn 't been heard from in more than two weeks , and police suspect he was killed in the Waco area .","Authorities and Baylor officials say Dennehy , 21 , hasn 't been heard from in more than two weeks ."
1,2052102,2052009,"Ghulam Mahaiuddin , head of administration in the southern province of Helmand , said the bus blast happened early in the morning , west of the provincial capital Lashkargah .","The bus blast in Helmand happened early in the morning in Nadi Ali district , west of the provincial capital Lashkargah ."
0,2464926,2464870,"The teen was in critical condition with life-threatening wounds , police said in a news release .","The teen was in critical condition at Sacred Heart Medical Center , police said in a news release ."
1,2663667,2663623,"In Canada , the booming dollar will be in focus again as it tries to stay above the 75 cent ( U.S. ) mark .","In Canada , the surging dollar was in focus again as it struggled and just failed to stay above the 75 cent ( U.S. ) mark ."
1,1048574,1048764,The same flood that blocked the airport road also swamped a Federal Express depot .,"The water blocking the airport road swamped several buildings , including a Federal Express depot ."
0,1669206,1669252,Each count has a maximum penalty of 10 years in prison and $ 1 million fine .,Both executives face up to 10 years in prison and a $ 1 million fine for securities fraud .
1,2861238,2861348,Defense attorneys said Durst accidentally shot Black in the face as they struggled for a gun after the elderly man illegally entered his apartment .,Durst 's attorneys contend their client accidentally shot Black in the face as they struggled for a gun after Black illegally entered his apartment .
1,1414844,1415063,Prosecutors said the investment was a breach of duty and resulted in the pension fund immediately losing $ 1 million .,The indictment says the investment was a breach of fiduciary duties and resulted in the state pension fund immediately losing $ 1 million .
1,2190158,2190221,"""CAPPS II will not use bank records , records indicating creditworthiness or medical records . """"""","CAPPS II will not use bank records , credit records , or medical records , according to Loy and Kelly ."
0,1580901,1580702,"""British ministers have been asked to explain why they gave undue prominence to the claim that Saddam Hussein could deploy chemical or biological weapons """" within 45 minutes """" .""","Ahead of the war , Blair cited British intelligence information that Saddam Hussein could deploy deadly chemical and biological weapons within 45 minutes ."
1,3357076,3357026,An attempt last month in the Senate to keep the fund open for another year fell flat .,An attempt to keep the fund open for another year fell flat in the Senate last month .
1,2977283,2977187,"By late Thursday afternoon , Putnam said the U.S. Attorney in the Southern District of New York had subpoenaed its trading documents , raising the possibility of a criminal indictment .","Earlier this week , Putnam said the Manhattan U.S. Attorney had subpoenaed its trading documents , raising the possibility of a criminal indictment ."
1,2650998,2650889,"The Emeryville-based toy company filed suit Friday in federal court in Wilmington , Del . , claiming Fisher-Price is violating its 1998 patent on interactive learning books for toddlers and preschoolers .",The Emeryville-based toy company filed suit Friday claiming Fisher-Price is violating its 1998 patent on interactive-learning books for toddlers and preschoolers .
0,3009646,3009757,"Levin 's attorney , Bo Hitchcock , declined to comment Friday .","Hitchcock has declined to comment on the case , as has Levin ."
1,3059963,3059991,Microsoft this week released a critical update to fix a bug with its newly released Office 2003 suite .,"Microsoft has released a critical update for its newly released office suite , Office 2003 ."
1,2728832,2728851,Meat giant Smithfield Foods Inc. has won a bidding war to buy a bankrupt Midwestern pork producer .,Pork processing giant Smithfield Foods Inc. said Monday that it won the bidding in an auction for bankrupt Farmland Industries Inc . ' s pork business .
