Quality,#1 ID,#2 ID,#1 String,#2 String
0,58747,58516,"The Nasdaq composite index increased 10.73 , or 0.7 percent , to 1,514.77 .","The Nasdaq Composite index , full of technology stocks , was lately up around 18 points ."
0,490022,490005,"The broader Standard & Poor 's 500 Index .SPX climbed 10 points , or 1.10 percent , to 943 .","The Nasdaq Composite Index .IXIC jumped 43.64 points , or 2.89 percent , to 1,553.73 ."
1,240387,240350,"Investigators have meticulously looked into virtually every aspect of Campbell 's personal and financial affairs , Campbell has acknowledged .","Investigators continue to probe virtually every aspect of Campbell 's personal and financial affairs , the former mayor has said ."
1,637875,637821,"""A slit the size of one created in the test would let in a stream of gas three times as hot as a blowtorch . """"""",A slit the size of one created in the test would let in a stream of gas three times hotter than a blowtorch .
1,476713,476614,"Passengers would be given a refund and voucher for another trip , she said .",Passengers on that cruise are to be given a refund and voucher for another trip .
1,1571089,1571025,The U.S. Conference Board said its latest measure of business confidence hit 60 after falling to 53 in its first quarter survey .,"The Conference Board said its measure of business confidence , which had fallen to 53 in the first quarter of 2003 , improved to 60 in the most recent second quarter ."
1,1243593,1243934,""" Nobody really knows what happened except me and that guard ,  Kaye said , """" and I can assure you that what he said happened didn 't happen . """""""," Nobody really knows what happened there except for me and the guard , and I can assure you that what he said happened didn 't happen ,  Kaye said ."
0,2452548,2452405,The Washington Times first reported yesterday that Army Capt. James .,The arrest was reported in The Washington Times today .
0,3334905,3334946,"""The Justice Department filed suit Thursday against the state of Mississippi for failing to end what federal officials call """" disturbing """" abuse of juveniles and """" unconscionable """" conditions at two state-run facilities .""","The Justice Department filed a civil rights lawsuit Thursday against the state of Mississippi , alleging abuse of juvenile offenders at two state-run facilities ."
0,1487731,1487197,Arison said Mann may have been one of the pioneers of the world music movement and he had a deep love of Brazilian music .,Arison said Mann was a pioneer of the world music movement -- well before the term was coined -- and he had a deep love of Brazilian music .
1,1614277,1614170, No data exists to indicate that the situation with repair stations poses a safety concern . ,"However , FAA spokeswoman Kathleen Bergen said no data indicate that the situation poses safety problems ."
0,861289,861467,"When asked where the weapons were , Rice said : ' ' This is a program that was built for concealment .",""" The fact is , this was a program that was built for concealment ."
1,1513825,1513801,"They have been identified by the Tarrant County Medical Examiner 's Office as Melena 's brother , Angel Melena , 25 , and Narcisco Del Angel Lozano , 34 .","The Tarrant County Medical Examiner 's Office has identified the deceased passengers at the scene as Angel Melena , 25 , and Narcisco Del-Angel Lozano , 34 ."
0,2182281,2182333,"United Nations inspectors have discovered traces of highly enriched uranium near an Iranian nuclear facility , heightening worries that the country may have a secret nuclear weapons program .","NITED NATIONS , Aug. 26 International inspectors have found traces of highly enriched uranium at an Iranian facility , according to a new confidential report distributed today ."
0,458141,458283,Nelson had received a technical foul with 2 : 46 to go in the first quarter .,Nelson stared down referee Joey Crawford during a timeout with 2 : 46 left in the first quarter and San Antonio leading 26-16 .
1,956131,956277,"Dynes will get $ 395,000 a year , an increase over Atkinson 's current salary of $ 361,400 .","In his new position , Dynes will earn $ 395,000 , a significant increase over Atkinson 's salary of $ 361,400 ."
0,1617908,1617844,Shares of Coke closed New York Stock Exchange trading Thursday at $ 44.01 .,"In morning trading on the New York Stock Exchange , Coca-Cola shares were down 34 cents at $ 43.67 ."
1,1851443,1851377,Qualcomm has enjoyed many years of selling CDMA chips against little or no competition .," Qualcomm has enjoyed many years of selling ... against little or no competition , """" Hubach said in the statement ."""
1,2173504,2173632,"""In a statement , the company said both bids would allow Vivendi to """" maintain a substantial minority interest in a U.S. media corporation with excellent growth potential . """"""","""It also added that both proposals would allow Vivendi Uni to maintain """" a substantial minority interest in a U.S. media corporation with excellent growth potential . """""""
0,3150800,3150832,"Analysts had expected 53 cents a share , according to research firm Thomson First Call .","Home Depot is expected to report earnings per share of 46 cents for the third quarter , according to Thomson First Call ."
0,124994,125207,A panel of the 9th US Circuit Court of Appeals upheld California 's assault weapons ban in a 2-1 ruling last December .,The December decision by the 9th U.S. Circuit Court of Appeals upheld California 's law banning certain assault weapons and revived the national gun-ownership debate .
1,1369186,1369215,"""Not only had Bashir given his blessing but he had asked """" that we hit the target well """" , Mr Bafana said .""","""Not only giving his blessing but he asked that we hit the target well . """""""
0,1244546,1244687,History will remember the University of Washington 's Dr. Belding Scribner as the man who has saved more than a million lives by making long-term kidney dialysis possible .,"Dr. Belding Scribner , inventor of a device that made long-term kidney dialysis possible and has saved more than a million lives , has died in Seattle at age 82 ."
1,1257237,1257412,"The Aspen fire had charred more than 12,400 acres by Monday on Mount Lemmon just north of Tucson and more than 250 homes had been destroyed .","The fire has so far charred 11,400 acres on Mount Lemmon just north of Tucson , and more than 250 homes have been destroyed ."
0,184604,184749,I never organised a youth camp for the diocese of Bendigo .,"""I never attended a youth camp organised by that diocese . """""""
0,1857647,1857914,"BOB HOPE , master of the one-liner and Americas favourite comedian , died with a smile on his face yesterday just months after celebrating his 100th birthday .","""Bob Hope , the master of one-line quips , died Sunday night """" with a smile on his face , """" his daughter said yesterday ."""
1,1982755,1982770,"Adolescent specialist Dr Michael Cohen , who worked on the study , said doctors had treated eight-year-old children with anorexia - and that he had once treated a four-year-old boy .","Adolescent specialist Dr. Michael Cohen , who worked on the study , said doctors had treated 8-year-old children with anorexia _ and that he had once treated a 4-year-old boy ."
1,747160,747144," We have concluded that the outlook for price stability over the medium term has improved significantly since our last decision to lower interest rates ,  Duisenberg said .","""In a statement , the ECB said the outlook for price stability over the medium term had """" improved significantly """" since its last decision to lower interest rates in March ."""
1,126740,127044,"Chief merchandising officers oversee the buying and development of merchandise , deciding the merchandising direction of the company , or basically what it should stand for .","He or she decides the merchandising direction of the company , or basically what it should stand for ."
0,969654,969295,"The broader Standard & Poor 's 500 Index < .SPX > eased 7.57 points , or 0.76 percent , at 990.94 .","The technology-laced Nasdaq Composite Index was down 25.36 points , or 1.53 percent , at 1,628.26 ."
1,1580672,1580644,But the Foreign Affairs Committee yesterday cleared Blair 's cabinet of that accusation .,"In its report , the foreign affairs committee absolved Mr. Blair of charges of doctoring intelligence ."
1,2481604,2481631,"Calvin Hollins Jr . ' s attorney , Thomas Royce , has repeatedly said his client had no link with the company that owned and operated E2 .","The lawyer for Hollins Jr . , Thomas Royce , has said his client had no link to the company that owned and operated E2 ."
0,773545,773722,"MessageLabs , which runs outsourced e-mail servers for 700,000 customers around the world , said it had filtered out 27,000 infected e-mails in 115 countries as of Thursday morning .","""Messagelabs , which runs outsourced e-mail servers for 700,000 customers around the world , has labeled the worm """" high risk """" and reports more than 31,000 infections in 120 countries ."""
1,2286593,2286504,"Two hours earlier , they had recovered the body of Melissa Rogers , 33 , of Liberty , Mo .","Just before dawn Tuesday , searchers found the body of Melissa Rogers , 33 , of Liberty , Mo ."
1,1311599,1311475,The two cases concerned the admissions policies of the University of Michigan 's law school and undergraduate college .,"The two cases were from the University of Michigan , one involving undergraduate admissions and the other , law school admissions ."
0,1343037,1343491,"The Dow Jones industrial average fell 98.30 , or 1.1 percent , while bond values fell , too .","The Dow Jones industrial average finished the day down 98.32 points at 9,011.53 ."
1,2204550,2204582,"Microsoft presented several options at the meeting , the consortium said in the statement .","""Microsoft officials presented """" several options """" it is considering , the W3C posting said ."""
1,3083157,3083264," I feel that people that are sending these messages are infringing on my rights and everyone else 's rights to use their computers ,  said McKechnie .","""The people who are sending these messages are infringing on my rights and everyone else 's rights to use your computer , """" McKechnie said ."""
1,2931868,2932271,Governor Gray Davis estimated yesterday that the fires could cost nearly $ 2 billion .,State officials estimated the cost at nearly $ 2 billion .
1,2555777,2555594,"He is temporarily serving as Chechnya 's acting president while his boss , Akhmad Kadyrov , is on the campaign trail .","He is temporarily serving as Chechnya 's acting president while his boss , Akhmad Kadyrov , is running in the region 's Oct. 5 presidential election ."
1,2636841,2636644,The suspects are expected to turn themselves in to Pennsylvania authorities within the next few days .,"The boys are expected to surrender voluntarily to Pennsylvania authorities within the next several days , Zimmer said ."
1,2529227,2529209,About 400 of those taken into custody were charged with manufacturing or distributing child pornography on the Internet .,"The largest number of arrests , about 400 , were on charges of manufacturing or distributing child pornography on the Internet ."
1,2158059,2158105,A lawsuit has been filed in an attempt to block the removal of the Ten Commandments monument from the building .,Supporters asked a federal court Monday to block the removal of a Ten Commandments monument from the Alabama Judicial Building .
0,3176415,3176292,"In after-hours trading , H-P shares rose 62 cents to $ 22.83 after adding 56 cents in the regular session .","In after-hours trading , Hewlett-Packard shares rose 55 cents , to $ 22.86 , according to Instinet ."
1,2278050,2278126,Parson has been charged on one count of intentionally causing or attempting to cause damage to a computer .,Parson faces one federal count of intentionally causing damage to a protected computer .
0,462816,462552,"Earlier Friday , Taiwan reported 55 new cases but no new deaths .","Yesterday , Taiwan reported 65 new cases , its biggest one-day increase yet ."
1,1245845,1245522,"Naim al-Goud , mayor of Hit , said people from outside his region were ``doing this sabotage against the lines .","Naim al-Goud , the newly appointed mayor of Hit , said people from outside his region attacked the pipeline ."
1,3419852,3419777,"Researchers at Sweden 's Karolinska Institute reanalyzed data from more than 2,000 infants who had been treated with radiation for a benign birthmark condition between 1930 and 1959 .","Researchers at Sweden 's Karolinska Institute recently went over data from more than 2,000 children treated with radiation for a harmless birthmark condition between 1930 and 1959 ."
0,3009814,3009757,"Bo Hitchcock , Levin 's attorney , declined to comment Friday .","Hitchcock has declined to comment on the case , as has Levin ."
1,2204002,2204069," This is , I think , a very seminal moment in our agency 's history ,  Mr O 'Keefe said ."," I think we are at a seminal moment in the history of this agency ,  he said ."
1,1438505,1438576, PeopleSoft has consistently maintained that the proposed combination of PeopleSoft and Oracle faces substantial regulatory delays and a significant likelihood that the transaction would be prohibited . ,PeopleSoft has argued that an Oracle takeover would face substantial regulatory delays and a significant likelihood that the transaction would be prohibited .
0,166344,166421,The stock lost about 75 percent of its value after that bombshell and remains 40 percent below pre-disclosure levels .,The stock lost some three quarters of its value after the initial February 24 bombshell disclosure .
0,774305,774531,"They said many had been beaten , and police officers also stormed private wards at the hospital and harassed patients .",They said the police officers also entered various private wards at the clinic and attacked patients .
1,1895295,1895167,British police arrested 21 people early Tuesday in connection with the suspected ritual murder of an African boy whose torso was found in the Thames River .,Police have arrested 21 people in connection with the murder of a young Nigerian child whose headless and limbless torso was found floating in the river Thames .
0,1700574,1700638,"Reuters reported Braun ended June with $ 22,126 in the bank , according to her FEC report , and the Rev. Al Sharpton reported $ 12,061 in the bank .","Former Illinois Sen. Carol Moseley Braun ended June with $ 22,126 in the bank , according to her FEC report ."
0,1787836,1787964,"Southwest exercised nine 2004 options and six 2005 options , which were accelerated for delivery next year .",Southwest said it recently exercised remaining options for the delivery of nine Boeing 737-700s next year .
1,2797028,2796993,"However , several ministers from more developed APEC economies have said failure to fight terror will be a cost in itself .",More developed APEC members say failure to fight terror will be a cost in itself .
1,221462,221512,At the time federal investigators were looking into how CFSB allocated shares of initial public stock offerings .,A federal grand jury and the Securities and Exchange Commission were looking into how the company allocated shares of initial public stock offerings .
1,153219,153202,"Those involved were allegedly told to never speak of the incident again , according to the letter .",The letter said staff was told to never speak of the incident .
1,1787563,1787470,The agency said it would not release the name of the 17-year-old involved because he is a minor .,The agency said it had no plans to release the name of the teenager involved because he was a minor .
1,1692094,1692026,"Analysts have predicted third-quarter earnings of 16 cents a share and revenue of $ 7.15 billion , on average .","Analysts surveyed by Reuters Research expected earnings of 13 cents a share on revenue of $ 6.7 billion , on average ."
0,111977,111896,The Chelsea defender Marcel Desailly has been the latest to speak out .,"Marcel Desailly , the France captain and Chelsea defender , believes the latter is true ."
1,1379534,1379472,"Five Big East schools , Connecticut , Pittsburgh , Rutgers , Virginia Tech and West Virginia , filed the lawsuit June 6 .","Pittsburgh , West Virginia , Rutgers , Connecticut and Virginia Tech filed the lawsuit this month in Hartford , Conn ."
0,2243130,2243048,"The Dow Jones industrial average .DJI rose 41.61 points , or 0.44 percent , to 9,415.82 .","The Dow Jones rose 41.61 points Friday , a gain of 0.4 % for the day and 0.7 % for the week ."
1,992373,992505," Landing on an aircraft carrier doesn 't make up for the loss of 2.5 million jobs in America ,  said the senator , a much-decorated Vietnam War veteran ."," Landing on an aircraft carrier doesn 't make up for the loss of 2.7 million jobs in America ,  Kerry said ."
1,2338980,2338968,"A nationally known itinerant computer hacker faces a federal arrest warrant on a sealed federal complaint in New York , a federal defender in California said Friday .","A nationally known computer hacker is being sought on a federal arrest warrant stemming from a sealed complaint in New York , a federal defender in California said Friday ."
1,2775364,2775332,"""A really robust program could be had for about 20 cents a day , """" Griffin said ."""," A really robust space program could be had for a mere 20 cents a day from each person ,  he said ."
0,2582380,2582198,Shaklee spokeswoman Jenifer Thompson said the company is continuing to work with authorities .,Shaklee spokeswoman Jenifer Thompson referred all calls to the FBI .
0,2662158,2662046,"The Standard Edition is $ 15,000 per processor or $ 300 per named user .",The Standard Edition One is a single processor version of the Oracle Standard Edition Database .
0,1141068,1141051,"Mahmud controlled access to Saddam for everyone but immediate family members , Pentagon officials said .",Mahmud controlled access to Saddam and was frequently at his side .
1,2615207,2615238,China would become only the third nation to put a human in space .,China would become the third nation to achieve manned spaceflight .
1,1119244,1119355,"Buyers can purchase a Windows- and Office-loaded desktop for $ 298 , excluding taxes , the report said .","Buyers can now choose a Windows- and Office-loaded desktop for 12,390 baht ( US $ 298 ) , excluding taxes , the report said ."
1,727276,727340,"""Besides the fact that Americans want to be liked , she said , there is a """" huge cost when world opinion is negative to the United States .""","""Americans just want to be liked , she said , but there also is a """" huge cost """" when world opinion is negative toward the United States ."""
1,2205838,2205858,"Tibco has used the Rendezvous name since 1994 for several of its technology products , according to the Palo Alto , California company .","Tibco has used the Rendezvous name since 1994 for several of its technology products , it said ."
1,1722074,1721807,The number of injured dropped to 2.92 million in 2002 from 3.03 million a year earlier .,"At the same time , the number of injuries dropped , from 3.03 million in 2001 to 2.92 million in 2002 ."
1,3388966,3389018,"""A grief-stricken old woman , disconsolate with grief , smeared her face with dirt , uttering : """" My child , my child . """"""","""One old woman , disconsolate with grief , smeared her face with dirt , only able to utter : """" My child , my child . """""""
0,772613,772655,"Federal agent Bill Polychronopoulos said it was not known if the man , 30 , would be charged .",Federal Agent Bill Polychronopoulos said last night the man involved in the Melbourne incident had been unarmed .
1,486096,486255,"Although deeply disapproved of in the Soviet Union , the Beatles popularity knew no bounds and far outreached any other Western rock music .","Although the Beatles were deeply disapproved of in the Soviet Union , their popularity knew no bounds and far outreached any other Western rock groups ."
1,3182444,3182413,The United States and Britain are seeking backing at the United Nations for their agenda to hand over power to Iraqis .,"At the United Nations , the United States and Britain are seeking backing for their agenda to hand over power to Iraqis ."
0,18720,18757,"Shares of LendingTree rose $ 6.21 , or 42 percent , to $ 20.90 after hitting $ 21.36 earlier .","LendingTree shares rose 43 percent , or $ 6.31 , to $ 21 , more than doubling in the last two months ."
1,1019061,1018963,"Shares of Pleasanton-based PeopleSoft rose 4 cents , to $ 16.96 , in Monday trading on the Nasdaq Stock Market .",PeopleSoft shares were up 4 cents at $ 16.96 in late morning trade on the Nasdaq .
1,2128403,2128443,They also said the rule will make the nation 's electrical system more reliable -- a high-profile issue after last week 's massive power blackout .,"They also said the rule will improve the reliability of the nation 's electrical system , which is needed after last week 's massive power blackout ."
0,222911,223008,"The 1 5 / 8 percent note maturing in April 2005 gained 1 / 16 to 100 13 / 32 , lowering its yield 1 basis points to 1.41 percent .",The yield on the 3 percent note maturing in 2008 fell 22 basis points to 2.61 percent .
1,1973651,1973712,"On Sunday August 3 , the House of Deputies voted nearly 2-1 in favor of the Reverend Gene Robinson of New Hampshire .","On Tuesday in Minneapolis , the House of Bishops gave final approval on a 62-43 vote for the Rev. V. Gene Robinson of New Hampshire to become bishop ."
1,1167817,1167737,"Under Kansas law , it is illegal for children under the age of 16 to have sexual relations .","In the opinion , Kline noted that it is illegal for children that young to have sexual relations ."
0,3131772,3131625,Legislation making it harder for consumers to erase their debts in bankruptcy court won overwhelming House approval in March .,"Legislation making it harder for consumers to erase their debts in bankruptcy court won speedy , House approval in March and was endorsed by the White House ."
1,193911,194178,"They said they were not advocating the changes yet , but believed they are worth considering — especially as NATO expands to 26 members .","The sponsors said they were not advocating the changes yet , but believed it was worth considering - especially as NATO expands to 26 members ."
1,1125577,1125579,He acted as an international executive producer on Who Wants to be a Millionaire and The Weakest Link .,A Melbourne TV producer who worked on shows including Who Wants To Be a Millionaire ?
0,3384254,3383797,At least 13 of the affected flights were scheduled out of Atlanta .,At least 13 flights out of Atlanta were listed as canceled .
0,2668628,2668543,The American conservatives are clearly in the minority within the Episcopal Church .,The letter indicates the Vatican 's interest in bolstering conservatives within the Episcopal Church .
1,55074,55220,"""But a state judge has ruled that the so-called """" double jeopardy """" protections do not apply in the case .""",A judge already has ruled that double-jeopardy protections don 't apply in the case .
1,1618493,1618463,Representatives for Puretunes could not immediately be reached for comment Wednesday .,Puretunes representatives could not be located Thursday to comment on the suit .
1,1152748,1152795,"Subsequently , some bondholders have filed suit to block the exchange offer .",Bondholders of Mirant Americas Generation subsequently filed suit against Mirant seeking to block the exchange offer .
1,921159,921272,"The US chip market is expected to decline 2.1 percent this year , then grow 15.7 percent in 2004 .","The Americas market will decline 2.1 percent to $ 30.6 billion in 2003 , and then grow 15.7 percent to $ 35.4 billion in 2004 ."
1,2323107,2323116,"Since December 2002 , Evans has been the vice chair of the U.S. Chief Information Officers Council .",Evans is also the vice-chairman of the Federal Chief Information Officers Council .
1,2826484,2826474,The fight over online music sales was disclosed in documents filed last week with the judge and made available by the court yesterday .,The fight over online music sales was disclosed in documents made available Monday by the court .
0,3130888,3130842,A spokesman for the U.S. Attorney 's Office was not available for comment .,A spokesman for the United States Attorney 's office in Manhattan had no comment .
0,1822540,1822921,"But Adora Obi Nweze , the NAACP state president , said the state only tried to prove its conclusion of suicide , rather than consider the possibility of murder .","Adora Obi Nweze , the NAACP state president , said the state has refused to consider the possibility of murder ."
0,3414738,3414762,"Shares of San Diego-based Jack In The Box closed at $ 21.49 , up 78 cents , or 3.8 percent , on the New York Stock Exchange .","Shares of Tampa-based Outback Steakhouse Inc. closed at $ 44.50 , up $ 1.78 , or 4.2 percent , on the New York Stock Exchange ."
1,3320347,3320265,"Cullen , 43 , is charged with murdering a Catholic clergyman and attempting to kill another patient at Somerset Medical Center .","Cullen , 43 , is charged with killing a Roman Catholic Church official and attempting to kill another patient at Somerset Medical Center in Somerville ."
0,1701278,1701371,"All three had criminal records for stealing cattle , the statement said .",It said they all had criminal records for stealing cattle and Lamas was twice imprisoned for armed robbery .
1,2889534,2889485,"The GAO found cable rates have increased 40 percent over the past five years , versus 12 percent inflation during the period .","The GAO found that cable rates have increased by 40 percent during the past five years , far above the 12 percent inflation in that period ."
