Quality,#1 ID,#2 ID,#1 String,#2 String
1,2170444,2170659, NASA 's organizational culture and structure had as much to do with this accident as the ( loose ) foam . ," The NASA organizational culture had as much to do with this accident as the foam ,  the report said ."
1,2003451,2003409,"Frank Partnoy , a securities law professor at the University of San Diego , said the case suggested that Merrill 's oversight and control of its executives were inadequate .","Frank Partnoy , a securities-law professor at the University of San Diego School of Law , said the case suggests Merrill Lynch 's oversight and control of its executives was inadequate ."
1,1043007,1043209," For customers to get the most of the Internet , several factors are crucial ,  Pierre Danon , CEO of BT 's retail unit ."," For customers to get the most out of the internet , several factors are crucial ,  Mr Danon said ."
1,1048004,1047810,It would not affect economic damages such as lost wages or hospital bills .,"Economic damages , such as lost wages or medical costs , wouldn 't be capped under Bush 's plan ."
0,1200832,1201040,"In court , Stewart briefly waved to courtroom sketch artists seated in the jury box .",Stewart waved to courtroom sketch artists seated in the jury box and took notes in a spiral-bound notebook during the hearing .
1,424636,424710,"Aquila is short of cash , and Avon bondholders at one point feared it may default on interest payments .",Avon bondholders have no recourse to Midlands 's assets and at one point feared Aquila would default on interest payments .
0,1117441,1117426,"""U.S. Attorney Patrick Fitzgerald said the wholesalers were not to blame and were """" victims in this . """"""","""U.S. Attorney Patrick Fitzgerald declined to name the wholesalers , whom he called """" victims in this . """""""
0,2122781,2122817,"Under the settlement , Solutia will pay $ 50 million in equal installments over a period of 10 years .","Under the agreement , Solutia will pay $ 50 million and Monsanto will pay $ 390 million ."
1,1946553,1946598,Fewer than a dozen FBI agents were dispatched to secure and analyze evidence .,Fewer than a dozen FBI agents will be sent to Iraq to secure and analyze evidence of the bombing .
1,361380,361266,The per-share earnings were 4 cents per share higher than the expectations of analysts surveyed by Thomson First Call .,That was 4 cents higher than the expectations of analysts surveyed by Thomson First Call .
0,57271,57251,The Taiwan Stock Exchange will ask the Securities and Futures Commission ( SFC ) to suspend trading in Mosel shares .,A request for a two-month extension was denied and the Taiwan Stock Exchange is to ask the Securities and Futures Commission ( SFC ) to suspend trading in Mosel shares .
0,3164761,3164606,"Peterson told police he fished alone in San Francisco Bay on Christmas Eve , returning to an empty house .",Peterson told police he left his wife at about 9 : 30 a.m. on Dec. 24 to fish alone in San Francisco Bay .
0,3224724,3224642,The House and Senate are expected to vote on the omnibus bill in the next two months .,The House Republican leadership said it expected to call members back Dec. 8 for a vote on the omnibus bill .
0,1669206,1669252,Each count has a maximum penalty of 10 years in prison and $ 1 million fine .,Both executives face up to 10 years in prison and a $ 1 million fine for securities fraud .
1,2515695,2515725,His harsh criticism of PLO chairman Yasser Arafat led to his books being banned for a time by the Palestinian Authority .,"His harsh criticism of the PLO 's chairman , Yasser Arafat , saw the Palestinian Authority ban his books for a time ."
1,530989,530791,"Westfield , which owns Galleria in Morley , also will continue discussions about the other co-owned centres such as Knox City in Melbourne , half-owned by Deutsche Bank .","Westfield also will continue discussions over the other co-owned centres , such as Knox City in Melbourne , where Deutsche Bank owns a 50 per cent stake ."
1,1390426,1390317,But Abraham said changes in air-pollution rules would be up to the Environmental Protection Agency ( EPA ) .,Changes in air pollution rules would be up to the Environmental Protection Agency .
1,1053869,1053207,U.S. law enforcement officials are sneering at Dar Heatherington 's version of the events which thrust her into the public spotlight .,U.S. law enforcement officials are sneering at Dar Heatherington 's version of of the events -- including a police conspiracy to discredit her -- which thrust her into the public spotlight .
1,3153729,3153788,"Dusenbery 's fiancee , Jessica Wheat , said he was considering settling down in Fort Campbell and making the Army his career .","Jessica Wheat , who said she and Dusenbery were planning to marry , said Dusenbery was considering settling down in Fort Campbell and making the Army his career ."
1,1641162,1641062,It said the damage to the wing provided a pathway for hot gasses to penetrate the ship 's thermal armor during Columbia 's ill-fated reentry .,The document says the damage to the wing provided a pathway for hot gases to penetrate Columbia 's thermal armour during its fatal re-entry .
1,2331304,2331918,Bloodsworth was ultimately cleared with evidence gathered from a semen stain on the victim 's panties .,"In 1993 , after nine years in prison , Bloodsworth was cleared with evidence gathered from a semen stain on the victim 's panties ."
1,3057898,3057973,They found molecules that can only be produced when ozone breaks down cholesterol .,And all of the samples contained molecules that can only be produced when cholesterol interacts with ozone .
1,588211,588199,"Such a letter indicates the government intends to pursue an indictment and believes it has substantial evidence to support an indictment , the company said .",The Kenilworth-based company said it believes the letter shows that the government plans to pursue a criminal indictment and likely has substantial evidence supporting an indictment .
0,1738026,1737931,"But for more than a century , an untold amount of money intended for some of the nation 's poorest residents was lost , stolen or never collected .","For more than a century , an undetermined amount of money was lost , stolen , or never collected ."
1,3224745,3224869," The Republicans went into a closet , met with themselves , and announced a ' compromise . ' "," The Republicans went into a closet , met with themselves , and announced a compromise ,  Hollings said in a statement ."
1,2482633,2482523,"US District Judge William M. Hoeveler 's removal by his superior was a victory for US Sugar Corp. , which led the fight for his ouster .","U.S. District Judge William M. Hoeveler 's removal by his superior was a victory for U.S. Sugar Corp. , which led the fight against Hoeveler ."
1,213302,213135,The Washington Post said Airlite would shut down its first shift and parts of the second shift Monday to accommodate the president ’ s appearance .,"The plant plans to shut down its first shift and parts of the second shift Monday to accommodate the president 's appearance , Crosby said ."
0,3181243,3181212,Both were declared dead about 6 p.m. at Brookdale University Hospital and Medical Center .,"Both shooting victims were rushed to Brookdale University Hospital Medical Center , where they died a short time later ."
1,607862,607926,"The agreement resolves a lawsuit AOL filed against Microsoft in January 2002 on behalf of its subsidiary , Netscape Communications .",The legal settlement resolves the private anti-trust lawsuit filed against Microsoft in January 2002 by AOL Time Warner 's America Online unit on behalf of its Netscape subsidiary .
1,1276754,1276678," This is a cloud hanging over their credibility , their word ,  said Hagel .",""" This is a cloud hanging over their credibility , their word ,  Hagel said on ABC 's """" This Week . """""""
1,436562,435307,Her putt for birdie was three feet short but she saved par without difficulty .,She leaves her birdie putt some three feet short but drops her par putt .
0,2849263,2849208,"On July 10 , a team of 32 Singaporean police officers was sent to Baghdad .",In July 32 Singaporean police officers were sent to Baghdad to help train Iraqi police forces and returned home last month .
1,519592,519351,"""Called """" Taxpayers Against the Recall , """" it was to be launched Wednesday afternoon outside a Sacramento fire station .""","The new effort , Taxpayers Against the Recall , will be formally launched today outside a Sacramento fire station ."
0,1410601,1410768,"Health Minister Peter Coleman said about 300 people had been killed and 1,000 wounded in the past few days .","Health Minister Peter Coleman said about 300 people had been killed and 1,000 injured as the rebels fought into the capital ."
0,1741899,1741943," His statement is that he possibly hit the gas instead of the brakes ,  Mr Butts said ."," He says he couldn 't stop the vehicle ... his statement is he possibly hit the gas instead of the brake ,  Butts said ."
0,363199,362925,"Investors were askingwhether other banks , some of which are still being audited , could be dealt with in the same way .","Other Japanese banks , some of which are still being audited , could face similar scrutiny ."
1,381280,381254,"Available in June , Bare Metal Restore 4.6 costs $ 900 per Windows client and $ 1,000 per Unix client for new customers .","Bare Metal Restore 4.6 will be available in mid-June , said Veritas , and will cost $ 900 per Windows client and $ 1,000 per Unix client ."
1,1726893,1726944,"The 2001 recession is considered short and shallow relative to the nine others since World War II , which averaged 11 months .","The most recent recession was short and shallow relative to the nine others , averaging 11 months , that occurred since World War II ."
1,1694716,1694679,Token-issuing framework provides capabilities that build on WS-Security and define extensions to request and issue security tokens and to manage trust relationships and secure conversations .,"Within WSE 2.0 , WS-Trust , WS-SecureConversation build on WS-Security and define extensions to request and issue security tokens and to manage relationships and secure conversations ."
0,1588251,1588119,"The technology-heavy Nasdaq Composite Index gained 25.75 points , or 1.5 percent , to 1,746.46 , its highest close in about 15 months .","The technology-laced Nasdaq Composite Index .IXIC was down 1.55 points , or 0.09 percent , at 1,744.91 ."
1,1183958,1183917,"Forty to 50 years ago , the ratio was 3 to 1 , Kessler said , and 10 years ago , it was 2 to 1 .","Forty to 50 years ago , the ratio was about 3-to-1 , Kessler said , and 10 years ago , it was about 2-to-1 ."
1,2857994,2857985,"Preventing stronger gains , News Corp < NCP.AX > fell 1.3 percent to A $ 12.43 and Brambles < BIL.AX > dropped 1.9 percent to A $ 4.75 after a weak performance overnight .","Holding the market back , News Corp < NCP.AX > fell two percent to A $ 12.34 and Brambles < BIL.AX > dropped 2.3 percent to A $ 4.73 after a weak performance overnight ."
1,1754660,1754722,A senior Administration official who briefed journalists on Friday said neither Mr Bush nor National Security Adviser Condoleezza Rice read the estimate in its entirety .,The senior administration official said neither Bush nor National Security Adviser Condoleezza Rice read the entire National Intelligence Estimate .
0,633766,633873,"The Dow Jones industrial average < .DJI > rose 98.74 points , or 1.12 percent , to 8,949.00 .","The city index outperformed the Dow Jones industrial average , which rose 2.9 percent during the four-day trading week ."
0,2274850,2274727,Janice Kelly said her husband had received assurances from senior MoD officials that his name would not be made public .,She told the inquiry that her husband had received assurances from his line manager and senior ministry officials that when he came forward his name would not be made public .
0,1617827,1617800,A spokesman for the U.S. Attorney 's Office in Atlanta also refused to comment .,Coca-Cola announced Friday morning that the U.S. Attorney 's office in Atlanta has started an inquiry .
1,3321146,3321233,"In March , Rowland 's former deputy chief of staff pleaded guilty to accepting gold and cash in return for steering state contracts .","Lawrence E. Alibozek , his former deputy chief of staff , pleaded guilty to accepting cash and gold coins in exchange for influencing state contracts ."
1,1095653,1095781,"Based on the history and success of The Winston in Charlotte , I believe theres no place but Lowes Motor Speedway that can do it justice ."," Based on the history and success of The Winston in Charlotte , I believe there 's no place but Lowe 's Motor Speedway that can do it justice . "
1,2375172,2375137,He says information released about a tarot card left at one shooting scene may have prolonged the spree by cutting off fragile communications with the sniper .,He says the release of a tarot card left at a shooting scene may have prolonged the spree by cutting off fragile communications with the sniper .
0,1578836,1578673,"A senior air force official and a member of parliament were also on board , state radio report said .","A senior air force official and a member of Parliament also died in the crash , it said ."
1,2119782,2119685,"The computers were reportedly located in the U.S. , Canada and South Korea .","The PCs are scattered across the United States , Canada and South Korea ."
1,221367,221515," Frank Quattrone is innocent ,  Keker said in a statement .",Quattrone lawyer John W. Keker said his client is innocent .
0,283606,283689,"The staged scene , covering several acres , featured smashed cars and buses , ruined buildings , scattered debris and spot fires .","Smashed cars and buses , ruined buildings , scattered debris and spot fires added to the realism ."
0,1701370,1701277,"The government identified the alleged hijackers as Francisco Lamas Carón , 29 , Luis Alberto Suarez Acosta , 22 , and Yosvani Martínez Acosta , 27 .","The ministry said the hijackers Francisco Lamas Caron , 29 ; Luis Alberto Suarez Acosta , 22 ; and Yosvani Martinez Acosta , 27 , shot themselves for unknown reasons ."
1,1382183,1381827,Justice Anthony Kennedy dissented in an opinion joined by Chief Justice William Rehnquist and Justices Antonin Scalia and Clarence Thomas .,He was joined by Chief Justice William H. Rehnquist and Justices Antonin Scalia and Clarence Thomas .
1,283128,283117,The measures could be taken up by the full Senate as early as Friday .,Ratliff said he hopes to bring the two measures to the full Senate by Friday .
1,98427,98654,"On Wednesday , a man was shot near Kut as he tried to run over two marines at a checkpoint .","On Wednesday , the Marines shot an attacker near the town of Al-Kut as he tried to run over two Marines at a checkpoint ."
1,1458108,1458147,Kerry Kennedy Cuomo and Andrew Cuomo have been married 13 years .,Andrew Cuomo and Kerry Kennedy were married 13 years .
0,261466,261502,The total number of new cases in China was fewer than 100 for the third day in a row .,"On Monday , the number of SARS cases in China passed 5,000 , hitting a total of 5,013 ."
1,1443586,1443540,The findings appear in next Friday 's Physical Review Letters .,The findings will be reported Friday in the journal Physical Review Letters .
1,3125139,3124927,Chi-Chi 's has agreed to keep the restaurant closed until Jan. 2 - two months after it voluntarily closed following initial reports of the disease .,Chi-Chi 's has agreed to keep the restaurant closed until Jan. 2 -- two months after it voluntarily closed when the disease was first reported .
0,1708655,1708561,"First , it 's found in most versions of Windows , including the new Windows Server 2003 .","""It is the first """" critical """" flaw discovered and fixed in the new Windows Server 2003 ."""
1,895812,895754,"While a month 's supply of aspirin can cost less than $ 10 , the equivalent amount of ticlopidine can run significantly more than $ 100 .","While a month 's supply of aspirin can cost under $ 10 , the equivalent amount of ticlopidine can run well over $ 100 ."
1,2962749,2962720,"""After consulting with experts , he said he was advised a delay will give Luna his best chance of reuniting with """" L """" Pod , his family .""","""Experts say the delay will give Luna his best chance of reuniting with """" L """" Pod , his family , Thibault said ."""
1,960865,960919,The budget fell steadily until dropping as low as $ 2.93 billion in 1998 and has gradually risen to $ 3.27 billion for fiscal 2002 .,It fell steadily until it dropped as low as $ 2.93 billion in 1998 and rose gradually to $ 3.27 billion for fiscal 2002 .
0,375988,375914,She appeared in federal court there Monday and was expected to be transferred to Houston in two weeks .,Holloway surrendered in Cleveland on Friday and was expected to be transferred to Houston in two weeks .
1,2126941,2126894,"The Rev. Christopher J. Coyne , spokesman for the archdiocese , wouldn 't comment Friday .","The Rev. Christopher Coyne , spokesman for the archdiocese , did not immediately return several calls seeking comment ."
1,374633,374276,"Yesterday 's ruling is a great first step toward better coverage for poor Maine residents , he said , but there is more to be done .","He said the court 's ruling was a great first step toward better coverage for poor Maine residents , but that there was more to be done ."
0,644152,643712,"Authorities in Alabama said the passage of time , and the transfer or retirement of some investigators , has not hurt their case .","Meantime , federal authorities in Alabama said the passage of time has not hurt their case against Rudolph ."
1,2315720,2315696,"State Sen. Vi Simpson , former state and national Democratic chairman Joe Andrew are seeking the Democratic nomination .","Leading Democratic candidates are former state and national Democratic Chairman Joe Andrew and State Sen. Vi Simpson , Ellettsville ."
1,533426,533451,"Data showed Italian business confidence slipped to its lowest level in 16 months in May , aiding rate cut expectations .","On Tuesday , figures also showed Italian business confidence slipped again in May to its lowest level in 16 months , doing nothing to discourage rate cut expectations ."
1,2555766,2555591,Chechen officials working for the Moscow-backed government are a frequent target for rebels and tension is running high ahead of next Sunday 's presidential election in war-torn Chechnya .,"Officials in Chechnya 's Moscow-backed government are a frequent target for rebels , and tension is running high ahead of Sunday 's presidential election in the war-ravaged region ."
1,1265264,1265297,"The A920 comes with a printer , scanner , and copier for $ 89 .","Dell 's Personal All-in-One A920 is an entry-level device that combines printer , scanner and copier functions for $ 89 ."
0,2232494,2232543,"They include two Kuwaitis and six Palestinians with Jordanian passports with the remainder Iraqis and Saudis , the official said .","Two Kuwaitis and six Palestinians with Jordanian passports were among the suspects , the official said ."
1,222638,222492,The company is in the early stages of testing the drug for rheumatoid arthritis .,The company is also testing its cancer drug Rituxan for use by rheumatoid arthritis patients .
1,2403100,2403192,On average the students suffered at least one of the 13 symptoms between three and 11 times in the last year .,"Based on having at least one of these symptoms , most students were hung over between three and 11 times in the past year ."
0,2060828,2060865,"A new variant of Blaster also appeared Wednesday and seemed to be spreading , according to antivirus companies .","The new variation of Blaster was identified Wednesday , according to antivirus company Sophos ."
1,2733361,2733225,"With an estimated net worth of $ 1.7 billion , Mrs. Kroc ranked No. 121 on Forbes magazine 's latest list of the nation 's wealthiest people .","Kroc ranked No. 121 on Forbes magazine 's latest list of the nation 's wealthiest people , with an estimated net worth of $ 1.7 billion ."
0,2620067,2620050,"Debra Mitchell , a member of the church , said Wilson had recently lost her job .","Mitchell said many knew Wilson , 43 , to be unstable and that she recently lost her job ."
1,44610,44377,Garner said Iraq 's reconstruction was not as difficult as he had expected -- mainly because the war caused less infrastructure damage and fewer refugees than anticipated .,Garner said reconstruction will not be as difficult as he anticipated because the war caused less damage and created fewer refugees .
1,1620264,1620507," At this point , Mr. Brando announced : ' Somebody ought to put a bullet '  through her head , the motion continued .","""Brando said that """" somebody ought to put a bullet """" through her head , according to the defense ."""
0,2046780,2046991,DeVries did make one stop in town Wednesday - registering as a sex offender at the Soledad Police Department .,Convicted child molester Brian DeVries spoke out in response to community outrage Wednesday afternoon after registering as a sex offender at the Soledad Police Department .
0,1790075,1790177,The Recording Industry Association of America says it plans to sue the song traders next month .,"That is , if the Recording Industry Association of America has anything to say about it ."
1,224868,225233,Shares of Hartford rose $ 2.88 to $ 46.50 in New York Stock Exchange composite trading .,"Shares of Hartford were up $ 2.28 , or 5.2 percent , to $ 45.90 in midday trading ."
1,390669,390518,"Only two other countries , Germany and the Dominican Republic , have publicly expressed reservations , and Germany has since said it will sign it .","Only two other countries , the Dominican Republic and Germany , publicly expressed reservations about the treaty , and Germany has since said it will support the pact ."
1,1913621,1913715,The merged company will keep the Interwoven name and be headquartered in Sunnyvale .,The new company will be named Interwoven and will be headquartered in Sunnyvale .
1,2254641,2254589,"The 244th Engineer Battalion has been clearing rubble , building playgrounds and restoring irrigation in Iraq , the military said .","The battalion has been clearing rubble , building playgrounds and restoring irrigation in Iraq , military officials told The Associated Press ."
1,3102696,3102405,"""The 60-year-old millionaire hugged his attorneys , saying : """" Thank you so much . """"""","""Moments later , he hugged his defense lawyers , softly saying , """" Thank you , so much . """""""
0,2945092,2945178,"""Strong spokeswoman Stephanie Truog said , """" We are in the process of a thorough internal review with the assistance of outside professionals .""","""Strong Financial released a statement Wednesday night : """" We are in the process of a thorough internal review ."""
1,1538790,1538868,Sales of downloaded singles and albums will be included in Billboard 's charts for those configurations .,"Digital download sales of recorded albums and singles will be included in the album and singles sales charts , respectively ."
0,1319631,1319681,"Goldman decided to increase its quarterly dividend to 25 cents a share from 12 cents , citing recent tax legislation as a primary factor behind the move .","In addition , Goldman raised its quarterly dividend to 25 cents a share , up from 13 cents previously ."
0,219039,218851,"He will replace Ron Dittemore , who announced his resignation April 23 .",Dittemore announced his plans to resign on April 23 .
1,1087515,1087318,"The $ 19.50-a-share bid , comes two days after PeopleSoft revised its bid for smaller rival J.D. Edwards & Co . JDEC.O to include cash as well as stock .",Oracle 's $ 19.50-a-share bid comes two days after PeopleSoft added cash to its original all-share deal with smaller rival J.D. Edwards & Co . JDEC.O .
1,2854524,2854472,"About 1,557 genes on chromosome 6 are thought to be functional .","The remaining 1,557 genes are believed to be all functional ."
0,3448500,3448457,"Ryland Group ( nyse : RYL - news - people ) , a homebuilder and mortgage-finance company , sank $ 9.65 , or 11.6 percent , to $ 73.40 .","Swedish telecom equipment maker Ericsson ( nasdaq : QCOM - news - people ) jumped $ 2.88 , or 15.7 percent , to $ 21.28 ."
1,886793,887032,"Privately-held GeCAD Software , founded in 1992 , has supplied antivirus and security products since 1994 under the name RAV AntiVirus .","GeCAD , founded in 1992 and based in Bucharest , provides anti-virus , anti-spam and content-filtering products under the name RAV AntiVirus ."
1,1921888,1921873,"Professor Hermon-Taylor adds , An unexpected finding of the research showed that patients suffering with Irritable Bowel Syndrome ( IBS ) were also infected with the MAP bug .",Hermon-Taylor said an unexpected finding of the research showed that patients suffering from irritable bowel syndrome ( IBS ) may also be infected with MAP .
1,2521336,2521360," We had nothing to do with @ Stake 's internal personnel decision ,  Microsoft spokesman Sean Sundwell said ."," Microsoft had absolutely nothing to do with AtStake 's internal personnel decision ,  Sundwall said ."
1,403037,402971,"Revelations of the expenditures shocked some employees at Delta , an airline that is cutting jobs as it struggles with increased security costs and fewer passengers .","Revelations of the expenditures shocked some employees at Delta , an airline that has posted huge losses and cut jobs as it struggles with increased security costs and fewer passengers ."
1,556146,556044,"More than 60 percent of the company 's 1,000 employees were killed in the attack .","More than 60 per cent of its 1,000 employees at the time were killed ."
