Quality,#1 ID,#2 ID,#1 String,#2 String
1,1438883,1438633,"Werdegar also said Intel 's servers weren 't harmed by the computer messages and the thousands of recipients were able to request that the E-mails stop , which Hamidi honored .","She also noted that Intel 's servers were not harmed and that the thousands of Hamidi e-mail recipients were able to request that the e-mails stop , which Hamidi honored ."
1,407297,407281,The study found that only about one-third of parents of sexually experienced 14-year-olds knew their children were having sex .,"""Only about one-third of parents of sexually experienced 14-year-olds know that their child has had sex , """" the report says ."""
0,1668236,1668179,Yeager said the suspect in the Target attack showed tendencies of being a prior offender .,"Yeager said the incident appeared to be isolated , but the suspect showed tendencies of being a prior offender ."
1,2063589,2063578,The company reported that it terminated Sequent 's Unix contract for improper transfer of source code and development methods into Linux .,SCO said it terminated Sequent 's contract due to improper transfer of the company 's source code and development methods into Linux .
0,1478072,1477994,""" If the other rating agencies also downgrade us ..",The two other national rating agencies are waiting to take action .
1,1245664,1245881,"Another million barrels , bought by Spanish refiner Cepsa SA , was to be loaded onto a Spanish tanker , the Sandra Tapias .","A Spanish tanker , Sandra Tapias , was to be loaded with another million barrels , bought by Spanish refiner Cepsa SA , in the afternoon ."
1,2343280,2343315,The reading for both August and July is the best seen since the survey began in August 1997 .,It is the highest reading since the index was created in August 1997 .
0,41192,41211,"Shares of USA Interactive rose $ 2.28 , or 7 percent , to $ 34.96 on Friday in Nasdaq Stock Market composite trading and have gained 53 percent this year .","Shares of LendingTree rose $ 6.03 , or 41 percent , to close at $ 20.72 on the Nasdaq stock market yesterday ."
1,1106212,1106299,President Bush and top administration officials cited the threat from Iraq 's banned weapons programs as the main justification for going to war .,President Bush and top officials in his administration cited the threat from Iraq 's alleged chemical and biological weapons and nuclear weapons program as the main justification for going to war .
1,956231,956502,"He will be paid $ 395,000 per year , up from Atkinson 's current salary of $ 361,400 .","Dynes will be paid $ 395,000 a year ; Atkinson 's salary is $ 361,400 ."
0,1617344,1617290,"Attorney John Barnett , who represents Morse , showed photos of a scratch on Morse 's neck and the officer 's bloody ear .","After Jackson testified he never touched the officers during the struggle on the ground , Barnett showed photos of a scratch on Morse 's neck and the officer 's bloody ear ."
0,1741899,1741943," His statement is that he possibly hit the gas instead of the brakes ,  Mr Butts said ."," He says he couldn 't stop the vehicle ... his statement is he possibly hit the gas instead of the brake ,  Butts said ."
1,2763475,2763440,"They did so after her feeding tube was removed this afternoon , accompanied by the Rev. Thaddeus Malanowski , a Catholic priest who visits Mrs. Schiavo weekly .","They did visit after her feeding tube had been removed , accompanied by the Rev. Thaddeus Malanowski , a Roman Catholic priest who visits Mrs. Schiavo weekly ."
1,434842,434929,"With all precincts reporting , Fletcher — a three-term congressman from Lexington — had an overwhelming 57 percent of the vote .","With all precincts reporting , Fletcher had 88,747 votes , or 57 percent of the total ."
1,771017,771084,"Taupo was guiding her owner Paul Kibblewhite , 62 , on a three-day walk with a tramping party of eight .","Taupo had been leading Mr Kibblewhite , 62 , of Rotorua , on a three-day walk with a tramping party of eight ."
1,228848,228809,"But its most popular comedy , Friends , is going into its last season .","But its most popular comedy , Friends , will sign off after a two-hour finale next May ."
1,1072674,1072425,"O 'Brien 's attorney , Jordan Green , declined to comment .","Jordan Green , O 'Brien 's private attorney , said he had no comment ."
0,31854,31913,"Passed in 1999 but never put into effect , the law would have made it illegal for bar and restaurant patrons to light up .","Passed in 1999 but never put into effect , the smoking law would have prevented bar and restaurant patrons from lighting up , but exempted private clubs from the regulation ."
1,2959224,2959270," The GPL violates the U.S. Constitution , together with copyright , antitrust and export control laws ,  SCO Group said in an answer filed to an IBM court filing ."," The GPL violates the U.S. Constitution , together with copyright , antitrust and export control laws ,  states SCO in documents filed with the U.S. District Court for Utah ."
1,1841375,1841180,"And if estimates hold , it will mark the first time in history that five films grossed more than $ 20 million each in one weekend .",It is also the first time in history that five films grossed more than $ 20 million each in one weekend .
1,3271454,3271282,"But none of them opposed the idea outright , ministers said .","But none of the ministers opposed Mr. Powell 's suggestion outright on Thursday , the ministers said ."
0,3444060,3444025,The calculation shows that the number of deaths from pneumonia and influenza have exceeded the usual number for recent weeks .,One is a statistical calculation based on the number of deaths from pneumonia and influenza in 122 cities .
0,3366214,3366092,"A seventh victim , a woman , died Tuesday night in the burn unit at childrens Hospital Medical Center of Akron .","A seventh person , a 21-year-old woman , was in critical condition in the burn unit at Akron Children 's Hospital ."
0,2414161,2413910,"Sentenced to 20 years to life , she was granted parole last month despite the opposition of relatives , friends and colleagues of the slain men .","Boudin , 60 , a former Weather Underground member , was granted parole last month despite heavy opposition by relatives , friends , and colleagues of the slain men ."
1,696329,696168,The United States only agreed to let the agency back into Iraq after repeated warnings by IAEA chief Mohamed ElBaradei .,Washington only agreed to let the U.N. mission into Iraq after repeated warnings by IAEA chief Mohamed ElBaradei .
1,655516,655401,"The global death toll approached 770 with more than 8,300 people sickened since the SARS virus first appeared in southern China in November .",The global death toll is 770 with more than 8300 people sickened since the severe acute respiratory syndrome virus first appeared in southern China in November .
1,2196784,2196874,"He said it was a mistake , and he reimbursed the party nearly $ 2,000 .","The governor said the use of the credit card was a mistake , and has since reimbursed the party for the expense ."
1,1892206,1892096,It also hired Citigroup and Morgan Stanley to explore refinancing or restructuring of $ 175 million in senior notes due next year .,ATA also has hired Citigroup and Morgan Stanley to evaluate options for refinancing or restructuring $ 175 million of 10.5 percent senior notes due in August 2004 .
0,514810,514453,The two Democrats on the five-member FCC held a press conference to sway opinion against Powell and the two other Republicans on the panel .,The two Democrats on the five-member FCC panel held a news conference to sway opinion against Powell .
0,2636610,2636828,"Sixty players and five coaches from the school attended the training camp in August in Preston Park , about 125 miles north of Philadelphia .","Sixty players and five coaches from Mepham High School in Bellmore , Long Island attended the training camp in August ."
1,2545273,2545342,"Canada won 't commit more troops to Afghanistan until the current year-long mission is complete , Prime Minister Jean Chretien said yesterday .","Canada will not consider sending more troops to Afghanistan until its current 12-month peacekeeping mission is complete , Prime Minister Jean Chretien said Saturday ."
1,3279020,3278928,"Progress Software plans to acquire privately held DataDirect Technologies for about $ 88 million in cash , the companies said Friday .","Progress Software Corp. is acquiring DataDirect Technologies Ltd . , a privately held supplier of data-access software , for approximately $ 88 million , the companies said Friday ."
1,1851859,1851814,"In the year-ago period , Pearson posted a 26 million pre-tax profit .",A year ago the firm posted a profit of 26 million pounds .
0,365851,365967,"Initial autopsy reports show they died of dehydration , hyperthermia and suffocation .","Two more died later , and initial autopsy reports show they succumbed to dehydration , hypothermia and suffocation ."
0,1151081,1151065,The company 's chief executive retired and chief financial officer resigned .,"A third executive , chief operating officer David Glenn was fired ."
1,305630,305407,"The decades-long conflict has killed more than 10,000 people in the resource-rich province , most of them civilians .","More than 10,000 people , most of them civilians , have been killed in three decades of insurgency ."
1,1780523,1780684,""" There is always a danger of casualties in something like this .",Howard said there was always a risk of casualties .
1,862810,862724," She was crying and scared , ' said Isa Yasin , the owner of the store ."""," She was crying and she was really scared ,  said Yasin ."
1,2150265,2150184,"""Sheena Young of Child , the national infertility support network , hoped the guidelines would lead to a more """" fair and equitable """" service for infertility sufferers .""","""Sheena Young , a spokesman for Child , the national infertility support network , said the proposed guidelines should lead to a more """" fair and equitable """" service for infertility sufferers ."""
1,313947,313222,"As a result , Nelson now faces up to 10 years ' jail instead of life .",The verdict means Nelson faces up to 10 years in prison rather than a possible life sentence .
1,633383,633460,"He had also said an interest rate cut by the European Central Bank , which meets Thursday , would be welcome .","He had also said on the eve of Monday 's talks that an interest rate cut by the European Central Bank , which meets on Thursday , would be welcome ."
0,1399401,1399370,"Other , more traditional tests are also available .",Traditional tests also are available at no cost today .
0,1957823,1957694,"Tenet has been under scrutiny since November , when former Chief Executive Jeffrey Barbakow said the company used aggressive pricing to trigger higher payments for the sickest Medicare patients .","In November , Jeffrey Brabakow , the chief executive at the time , said the company used aggressive pricing to get higher payments for the sickest Medicare patients ."
0,1396772,1396869,The group ambitiously expects to issue guidelines by the end of the year and release products by late 2004 .,The group expects to roll out the first products by the second half of 2004 .
0,332392,332566,"""The department told airlines """" the threat level to UK civil aviation interests in Kenya has increased to imminent .""","Britain 's Department for Transport said ' ' the threat level to UK civil aviation interests in Kenya has increased to imminent , ' ' and suspended flights after 6 p.m. EDT ."
1,3035805,3035933,"None of Deans opponents picked him as someone to party with , nor was Dean asked that question .",None of Dean 's opponents picked him as someone to party with and Dean was not asked the question .
1,2521336,2521360," We had nothing to do with @ Stake 's internal personnel decision ,  Microsoft spokesman Sean Sundwell said ."," Microsoft had absolutely nothing to do with AtStake 's internal personnel decision ,  Sundwall said ."
0,1077094,1076865,"Two weeks later on New Year 's night , Nikia Shanell Kilpatrick was discovered bound and strangled in her apartment .","On Jan. 1 , Nikia Shanell Kilpatrick , who was pregnant , was found bound and strangled in her apartment ."
1,1691524,1691465,"That compares with earnings of $ 446 million , or 7 cents per share , on revenue of $ 6.3 billion in the same period a year ago .","That compares with a profit of $ 446 million , or seven cents per share , on revenue of $ 6.32 billion in the same period last year ."
1,2263996,2263904,Russian cosmonaut Malenchenko managed a space first earlier this month by marrying his earth-bound fiance by space phone .,Russian cosmonaut Malenchenko achieved a first earlier this month when he married his earth-bound fiancee by video link .
0,748187,748228,"The transfers would reduce P & G 's worldwide work force to slightly less than 100,000 .","The transfers would reduce P & G ’ s worldwide work force to slightly less than 100,000 , down from 110,000 several years ago ."
1,222647,222469,"Shares in Berkeley-based Xoma lost 77 cents , or 14 percent , to close at $ 4.72 each in trading on the Nasdaq Stock Market .","The share price of Berkeley-based Xoma lost 73 cents a share , or 13 percent , to $ 4.76 in afternoon trading on the Nasdaq Stock Market ."
1,2405187,2405072,"Intel Corp. unveiled Wednesday its next generation processor for cellular phones , personal digital assistants and other wireless devices .","Intel on Wednesday unveiled its next-generation processor for cell phones , PDAs , and other wireless devices ."
1,1027118,1027150,"As he left court , McCartney cast one long angry glare at Amrozi , who almost hid behind his lawyer to the side .","As he left the court , McCartney cast a long , angry glare at Amrozi , who tried to hide behind his lawyer ."
0,1578836,1578673,"A senior air force official and a member of parliament were also on board , state radio report said .","A senior air force official and a member of Parliament also died in the crash , it said ."
1,3149040,3149074,"Intel ’ s Xeon surpassed HP ’ s PA-RISC to become the most often used processor , rising from 76 systems in June to 152 systems in November .","Intel 's Xeon surpassed HP 's PA-RISC to become the processor most often used , rising from 76 systems in June to 152 systems in November ."
0,845113,845201,"Foreigners board helicopters for evacuation from the European Union compound in Monrovia , Liberia , on Monday .","French troops defend a group of foreigners as they board helicopters for evacuation from the European Union compound in Monrovia , Liberia ."
1,552386,552172," Please , keep doing your homework ,  said Bavelier , the mother of three ."," Please , keep doing your homework ,  said Bavelier , the mother of 6-year-old twins and a 2-year old ."
1,1793541,1793607,Tampering with medicine has been so lucrative that many of those arrested lived in million-dollar homes .,"Tampering with medicine apparently was so lucrative , investigators said , that many of the suspects lived in million-dollar homes ."
1,1599728,1599554," We acted because we saw the existing evidence in a new light , through the prism of ... Sept . 11th . "," We acted because we saw the evidence in a dramatic new light , through the prism of our experience on 9 / 11 . "
0,969584,969187,"The blue-chip Dow Jones industrial average .DJI fell 86.56 points , or 0.94 percent , to 9,109.99 , after giving up more than 1 percent earlier .","The Dow Jones industrial average .DJI fell 79.43 points , or 0.86 percent , to 9,117.12 on Friday ."
1,1149319,1149377,"""Oracle 's offer """" undervalues the company and is not in the best interest of stockholders , """" PeopleSoft CEO Craig Conway said ."""," Oracle 's offer undervalues the company and is not in the best interest of PeopleSoft stockholders ,  said PeopleSoft President and CEO Craig Conway , in the statement ."
0,2332155,2332299,"Henri was centered about 75 miles southwest of Cedar Key and was moving east-northeast at 5 mph , forecasters said .","It was centered about 100 miles southwest of Cedar Key and drifting erratically southward , forecasters said ."
1,1538790,1538868,Sales of downloaded singles and albums will be included in Billboard 's charts for those configurations .,"Digital download sales of recorded albums and singles will be included in the album and singles sales charts , respectively ."
1,2794695,2794721,"""General Myers told reporters that """" at first blush , it doesn 't look like any rules were broken """" ."""," At first blush , it doesn 't look like any rules were broken ,  said Gen. Richard Myers , chairman of the Joint Chiefs of Staff ."
1,2238966,2239003,"Peterson , 27 , was eight months pregnant when she disappeared in the days before Christmas .",Peterson was almost eight months pregnant when she was reported missing .
1,413097,413107,"""But right now it looks manageable , """" Gehman told reporters .""","""Right now it looks to me like it 's going to be manageable , """" he said ."""
0,2205356,2205241,"Second comes HP ( 27 percent with $ 2.9 billion , up just 0.4 percent ) .",HP fell to second place with server sales growing 0.4 percent to $ 2.9 billion .
1,218925,218856,"Without the fleet , NASA has relied on the Russian space program to rotate crew members for the International Space Station and to send supplies to the orbiting laboratory .","Without the shuttle fleet , NASA is relying on the Russian space program to rotate crew members on the International Space Station and send new supplies to the orbiting laboratory ."
0,3042240,3042279,"The rats that consumed the tomato powder had a 26 percent lower risk of prostate cancer death than the control rats , researchers found .","Rats on the tomato powder diet had a 26 percent lower risk of prostate cancer death than the control rats , allowing for diet restriction ."
0,229442,229500,"""I thought things went a bit overboard but I prefer to leave it on the field , """" Sarwan said ."""," A lot of things ( were said ) , but I 'd prefer to leave it on the field ,  he said ."
1,3261229,3261252,"The arrests came two days after Ken Livingstone , the London Mayor , claimed police and security services had foiled four terrorist attacks on the capital .",London Mayor Ken Livingstone announced over the weekend that police and security services had foiled four terrorist attacks on the capital .
1,1759675,1759745," The investigation appears to be focused on certain accounting practices common to the interactive entertainment industry , with specific emphasis on revenue recognition ,  Activision said in an SEC filing .","""According to the company filings , the investigation """" appears to be focused on certain accounting practices common to the interactive entertainment industry , with specific emphasis on revenue recognition . """""""
1,306643,306346,"The latest attack came just two days after three suicide bombers drove a truck loaded with explosives into a government office complex in northern Chechnya , killing 59 people .","The attacks came two days after suicide bombers detonated a truck bomb in a Government compound in northern Chechnya , killing 59 ."
0,1195661,1195775,The U.S. Centers for Disease Control and Prevention has been gathering information on suspect cases .,"Nationally , the federal Centers for Disease Control and Prevention recorded 4,156 cases of West Nile , including 284 deaths ."
1,2395061,2394939,He projected Vanderpool will be available within the next five years .,"Products featuring Vanderpool will be released within five years , he said ."
1,2157605,2157574," United is continuing to deliver major cost reductions and is now coupling that effort with significant unit revenue improvement ,  chief financial officer Jake Brace said in a statement ."," United is continuing to deliver major cost reductions and is now coupling that effort with significant unit revenue improvement ,  he said ."
1,330570,330597,"SARS has also taken a toll on Taiwan 's economy , as it has on economies across the region , hammering consumer spending and leaving shops , restaurants and airports empty .","SARS has also taken a toll on Taiwan 's economy , hammering consumer spending , with shops , restaurants and airports empty while people stay at home ."
1,1887655,1887596,"Network security products maker Secure Computing Inc. said Tuesday it is acquiring content-filtering vendor N2H2 for $ 20 million , furthering consolidation in an already-competitive market .","Network security products maker Secure Computing said Tuesday it is acquiring content filtering firm N2H2 for $ 20 million , furthering consolidation in an already competitive market ."
1,981097,981018,"Under the program , U.S. officials work with foreign port authorities to identify , target and search high-risk cargo .","Under the program , US officials work with foreign port authorities to seek out high-risk cargo before it can reach the United States ."
0,3389680,3389709,"It was the first suicide attack in Israel since October 4 , when a bomber killed 23 people .",The first Palestinian suicide attack in Israel killed eight people in April 1994 in the centre of Afula .
1,883815,883864,Iraqi officials say the attacks are being carried out by what they call outsiders who slip into Falluja and attack at night .,"""Iraqi officials here insist that the attacks are being carried out by """" outsiders """" who slip into Fallujah and attack at night ."""
1,3313775,3313498,Taiwan ranked No. 3 in the world behind China and Hong Kong for SARS deaths and cases .,"Taiwan ranked No. 3 on the global list for deaths and cases , behind China and Hong Kong ."
1,1980565,1980620,"The new WPAN standard uses the 2.4-GHz unlicensed frequency band and specifies raw data rates of 11M , 22M , 33M , 44M and 55Mbit / sec .","The new WPAN standard uses the 2.4 GHz unlicensed frequency band and specifies raw data rates of 11 , 22 , 33 , 44 and 55Mbit / s ."
0,699968,699921,"The technology-laced Nasdaq Composite Index .IXIC climbed 19.11 points , or 1.2 percent , to 1,615.02 .","The Standard & Poor 's 500 Index .SPX gained 13.68 points , or 1.42 percent , at 977.27 ."
1,2254641,2254589,"The 244th Engineer Battalion has been clearing rubble , building playgrounds and restoring irrigation in Iraq , the military said .","The battalion has been clearing rubble , building playgrounds and restoring irrigation in Iraq , military officials told The Associated Press ."
1,1258293,1258203,"Roberts said he didn 't think excess inventory showed up in Avery 's first quarter , although it might explain the drop and quick recovery in sales this quarter .","Roberts said he didn 't think excess inventory showed up in Avery 's March quarter , although it could explain the drop and quick recovery in sales during the current quarter ."
0,3315915,3315684,"Limbaugh 's lawyer , Roy Black , has accused the Palm Beach State Attorney 's Office of having political motives for investigating whether the conservative radio commentator bought painkillers illegally .","Limbaugh 's attorney , Roy Black , has accused the State Attorney 's Office of having political motives for its investigation ."
1,367061,366887,"Two of Collins ' top assistants will consult with state police during the investigation and determine if any federal laws were violated , he said Friday .",U.S. Attorney Jeffrey Collins also said two of his assistants will consult with state police during the investigation and determine if any federal laws were broken .
1,1789339,1789525,"""The company will launch 800 hot spots , or """" Wi-Fi Zones , """" later this summer , and plans to have more than 2,100 by the end of the year .""","The service will launch later this summer with 800 locations , and Sprint plans 2,100 locations by the end of the year ."
1,349539,349129,"""The previous weekend record for an R-rated film was $ 58 million for """" Hannibal . """"""","""The previous biggest R rated opening was """" Hannibal 's """" $ 58 million ."""
0,1277805,1277554,He was revived but was pronounced dead at Virginia Medical Center in Arlington .,He was declared dead on arrival at Virginia Hospital Center in Arlington at 9 : 13 a.m.
0,159377,159256,"More than 60 suspected cases have been reported in the United States , none of them fatal .","Sixty-five probable cases of SARS have been identified in the United States , along with 255 suspected cases ."
1,2706183,2706157,"The search was concentrated in northeast Pennsylvania , but State Police Trooper Tom Kelly acknowledged that Selenski could have traveled hundreds of miles by now .","The search was concentrated in northeastern Pennsylvania , but State Police Trooper Tom Kelly acknowledged that Selenski could be out of the area ."
1,957412,957368,"""Less than a month after departing her anchor 's chair at """" Dateline NBC , """" Jane Pauley has signed a new deal with NBC to host a syndicated daytime talk show .""","""Less than a month after leaving as host of """" Dateline NBC , """" Pauley agreed Thursday to launch a daytime talk show for NBC Enterprises ."""
1,424071,424093,"In two new schemes , people posing as IRS representatives target families of armed forces members and e-mail users .",Two new schemes target families of those serving in the military and e-mail users .
1,14874,14831,"""Powell fired back : """" He 's accusing the president of a ludicrous act , """" he said .""","If so , Powell said , he 's calling the president ludicrous , too ."
1,1346473,1346394,"Despite their differences , U.S. and EU leaders said there were areas of agreement .","Despite these and other differences , U.S. and EU leaders insisted they were working well together ."
