index,sentence1,sentence2,label
1821,"""In a statement in The Washington Times, the executive director of 21st Century Democrats, Mark Lotwis, called the lawsuit """"frivolous"""" and said: """"we're going to defend our organization's integrity"""". Landmark Education spokeswoman Deborah Beroset said that the Landmark Forum """"is in no way religious in nature and any claim to the contrary is simply absurd,"""" and stated: """"While we are not a party to this lawsuit and have no firsthand knowledge of it, we can only assume that we are being used as a legal and political football to further the plaintiff""""s own financial interests."""" The New York lawsuit was filed April 14, and is still in early filing stages. A conference with the federal court judge in the case has been scheduled for June 17.""",Mark Lotwis is a Democrat.,entailment
687,"""Pakistan's President Pervez Musharraf held talks with British Prime Minister Gordon Brown in London on Tuesday, reassuring his host that Pakistan will hold a fair election next month and is ready to continue a sustained fight against terrorism and extremism. The visit has been widely called President Musharraf's """"charm offensive."""" The Pakistani leader has held talks in Brussels, Paris, at the World Economic Forum in Davos, Switzerland and now in London in an effort which has been seen as an attempt to shore up European support for his government.""",Musharraf met Brown in London.,entailment
2358,In one case five workers at a plating company were asphyxiated by hydrogen cyanide while trying to clean a sludge tank.,Cyanide fumes killed five workers cleaning one tank.,entailment
2066,The increased amounts of carbon dioxide (CO2) and other greenhouse gases (GHGs) are the primary causes of the human-induced component of global warming.,Greenhouse effect changes global climate.,entailment
2118,"GUS on Friday disposed of its remaining home shopping business and last non-UK retail operation with the €390m (£265m) sale of the Dutch home shopping company, Wehkamp, to Industri Kapital, a private equity firm.",Wehkamp cost €390m.,entailment
1326,"Thousands of Shiite Muslims rallied Friday, in the southern city of Basra, to show support for Iraq's new constitution and the Shiite-dominated government.",Thousands of Shias have marched in the southern Iraqi city of Basra to back the new constitution.,entailment
1007,Passions surrounding Germany's final match at the Euro 2004 soccer championships turned violent when a woman stabbed her partner in the head because she didn't want to watch the game on television.,A woman passionately wanted to watch the soccer championship.,not_entailment
1094,"On opening day Salesforce.com's stock was up $6.20 to $17.20, a 56.4% increase over the initial offering price of $11.",Opening day of the stock of Salesforce.com rose 56.4% over the initial offering price.,entailment
820,"Following the assassination attempt in 1981, Reagan said he felt God had spared him for a purpose, and he intended to devote the rest of his life in dedication to his God and to that purpose.",Regan was almost assassinated in 1981.,entailment
1676,"About one million years ago, these people began to slowly leave Africa.","Humans existed 10,000 years ago.",entailment
1708,"Dr. Amy Joy Lanou, director of the Physicians Committee for Responsible Medicine in America, was quick to point out health dangers of the Atkins diet.",Atkins diet is associated with increased risk conditions.,entailment
745,"Dr. David Nabarro, of the World Health Organization, said a pandemic could come at any time and claim anywhere between 5 million and 150 million lives, depending on the world's response to bird flu.","The World Health Organization moved Friday, to revise alarming predictions that a pandemic stemming from the bird flu virus ravaging parts of Asia, could kill as many as 150 million people.",not_entailment
1311,"The 26-member International Energy Agency said, Friday, that member countries would release oil to help relieve the U.S. fuel crisis caused by Hurricane Katrina.",The United States has asked member states of the International Energy Agency to provide oil.,not_entailment
732,"Friday, June 9, 2006 Oklahoma Governor Brad Henry signed SB 1800 that allows the death penalty or life without parole for those convicted of sexually abusing a child under the age of 14. Additionally, the bill also establishes a Child Abuse Response Team within the Oklahoma State Bureau of Investigation. Oklahoma has now joined Florida, Louisiana, Montana, and South Carolina to have similar measures for repeat child molestation.",SB 1800 is a law that protects children.,entailment
2334,"""The American State Department announced that Russia recalled her ambassador to the United States """"for consultation"""" due to the bombing operations on Iraq.""","""An official source in the American Ministry of Foreign Affairs announced that Russia called the United States """"for consultation"""" because of the bombings on Iraq .""",not_entailment
35,World leaders expressed concern on Thursday that North Korea will quit six-party nuclear disarmament talks and will  bolster its nuclear weapons arsenal.,North Korea says it has a stockpile of nuclear weapons and is building more.,not_entailment
2319,"Warrington-born Chris Evans denies he went wild, despite quitting Radio 1 in 1997 and later being sacked by Virgin Radio for not turning up for work during a five-day drinking binge.",Chris Evans worked for Radio 1.,entailment
757,"Alzheimer's disease is successfully treated, and controlled by drugs which inhibit the synthesis of beta-amyloid protein.",Alzheimer's disease is treated using drugs.,entailment
2398,"On Friday evening, a car bomb exploded outside a Shiite mosque in Iskandariyah, 30 miles south of the capital, killing seven people and wounding 10, doctors said on condition of anonymity.",The car bomb at the mosque in Iskandariyah exploded.,entailment
1040,Medicare will select by lottery 10 percent of those who apply by Aug. 16 to begin receiving benefits starting Sept. 1.,Medicare will choose 10 percent of applicants to receive benefits by Aug. 16.,not_entailment
2312,"""Privacy lawyers are waiting with bated breath to see what the privacy commissioner has to say about this, because it has implications far beyond Google Street View, Bowman said. """"I think we're really at the beginning of this story, not the end."""" Canada's privacy laws require that a person being photographed give their consent to the pictures being published unless they are being taken for journalistic, literary or artistic purposes. However, in post-production, Google now subjects all photos to an automated process of blurring people's faces and licence plates. In addition, anyone can request specific images be removed from the site. """"The privacy concerns could be pretty severe for some and people can still be identified, even with faces blurred out,"""" Bowman said. """"I'm not sure how Google is rationalizing compliance with Canadian law by service providers who are taking the pictures here.""""""",Google is subjected to Canadian law.,not_entailment
620,PM has now firm projects which include a stake in a joint venture called Constellation in Samara involving the city's main tobacco factory.,PM acquired three Russian factories.,not_entailment
1794,"The FDA would not say in which states the pills had been sold, but instead recommended that customers determine whether products they bought are being recalled by checking the store list on the FDA Web site, and the batch list. The batch numbers appear on the container's label.",The FDA provided a list of states in which the pills have been sold.,not_entailment
1119,"Rodriguez told detectives he never touched the burning backpack, which was loaded with plastic pipes packed with gunpowder and BBs.",The burning backpack contained plastic pipes packed with gunpowder and BBs.,entailment
2450,"Macedonia seems confident it can weather the storm, but some fear Athens may soon take things up a notch.",Greece and Macedonia are in dispute over name.,not_entailment
1883,"Tom Online revenues for the three months ended June 30, 2005 were US$42.78 mn, an increase of 38.5% over the same period in 2004.",Tom Online revenues have risen by 38.5%.,entailment
719,"Kuwait becomes the fourth Gulf country where women as well as men can vote in elections. Saudi Arabia holds strictly limited, male-only elections.",Women can vote in elections in Saudi Arabia.,not_entailment
2233,Two bombs planted near an Islamic school in Pakistan killed eight people and injured 42 others yesterday in the latest outbreak of violence gripping the southern port of Karachi.,42 people killed in Karachi bomb attack.,not_entailment
1304,"Stony Brook, NY (1/10/02)- The discovery of paleolithic art in a cave in South Africa is causing researchers to consider an older and less Euro-centric view of the origins of what is considered 'modern behavior'.",Prehistoric art discovered in South Africa.,entailment
1807,"The Damascus public have been welcomed into the election candidate's private homes or to specially erected tents where voters have been enjoying food, drink and entertainment, particularly in the home of the wealthy candidate, Adnan Mullah, where dozens of supporters and friends have been invited to dinner every evening.",Candidates are entertaining voters in their homes.,entailment
457,"Both Bahrain and Qatar are members of the Gulf Cooperation Council (GCC), but they have a territorial dispute that has led to Bahrain's boycott of the GCC summit convened in the Qatari capital of Doha on December 7-9.","The members of the Gulf Cooperation Council are: Saudi Arabia, Kuwait, United Arab Emirates, Qatar, Oman, Bahrain.",not_entailment
1098,"In the year 538, Cyrus set in place a policy which demanded the return of the various gods to their proper places.",Cyrus issued a declaration in 538 that would allow the Jews to go back to their homeland.,not_entailment
1995,"Budapest consists of two parts, Buda and Pest, which are situated on opposite sides of the river and connected by a series of bridges.","Pest is on the opposite, east bank.",not_entailment
1458,"The scientific community now generally agrees that between 5 and 8 million years ago, there lived in Africa a hominid which would ultimately give rise to the first hominids and later the members of the genus Homo.","Humans existed 10,000 years ago.",not_entailment
2200,The Democrats' success in the 2006 elections means changes at the top in the House and Senate.,Democrats won the 2006 elections.,entailment
118,British mountaineer Alison Hargreaves becomes the first woman to climb Mount Everest alone and without oxygen tanks.,A woman succeeds in climbing Everest solo.,entailment
1316,"SCI, Houston's largest funeral services company, was headed by Robert Waltrip--a close associate of the Bush family.",Robert Waltrip works for the Bush family.,not_entailment
1632,"Mahbob Amiri, head of Afghanistan's quick-reaction force, said Monday's bomb in the capital detonated as a United Nations vehicle drove past.",The United Nations produces vehicles.,not_entailment
1717,"""The contaminated pills included metal fragments ranging in size from """"microdots"""" to portions of wire one-third of an inch long, the FDA said.""",The contaminated pills contained metal fragments.,entailment
1526,"President Ford reported that a force of 70 evacuation helicopters and 865 Marines had evacuated about 1,400 U.S. citizens and 5,500 third country nationals and South Vietnamese from landing zones near the U.S. Embassy in Saigon and the Tan Son Nhut Airfield.",U.S. Military evacuated U.S. citizens.,entailment
1620,"""It will be the most German of combinations: nudity and beach towels. After decades of sunbathing and camping in the buff, the legions of Teutonic naturists are about to get their very own holiday heaven — a completely clothing-free hotel. The Hotel Rosengarten, in the aptly named Black Forest town of Freudenstadt (""""Town of Joys""""), will mark a new frontier for the homeland of Freikörperkultur (FKK), meaning """"free body culture"""". A handful of German hotels have accommodated naturists up to now, but the management at Rosengarten plan to take a hardline anti-apparel stance.""",Hotel Rosengarten is a completely clothing-free hotel.,entailment
905,"On April 27th, Pavolini went on, ahead of his troops, and reached Mussolini. Accompanying him were Angela Curti, the former mistress of Mussolini.",Angela Curti was Mussolini's mistress.,entailment
2419,"After his release, the clean-shaven Magdy el-Nashar told reporters outside his home that he had nothing to do with the July 7 transit attacks, which killed 52 people and the four bombers.",52 people and four bombers were killed on July 7.,entailment
203,"Philip Morris cited strong volume gains in Germany, Italy, France, Spain, central and eastern Europe, Russia, the Middle East, Japan, Korea, Argentina and Brazil.",Philip Morris made market gains in Russia.,entailment
1881,Voting for a new European Parliament was clouded by concerns over apathy.,Voting for a new European Parliament has been clouded by apathy .,entailment
347,"It also raised questions about the quality of financial regulation in Singapore, where derivatives losses run up by former trader Nick Leeson led to the 1995 collapse of Barings Plc.",Nick Leeson was arrested for collapse of Barings Bank PLC.,not_entailment
971,City officials fired the captain of the crashed Staten Island ferry.,Staten Island ferry captain has refused to talk with investigators.,not_entailment
872,"For example, if you want to find out what the weather in your area will be like for the next five days, select the weather channel from the main multiscreen and you will find detailed forecasts and other weather news. Or if your team has been in action, you can read the top headlines for your chosen sport by keying in 300 on your handset - just as you would on Ceefax.",The weather channel gives you information about the weather in the next few days.,entailment
504,"The agreement also stated a period of transition for the Baltic countries to last until December 31, 1999. This was a much shorter period than that which was assigned to the Central European countries (their transition periods were declared to be 10 years). Estonia declined the transition period, Latvia received a transition period of four years, and Lithuania received a transition period of six years.",Baltic Countries join the EU.,not_entailment
1391,"Councilman Pierce said he was advised that the car belonged to James Clark, 68, an acquaintance of the Jones family.",Councilman Pierce owns a car.,not_entailment
1158,"This opinion poll was conducted on the sixth and seventh of October, and included a cross section of 861 adults with a margin of error estimated at 4%.","This poll was carried out on the 6th and 7th of October, and included a segment of 861 people with a margin of error estimated at 4%.",entailment
2242,"""This weekend, March 25 and 26, was a big weekend in the Ottawa area for Canadian Idol want a Be's. Canadian Idol is a national singing competition that is organized by CTV Inc. a Canadian broadcasting communications company for Canadian citizens. The television show, greatly based on """"American Idol,"""" has been on going for several seasons. In the past auditions have been know to have line-ups of thousands of people, however, this year after taking a tour around the new location it appears that line ups were manageable. Having the auditions at the St. Laurent Shopping mall [1] makes this easier said Idol's security coordinator Rick Paciorek.[2] Organizers have decided to change the way the auditions will """"rock and roll.""""""",Canadian Idol is a competition for singers.,entailment
1813,Fake prehistoric rock art of a caveman with a shopping trolley has been hung on the walls of the British Museum.,Prehistoric art discovered in South Africa.,not_entailment
152,"""Civic Alliance, the umbrella group of civic groups involved in rebuilding, hosted a large, public, town-hall meeting for 5,000 people, called """"Listening to the City"""" in July 2002.""",The Civic Alliance is an umbrella group.,entailment
314,"On Tuesday morning police in Bangladesh have blamed Islamic militants for what's believed to be the country's first suicide bombings. Up to ten people were killed and dozens of others injured in the two attacks. The attacks left at least 50 people wounded with many of them said to be in critical condition. The government has accused the hardline Jamayetul Mujahideen, which wants to introduce strict Islamic law in the Muslim-majority democracy, of staging the attacks targeting the legal system. Bangladesh police have arrested six men, including a suicide squad member in different parts of the country, in the last two days.",Two people were killed in Bangladesh.,not_entailment
1863,"His (or her) mandate is always to form a coalition based on a majority in the Dutch Parliament and a general agreement on policy ('regeerakkoord'). During a formation parties barter, letting go of some goals to achieve others.",Three parties form a Dutch coalition government.,not_entailment
1649,"The Metropolitan Museum of Art said Thursday that it would lay off more than a quarter of its merchandising staff, eliminating 74 jobs in addition to 53 already cut over the last year. It also warned that the worsening economy would most likely force it to shrink its overall work force by 10 percent ―as many as 250 full- and part-time jobs in all ―before the summer, including some in curatorial and other pivotal departments.",The Metropolitan Museum has 250 employees.,not_entailment
2137,"In 1979, the very first cases of AIDS appeared in New York. Cases of the disease that had never been seen prior to 1979, but is now considered more deadly than the bubonic plague, continued to surface in California and New York, almost exclusively in homosexual men.",AIDS spreads in Africa.,not_entailment
1193,"""First becoming famous in her native Ukraine in the 1990s, long-haired self-described """"Amazon"""" Ruslana gained international recognition for winning the 2004 Eurovision Song Contest with her song """"Wild Dances,"""" inspired by the musical traditions of the Hutsul people of the Ukrainian Carpathian Mountains.  In the five years since, Ruslana has decided to use her name and public status to represent a number of worthy causes, including human trafficking, renewable energy, and even the basic concept of democratic process, becoming a public face of Ukraine's Orange Revolution and later serving in Parliament.""",Ruslana was born in Ukraine.,entailment
1000,"Felipe González Márquez (born March 5, 1942) is a Spanish socialist politician. He was the General Secretary of the Spanish Socialist Workers' Party (PSOE) from 1974 to 1997.",Felipe González is the President of Spain.,not_entailment
1346,"The Istiqlal Mosque, in the northeast corner of Medan Merdeka opposite Lapangan Banteng, is one of the largest mosques in Southeast Asia.",The Istiqlal Mosque is one of the largest mosques in Southeast Asia.,entailment
1210,"Frye says, that he (a homeopathy expert) and Iris Bell recently studied homeopathic treatment of fibromyalgia.  A new analysis - comparing published studies of homeopathic drugs to matched, randomly selected studies of medical drugs - suggests that these apparent homeopathic drug effects are merely placebo effects.","What really irks Frye and other doctors of homeopathy, however, is that homeopathic remedies are not supposed to be used like medical drugs.",not_entailment
1148,"""Honda also released a video where a humanoid robot named Asimo was operated by a person wearing the helmet. The employee was stated to be thinking about raising his right hand, after which Asimo moved its right arm. Honda states that it could be quite some time before the technology is ready to go live due to difficulties such as the human brain's liability to become distracted, creating mixed thought patterns. A related problem is the amount of focus required by the operator. """"Practical uses are still way into the future."""" said Honda Research Institute Japan Co executive, Yasuhisa Arai. """"I'm [just] talking about dreams today.""""""",Yasuhisa Arai is an employee of Honda Research Institute Japan.,entailment
596,"Practically every architect of international stature has vied for the bonanza of public and private projects -- including Renzo Piano, Peter Eisenman, Philip Johnson, Rafael Moneo, Helmut Jahn and Richard Rogers.",Renzo Piano is an architect.,entailment
1250,"""Nicholas Burns stated in an exclusive interview for """"Utrinski Vesnik"""" from Pristina that it would be disgraceful if Athens puts a veto on Macedonia's application for membership in the European Union and NATO.""",Greece and Macedonia are in dispute over name.,not_entailment
1937,"Rose made his first start since joining the Knicks 10 games ago, replacing Thomas, who has an infected elbow.",Rose joined the Knicks 10 games ago.,entailment
331,"Former Chancellor Helmut Kohl, who stunned Germans with admission that he used illegal bank accounts to funnel secret money to Christian Democratic party, invokes personal honor in refusing to disclose names of people who gave more than $1 million between 1993 and 1998; scandal threatens to shred Kohl's place in history for reunifying Germany and leading Europe toward common currency.",The name of Helmut Kohl's political party is the Christian Democratic Union.,not_entailment
2170,"Martin was taken to New Orleans Ochsner Foundation Hospital, where nurse Jinny Resor said he was treated for dehydration.",Jinny Resor is employed at Ochsner Foundation Hospital.,entailment
252,"""On Feb. 20, Dr. Hunter S. Thompson took his life with a gunshot to the head at his fortified compound in Woody Creek, Colorado. The family will shortly provide more information about memorial service and media contacts. Hunter prized his privacy and we ask that his friends and admirers respect that privacy as well as that of his family, Juan Thompson said in a statement issued to Aspen Daily News. The death was confirmed by Pitkin County Sheriff Bob Braudis. Hunter S. Thompson was best known for his 1972 book """"Fear and Loathing in Las Vegas"""". He was recently married and had emotionally supported his friend John Kerry's candidacy.""",John Kerry was friends with Hunter S. Thompson.,entailment
1097,"The mystery of Alexander the Great's tomb still has not unraveled, and locating the burial of Alexander seems to have become an impossible mission for archaeologists.",Alexander the Great's Tomb remains undiscovered.,entailment
276,"Bechtolsheim left Sun in 1995 to found Granite Systems, a maker of high-speed networking systems, which he later sold to Cisco Systems.",Bechtolsheim was the owner of Cisco Systems.,not_entailment
2109,"Jahche Broughton, 15, was sentenced to life imprisonment and ordered to serve at least 12-and-a-half years behind bars for the murder on January 17 last year.  Miss Aim, 26, from Orkney, was killed as she made her way home from a night out with friends in the North Island resort of Taupo.   She suffered serious head injuries and later died in hospital.  A judge at the High Court in Rotorua told Broughton that the sentence took into account his age and guilty plea.  The teenager was 14 when he carried out the murder and is believed to be one of the youngest convicted criminals in New Zealand to be given a life sentence.",Jahche Broughton is the murderer of Miss Aim.,entailment
1537,"An official of the International Special Commission in charge of disarming Iraqi weapons (UNSCOM) announced yesterday, Saturday, that the Commission will keep its inspectors in Iraq despite Baghdad's decision to stop its cooperation with them.",UNSCOM is to stay in Iraq.,entailment
2362,"Jews were confined to the Jewish part of town called a ghetto, and many people there starved to death.","Disease, starvation, and overcrowding caused thousands to perish before deportations to the Nazi death camps, especially to Treblinka, began in late 1941.",not_entailment
54,"On 12 August, the San Carlos Battalion came across mines placed in their path and one soldier was killed while two were seriously injured. Meanwhile on 10 August, urban commandos took a patrol car by surprise and dropped a grenade inside the car, injuring four and partially destroying the vehicle.",A patrol car was attacked by the San Carlos Battalion.,not_entailment
423,Jacqueline B. Wender is Assistant to the President of Stanford University.,Jacqueline B. Wender is the President of Stanford University.,not_entailment
2316,"The PMDB is also the party led by Senator Jader Barbalho, the recently elected Senate President heaped with serious corruption charges.",Jader Barbalho is the Senate President.,entailment
62,"The Dutch, who ruled Indonesia until 1949, called the city of Jakarta Batavia.","Formerly ( until 1949 ) Batavia, Jakarta is largest city and capital of Indonesia.",not_entailment
1801,"Roddenberry was probably most known for her role as the voice of the computers in nearly every Star Trek television spinoff series from the 1960's to present time. She is also the voice of the computer in the upcoming movie by director J.J. Abrams, Star Trek. Majel also played Nurse Chapel in the original Star Trek series starring William Shatner and later played Lwaxana Troi in Star Trek: The Next Generation and Star Trek: Deep Space Nine.",Majel Roddenberry died of cancer.,not_entailment
112,"The 10-men team is expected to arrive at the foot of the mountain in the end of April and began their journey to the 8,586-meter peak in early May.",Kanchenjunga is 8586 meters high.,not_entailment
