index,sentence1,sentence2,label
2379,"""A new strain of Avian Flu or Bird Flu has been discovered in China and has also infected some humans. The virus also """"spreads fast"""" and has covered a """"big geographic region"""" according to Chinese health officials. It is not known how dangerous the new virus is and whether it is stronger or deadlier than the current H5N1 virus. Despite being detected in humans, no evidence has turned up to suggest that the virus can be spread easily from human to human.""",483Lu suffers from the H5N1 virus.,not_entailment
1636,"""The report faults intelligence agencies for a """"lack of imagination"""" in not anticipating that al Qaeda could attack the United States using hijacked aircraft.""",The report blames intelligence agencies.,entailment
1913,"Thanks to a global ban on the ivory trade that was passed in 1989 by the Convention on International Trade in Endangered Species of Wild Fauna and Flora (CITES), the African elephant population may be reversing its spiral toward extinction",The ban on ivory trade has been effective in protecting the elephant from extinction.,entailment
1362,"""Termed """"Operation Baylout"""", the group claims that hundreds of volunteers are taking part in coordinated efforts to jam the websites of the International Federation of the Phonographic Industry and MAQS, a law firm working with the prosecution in the Pirate Bay case. As of Friday evening MAQS's website read """"Our website is currently under attack and we have therefore decided to shut it down until the attack ceases.""""  The group is also coordinating efforts to jam the fax lines of the MPAA's anti-piracy office and of prosecuting attorney Monique Wadsted.  Andrew Norton of Pirate Party International rejected the attacks, saying, """"While we can't condone these acts, it does show there is a wealth of feeling that opposes the decisions and actions of this trade body.""",MAQS law firm employed hundreds of volunteers.,not_entailment
269,"According to NC Articles of Organization, the members of LLC company are H. Nelson Beavers, III, H. Chester Beavers and Jennie Beavers Stewart.",Jennie Beavers Stewart is a share-holder of Carolina Analytical Laboratory.,not_entailment
224,"James Kerr had been the foreman for the Deane, Adams and Deane gun factory. Robert Adams, one of the partners and inventor of the Adams revolver, was Kerr's cousin.",Dean invented a revolver.,not_entailment
2412,Recreational marijuana smokers are no more likely to develop oral cancer than nonusers.,Smoking marijuana does not increase the risk of developing oral cancer.,entailment
369,"Political change in eastern Europe and the removal of trade barriers in the Far East have given the four multinationals-Philip Morris, BAT Industries, R J Reynolds and Rothmans International-access to big potential new markets.",Trade liberalisation happened in China.,not_entailment
545,"The FMLN has prudently taken time before adopting a definite position, meanwhile the government has increased its detentions and attacked the residences of leaders of the Social Christian People's Movement.",Social Christian People's Movement was attacked by FMLN.,not_entailment
19,U.S. crude settled $1.32 lower at $42.83 a barrel.,"Crude the light American lowered to the closing 1.32 dollars, to 42.83 dollars the barrel.",not_entailment
1906,The terrorist is suspected of being behind several deadly kidnappings and dozens of suicide attacks in Iraq.,The terrorist may have caused suicide attacks and kidnappings.,entailment
589,"Blue Mountain Lumber is a subsidiary of Malaysian forestry transnational corporation, Ernslaw One.",Blue Mountain Lumber owns Ernslaw One.,not_entailment
1772,"""Mr Lopez Obrador was """"sworn in"""" by Senator Rosario Ibarra, a human rights activist and member of his party, who placed a red, green and white presidential sash across his shoulders.""",Senator Rosario Ibarra is a human rights militant.,entailment
1306,"Their work has stimulated research into microbes as possible reasons for other chronic inflammatory conditions, such as Crohn's disease, ulcerative colitis, rheumatoid arthritis and atherosclerosis, the Nobel assembly said.",Rheumatoid arthritis is caused by microbes.,not_entailment
2063,The relocation has enabled the company to eliminate the use of cyanide and chrome in its plating work replacing it with a soaplike solution.,Soap-like alternatives exist.,entailment
81,"The plaintiffs in this most recent suit contend that Lee, Perlmutter, Arthur Lieberman and Avi Arad conspired in bad faith to conceal and misappropriate financial interests in Lee's creations assigned to Stan Lee Media in 1998. SLM's meltdown involved its former President Peter F. Paul fleeing to Brazil, contributions made to Bill and Hillary Clinton, Paul's extradition and more. In 2007, SLM filed a $5 billion lawsuit in which it claimed co-ownership of all of Stan Lee's creations for Marvel.",Hillary Clinton is Bill's sister.,not_entailment
2318,"Helena Brighton, an attorney for Eliza May who served as executive director of the Texas Funeral Services Commission -the state agency that regulates the funeral business- claimed that she was fired from her state job because she raised questions about SCI.",Helena Brighton is a clerk of the Texas Funeral Services Commission.,not_entailment
695,"Yes, water is a critical area of dispute in the Arab-Israeli conflict; but given the current climate of peacemaking, and given the general war-weariness among states and populations, such predictions are excitable pieces of subjectivism.",There is a territorial waters dispute.,not_entailment
657,"A four-day state of emergency has been declared in the capital of Mongolia, Ulaanbaatar after violent protests occurred after allegations of vote rigging and fraud in Sunday's elections. Reports state that 5 people have been killed, and over 300 injured. The injured were police and protesters alike, suffering from smoke poisoning, rubber bullets, and stoning. Among the injured was a Japanese citizen, who was reportedly flown to Japan in the morning.",300 people were killed in Mongolia.,not_entailment
892,Green cards are becoming more difficult to obtain.,Green card is now difficult to receive.,entailment
1583,"Over 100 more lives were lost at sea, and 1800 were lost in Holland.",100 or more people lost their lives in a ferry sinking.,not_entailment
659,"Reagan was seriously wounded by a bullet fired by John Hinckley Jr. in an attempted assassination, but made a remarkably speedy recovery.",Reagan survived an attempted assassin's bullets.,entailment
2251,"In Greek mythology Mount Olympus was the home of the gods and the site of the throne of Zeus, the chief deity.",Mount Olympus is in Greece.,not_entailment
2325,"The main institutionalised forms of recognition for those who have made a significant contribution in the fields of physics, chemistry, medicine, literature, as well as for those working for peace (and more recently in the area of economics), are the Nobel prizes.",Nobel Peace Prize candidates have been chosen.,not_entailment
579,Protest votes as citizens of the 25 EU nations punished their governments.,The European Union is made up of 25 nations.,entailment
1075,"""Nancy Grace and the others, they just bashed her to the end, said Duckett's grandfather, Bill Eubanks, during an interview with The Orlando Sentinel. """"She wasn't one anyone ever would have thought of to do something like this. She and that baby just loved each other, couldn't get away from each other. She wouldn't hurt a bug."""" Grace's spokeswoman called the suicide """"a sad development,"""" and Grace herself issued a statement saying, """"I do not feel that our show is to blame for what happened to Melinda Duckett.""""""",Bill Eubanks was Melinda Duckett's grandad.,entailment
1685,"American Airlines began laying off hundreds of flight attendants on Tuesday, after a federal judge turned aside a union's bid to block the job losses.",American Airlines will recall hundreds of flight attendants.,entailment
1931,"Saddam Hussein accepted an 11th-hour offer to flee into exile weeks ahead of the U.S.-led 2003 invasion, but Arab League officials scuttled the proposal, officials in this Gulf state claimed.",Saddam Hussein flees to the U.S.,not_entailment
1859,"Sunday's explosion outside the Al-Rashi police station in the Al-Mashtel neighbourhood in the southeast of Baghdad, left a huge crater in the street.",Al Rashi is an executive of the police.,not_entailment
1925,"Galvarino Apablaza is the leader of the Marxist group FPMR - Manuel Rodriguez Patriotic Front. FPMR was founded in 1983 and became the armed wing of the Chilean Communist Party to carry out terrorist attacks against the Chilean militarist government of the dictator Augusto Pinochet. Its name is a tribute for Manuel Rodriguez Erdoiza, considered a Chilean hero in the war of the independence of Chile against Spain.",Comandante Salvador is the nickname of Galvarino Apablaza.,not_entailment
936,"A Continental Connection flight from Newark to Buffalo crashed into a house about four to six miles from Buffalo Niagara International Airport on Thursday night, killing 50 people, officials said. Continental Airlines Flight 3407 is a daily commuter flight from Newark Liberty International Airport in Newark, New Jersey to Buffalo, New York, operated under the Continental Connection brand by Virginia-based regional airline Colgan Air.",Buffalo is not far from Newark.,not_entailment
1015,"In 1932 he joined the then illegal Communist party and held high government and party posts from 1942, becoming home secretary in 1948, when the Communist party took control in Hungary.",Communist control in Hungary ended in 1948.,not_entailment
1183,"The substances that our company uses do not leave stains, do not have an unpleasant smell and are not toxic.",Our substances remove stains.,not_entailment
556,PM tried to buy the Belin biscuit company from RJR Nabisco two years ago.,American tobacco companies began to diversify production.,not_entailment
2154,"A man has died after riding the Expedition Everest roller coaster at Walt Disney World's Animal Kingdom in Orlando, Florida. The man, identified as Jeffery Reed, 44 from Navarre, was given CPR after being pulled off the ride unconscious, and was taken in an ambulance to Celebration Hospital, where he was pronounced dead. Reed had no external signs of injuries, and police are investigating to determine whether or not Reed may have had any pre-existing medical conditions. An autopsy is to be performed on the body, but details have not yet been released.",Walt Disney World is in Florida.,entailment
434,"A force majeure is an act of God, said attorney Phil Wittmann, who represents the New Orleans Saints and owner Tom Benson's local interests.",Phil Wittmann works for Tom Benson.,entailment
1946,Voting for a new European Parliament has been clouded by apathy.,Apathy clouds EU voting.,entailment
521,"""In Wednesday's filing, Google said it planned to complete the IPO """"as soon as practicable.""""""",It's unclear whether Wednesday's twist will affect the timing of Google's initial public offering.,not_entailment
1358,"As parties adapt to these new conditions, new definitions - replete with new assumptions about their functions - are likely to shape the ongoing debate about their roles and functions in the 21st century.",Several new political parties emerged.,not_entailment
1606,"""While local cab drivers had compliments, not everyone appreciated the company. The Chicago Cubs decided to cancel their booking after hearing about the con, and J.J. Hardy of the Milwaukee Brewers reported being kept up by fans on Wednesday night. The Brewers lost their game the following day. The convention closed with next year's date ―June 26-29 ―along with the announcement of a guest: Disney animator Floyd Norman. The event's theme will be """"It's a Jungle Out There!"""".""",J.J. Hardy has a contract with the Milwaukee Brewers.,entailment
671,Al-Qaida-linked militants have carried out a series of suicide bombings targeting Western interests in Indonesia since 2002.,Since 2002 Al-Qaida militants have tried to hit Western interests in Indonesia.,entailment
715,"Beijing's hard-line stance on the Dalai Lama has grown considerably tougher in recent years. Ties with Germany nose-dived after Chancellor Angela Merkel met with the Dalai Lama in September 2007, recovering only after Berlin offered a pledge similar to that made by France on Wednesday. Companies alleged to have supported the exiles' activities have been subjected to smear campaigns and boycott calls in China, and an appearance in mainland China by the British rock group Oasis was axed by Beijing last month because guitarist and chief songwriter Noel Gallagher once took part in a free Tibet concert — in 1997.",Angela Merkel is a Buddhist.,not_entailment
972,"""On the other hand, the article, """"Fiction and Facts About Drug Legalization"""", by Joseph Califano identifies possible social problems that could occur as a result of marijuana being decriminalized in any form, whether for medical purposes or for recreational use.""",Drug legalization has benefits.,not_entailment
861,"Verizon Communications Inc. said on Monday it would buy long-distance telephone company MCI Communications Inc. in a deal worth $6.75 billion, giving Verizon a foothold in the market for serving large corporations.",Verizon Communications Inc.'s $6.7 billion takeover of long-distance provider MCI Inc. transformed the telephone industry.,not_entailment
739,"Food and Drug Administration, which regulates human experiments, says its regulations forbid human cloning without prior agency permission, and it has launched an investigation into whether Clonaid illegally performed any work on U.S. soil.",Food and Drug Administration forbids human cloning without prior permission.,entailment
989,"Worldwide, child labor is most prevalent in the agricultural sector, where children are widely used as day laborers. Working long hours, children working in agriculture are often exposed to harmful pesticides, dangerous machinery, backbreaking loads, and many other hazardous conditions.",Child labor is widely used in Asia.,not_entailment
618,"The European Organization for Nuclear Research (CERN) said on Monday that repairing the Large Hadron Collider (LHC) will cost up to €16.6 million or $21 million. The LHC, which is the world's largest and highest-energy particle accelerator, is located near the border of France and Switzerland and crosses the border four times. It has a diameter of 27 km (17 miles). It is designed to simulate the conditions shortly after the Big Bang, but it broke down on September 19 due to an electrical failure.",CERN head office is in Paris.,not_entailment
2338,"The scandal is one of several threatening to undermine President Cardoso's four-party government alliance, and could force out one of Brazil's top politicians - the newly appointed President of the Senate, Jader Barbalho.",Jador Barbalho is a politician.,entailment
598,"The six-member delegation included lawyers from the Justice, State, and Homeland Security Departments, according to U.S. military sources, who spoke on condition of anonymity because only Justice was allowed to officially disclose the mission. They were to spend a minimum of one hour with each of the Uighur (WEE-gur) captives, who are part of China's Muslim minority and who risk religious persecution if returned to their homeland. Each was captured in Afghanistan in late 2001 and handed over to U.S. forces, who interrogated them to learn about al-Qaeda's paramilitary training camp structure.",Six Uighurs were captured to gain information about al-Qaeda.,not_entailment
2037,The hurdler suspended in 1993 for taking the anabolic steroid Nandrolone was cleared after a three judge arbitration panel ruled that the case against her could not be proved beyond reasonable doubt .,Nandrolone is a steroid.,entailment
1577,"In Italy, big protests by students and university staff against government reforms to higher education brought parts of central Rome to a standstill on Tuesday.",The Italian government introduces reforms to higher education.,entailment
1043,"New research shows there has been a sharp increase in disfiguring skin cancers, particularly in women under the age of 40, providing more evidence that young people are not heeding warnings about the dangers of tanning.",Tanning may cause skin cancers.,entailment
765,"About 10 million people live in the Paris metropolitan area, more than 15 percent of the country's total population. France's second largest city is Marseille (795,600) on the Mediterranean coast.",About 10 million people live in France.,not_entailment
849,"Traditionally, 60 percent of the tickets sold for a stop on the Vans Warped Tour, for example, occur six days prior to the show.",Most tours only sell 60 percent of the tickets.,not_entailment
2333,"""NEW YORK (CBS) ―  Imagine developing a condition where you start to lose the color in your skin. It's called """"vitiligo"""" and it affects millions of people in this country.  If you remember the King of Pop from his """"Thriller"""" days, you might notice that his skin tone was what you would expect for an African-American. Today? Michael Jackson is as pale and milky white as a ghost.  What happened is he developed the skin condition, vitiligo, reports CBS station WCBS-TV.""",Jackson's skin has become lighter because of vitiligo.,entailment
2093,"As an active member of the National Guard, he was called to duty in 1941. Although Kennon did not see active combat, he did not return home from World War II until May of 1945.",Kennon was part of the National Guard.,entailment
1683,"Analysts expected the company to earn $1.42 a share on revenue of $3.82 billion, according to a Thomson Financial survey.","Analysts had expected revenue of $3.8 billion, according to Reuters estimates.",not_entailment
1355,"US Federal Reserve boss, Alan Greenspan, sees increased US trade protectionism and ever-larger budget deficits as the biggest threats to the US economy.",Greenspan also said that bloated trade and budget deficits threaten the long-term health of the U.S. economy.,not_entailment
717,"Hurricane Isabel was a tropical storm when she entered Virginia, but caused damage to 75% of the state, making it one of the costliest disasters in Virginia's history.",A tropical storm has caused significant property damage or loss of life.,entailment
1371,"Around 130 flights were cancelled during a strike held on 19 January, and others were cancelled in the days that followed. When the flight assistants announced a further 24-hour for 23 January, the Italian Guarantee Authority (Commissione di Garanzia) which regulates strikes in essential public services (under the terms of laws no. 194/1990 and no. 83/2000) (IT0004266F) accused the unions of breaching the legal provision that 10 days must elapse between one strike and the next.",Italian flight assistants go on strike.,entailment
2000,"Brought under Ottoman rule in the 16th century, Jordan has been led only since the 1920s by Hashemite rulers, a family whose roots are in present-day Saudi Arabia.",The Hashemite dynasty rules Jordan.,entailment
18,"""FIFA has received 11 bids to host the 2018 and 2022 FIFA World Cup tournaments, an international football competition contested by the men's national teams. The countries vying to host the tournament are Australia, England, Indonesia, Japan, Mexico, Qatar, Russia, South Korea and United States, who have individual bids and the joint bids are from Belgium-Netherlands and Spain-Portugal.  Select bids are for 2018 and 2022 tournaments and two bids are just for the 2022 tournament. Qatar and South Korea are vying just for the 2022 tournament. The two winning bids will be chosen on December 2010 by the 24-man executive committee of FIFA.  Said FIFA president Sepp Blatter: """"We are very pleased about the fantastic level of interest in our flagship competition, with all initial bidders confirming their candidature.""""""",Sepp Blatter is the president of FIFA.,entailment
1460,"A suicide attack is an attack in which the attacker or attackers intend to kill others and intend to die in the process (see suicide). In a suicide attack in the strict sense the attacker dies by the attack itself, for example in an explosion or crash caused by the attacker.",People were killed in Tamil suicide attacks.,not_entailment
1162,"Moscow (USSR), 12 Jul 89 (PRAVDA)- Blood is flowing in Columbia, where last year, according to official statistics, there were 4,600 victims of political violence, including Jaime Pardo Leal (president of Colombia's national coordination committee), around 30 deputies and many municipal advisors and mayors.",Around 30 deputies were killed on 12 Jul 89.,not_entailment
1823,"Officials from TAG Heuer have announced that the company received the iF product design award, which was given away by the jury from the International Forum Design. TAG Heuer received the award for its concept watch, called Monaco Calibre 360 (Linear Second) Concept Chronograph. The jury that gives away the iF product design awards each year consists of leading design experts from all over the world gathered in one place. The iF awards are presented in Hanover, Germany, at the International Forum Design Hannover GMBH. There are a number of fields and disciplines which have their own awards.",Monaco Calibre 360 (Linear Second) Concept Chronograph is produced in Hannover.,not_entailment
1984,"Cedras, Biamby, and Francois also led the 1991 coup that drove Aristide, Haiti's first democratically elected president, from office",Aristide seized power in 1991.,not_entailment
506,"Jose Padilla, who is a former Chicago gang member, was found by jury to be guilty of supporting Islamic terrorist groups abroad. The co-defendants, Adham Hassoun and Kifan Jayyousi were also found guilty on conspiracy to murder, kidnap, and maim people in a foreign country; conspiracy to provide material support for terrorists; and providing material support for terrorists.",Jose Padilla did not support terrorism.,not_entailment
1898,"The two presidents, Bush and Chirac, were honored with a 21-gun salute.","The two presidents, Bush and Chirac, were honoured with a 21-gun salute.",entailment
421,"""A remastered version of Paramount's """"Breakfast at Tiffany's,"""" starring Audrey Hepburn, is scheduled for release Nov. 2 at $40.""","""Audrey Hepburn starred in """"Breakfast at Tiffany's"""".""",entailment
594,The Salt Lake City 2002 Winter Olympics will take place from February 8th to February 24th 2002. The Paralympics will take place in Salt Lake City from March 7th to March 16th 2002.,2002 Olympic Winter games take place in Salt Lake.,entailment
1699,Jackson also found the company maintained its Windows monopoly by setting deals with computer makers to promote Microsoft products over those from rival software makers.,Microsoft Windows is an operating system.,not_entailment
461,"""Mr Roughan claims that children from the age of nine and up are drinking late at night. """"You don't know what the hell's going to happen."""" Mr Nant has apologised to the affected, inconvenienced residents. New Zealand Post state they are going to continue to monitor the situation, however and also have on-going discussion with the local council and police """"to make sure we're abreast of any developments in the area."""" The gang violence/activity New Zealand Post are referring to is, on the previous Thursday the Armed Offenders Squad was called out where they raided three homes following a shooting, eight people were arrested, and a large number of firearms were seized.""",Roughan has nine children.,not_entailment
2142,"""As his jubilant nation cheered, Yunus told reporters in the capital of Dhaka that he wants """"to work to create some more new things in the world"""" and would use the award money to start a company to produce inexpensive yet nutritious food for poor people and set up an eye hospital to treat impoverished patients.""",Yunus wants to start a company.,entailment
1684,"Helena Brighton, an attorney for Eliza May who served as executive director of the Texas Funeral Services Commission -the state agency that regulates the funeral business- claimed that she was fired from her state job because she raised questions about SCI.",Eliza May hired Helena Brighton.,entailment
755,"Canada is officially a bilingual country but, with nearly 60% of the population speaking English as their mother-tongue, and only 24% speaking French as their first language, some people are questioning whether Canada is truly a bilingual nation or rather, a bilingual nation on paper only. French is not the only linguistic minority in Canada, and some of the languages spoken, in order of popularity, are Chinese, Italian, German, Polish, Spanish, Portuguese, Punjabi, Ukrainian, Arabic, Dutch, Tagalog, Greek, Vietnamese, Cree and Inuktitut.",French is the most widely spoken language in Québec.,not_entailment
1002,"In 1999, Victor Conte was sent two vials of a new drug by a chemist he knew and he started giving it to some of his clients. Including says Conte, one of Americas most iconic sportswomen, Marion Jones, who was about to compete in the 2000 Sydney Olympics.",Sportswomen have been suspected of doping.,not_entailment
