index,sentence1,sentence2,label
2224,"Arsenal sneaked a 1-0 victory over Birmingham at Highbury, taking advantage of Stephen Clemence's own-goal in the 81st minute.",Arsenal lost to Birmingham.,not_entailment
98,The discovery is based on velocity measurements of a whirlpool of hot gas orbiting the black hole.,Hubble discovers black holes.,not_entailment
364,This became Aquincum when the Romans established a military camp and civilian town there at the end of the 1st century AD.,"One of the first organized settlements on the site, though, was the Roman fortress of Aquincum.",not_entailment
672,"""France is to compensate people who suffered health problems as a result of three decades of nuclear weapons tests, its government says.  It was time to investigate health complaints reported by staff who took part in tests, Defence Minister Herve Morin said.  Mr Morin told Le Figaro France should be """"true to its conscience"""".  France carried out more than 200 tests, firstly in Algeria and later in French Polynesia, between 1966 and 1996.  Mr Morin said about 150,000 civil and military workers were """"theoretically affected"""" by the tests.  Mr Morin said an independent commission would examine claims on a case-by-case basis.  He added that 10m euros ($13.6m; £9.3m) had already been earmarked to compensate victims.""",France carried out more than 200 nuclear tests during 30 years.,entailment
2145,"New York Times reporter Judith Miller broke her media silence by writing a column the newspaper published on Sunday. Her lengthy story recounted two testimonies, September 30 and October 12, she gave to a U.S. federal grand jury seeking information on the source of the Valerie Plame leak. The column described the testimony as one that relied heavily on her reporting notes given to special prosecutor Patrick Fitzgerald between her first and second  appearances.",Judith Miller works for the New York Times.,entailment
2127,"However, market players were more inclined towards weakening yen, as the yen plunged to its lowest levels since October 1998, after foreign exchange markets interpreted comments made by visiting U.S. Treasury Secretary Paul O'Neill to mean that Washington is not opposed to a weak Japanese currency.",The introduction of the euro has been opposed.,not_entailment
854,"According to the 2002 census Slovenia has 1,964,036 inhabitants.","Slovenia has 1,964,036 inhabitants.",entailment
927,"""Aziz confirmed that Iraq's demands include """"the lifting of the blockade and the restructuring of the espionage commission, including its Chairman, (Richard) Butler.""",Iraq demands the lifting of the embargo and changes in the committee.,entailment
1022,"Thousands of Shiite Muslims rallied Friday, in the southern city of Basra, to show support for Iraq's new constitution and the Shiite-dominated government.",Sunni Arabs say they're not ready to re-join the committee drafting Iraq's new constitution.,not_entailment
1445,French police recovered five masterpieces stolen from Paris Museum last Summer including a small work by Renoir.,"Five masterpieces, including a Renoir, were recovered when the thief confessed.",not_entailment
536,"""Once called the """"Queen of the Danube,"""" Budapest has long been the focal point of the nation and a lively cultural centre.""","""Budapest was once popularly known as the """"Queen of the Danube.""""""",entailment
707,"Nine soldiers and two police officers were killed in the ensuing gun battle, and two police officers were wounded, the officials said.","Six policemen and two soldiers were killed in a gunbattle, officials said.",not_entailment
1103,"Climate change is with us. A decade ago, it was conjecture. Now the future is unfolding before our eyes. Canada's Inuit see it in disappearing Arctic ice and permafrost.",Greenhouse effect changes global climate.,not_entailment
1669,"""She would later return to the Contest in 2005 with """"Angel,"""" an anthem she penned herself, and achieved second place. Now, in 2009, she will be returning to Eurovision for a third try, hoping for the """"3-2-1"""" charm and a victory ―something that has eluded her thus far. Her entry, the ballad """"What If We,"""" has special memories for Chiara; it is dedicated to her father, who is recently deceased.""",Ms Siracura joined the Eurovision Song Contest.,not_entailment
831,"""The Russian government announced the termination of its """"counterterrorism operation"""" in Chechnya effective April 16. According to the leader of the Russian secret service, Alexander Bortnikov, 20,000 soldiers will leave Chechnya in order to normalise the situation in the autonomous republic of Russia. This happened on behalf of the Russian president Dmitry Medvedev who had already announced a possible withdrawal of the Russian troops at the G20 summit in the beginning of April this year. But some forces, the special forces of Moscow's ministry of the interior, will still stay in Chechnya.  Human rights activist Lew Ponomarjov welcomed the situation, saying that the counterterrorism situation in Chechnya had been a severe violation of human rights.""",Alexander Bortnikov lives in Chechnya.,not_entailment
874,"DENVER —  Angie Zapata was a tall woman with striking black hair and eyes who would attract the attention of men, even those who knew she was biologically male. But prosecutors say when Allen Andrade found out, he beat her to death with a fire extinguisher. Her sister discovered her battered body under a blanket in her Greeley apartment last July. Andrade, 32, of Thorton, is scheduled to go on trial Tuesday on charges including first-degree murder and a bias-motivated crime, which could add three years to his prison sentence if convicted.",Angie Zapata has been killed with a fire extinguisher.,entailment
1567,"The town lies along the stretch of coastline designated as Gold Beach during the D-Day landings , one of the beaches used by British troops in the allied invasion. Arromanches was selected as one of the sites for two Mulberry Harbours built on the Normandy coast, the other one built further West at Omaha Beach.",The Normandy landings took place in June 1944.,not_entailment
595,"LISBON, Jan. 22 (Xinhuanet) -- Anibal Cavaco Silva, a former prime minister, won Portugal's presidential election on Sunday.",New Portuguese prime minister is elected.,not_entailment
2112,"""PST Chittagong, Bangladesh-- Muhammad Yunus, Bangladesh's """"Banker to the Poor"""" who provides loans to help millions of people fight poverty by starting businesses, has won the Nobel Peace Prize.""",Muhammad Yunus won the Nobel Prize for Peace.,entailment
1194,"Scott Island was discovered and landed upon in December 1902 by Captain William Colbeck commander of the Morning, relief ship for Capt. Robert F. Scott's expedition.",Capt. Scott reached Scott Island in December 1902.,not_entailment
2235,Passions surrounding Germany's final match at the Euro 2004 soccer championships turned violent when a woman stabbed her partner in the head because she didn't want to watch the game on television.,A man was stabbed because of a soccer game.,entailment
475,"Also, in a landmark deal with Disney, iTunes is now offering current and past episodes from two of the most popular shows on television.",I-tunes does business with Disney.,entailment
552,"Further evidence emerged on Wednesday of the severe downturn in the aviation sector as Emirates pulled its giant Airbus A380s off the Dubai to New York route. The airline blamed the weakening global economy for the decision, an embarrassing U-turn only eight months after its A380 services were launched with the New York route. Emirates' failure to make New York work with the A380 has raised concerns about the large number of the double-decker aircraft ordered by the carrier. It is the A380's largest customer and has ordered 58 of the 500-seat aircraft. It operates two to New York, one to Heathrow and one to Sydney.",A380 has only 58 seats.,not_entailment
444,"Seeking common ground amid sensitive differences on democracy, Bush and Putin agreed Thursday, on new efforts to keep nuclear arms away from terrorists as well as from sovereign nations like Iran and North Korea.","Putin and Bush, on Thursday, agreed that Iran, along with North Korea, must not become a nuclear threat.",entailment
2441,"""The Australian state of New South Wales (NSW) launched its latest anti-cannabis campaign in Sydney today. The campaign, which specifically targets 14 to 19 year-olds aims to reduce the number of young people experimenting with the drug. The advertisements follow a tightening of cannabis laws in NSW last year. The campaign, which NSW Health has cost at AUD$600,000 will use a variety of print ads placed at bus stops and in youth magazines in addition to  advertisements on websites such as MySpace and MSN. Print ads use a tag line saying """"Pot. It mightn't kill you, but it could turn you into a dickhead"""".""",People are likely to start smoking tobacco when young.,not_entailment
991,"The ceasefire declaration by the Liberation Tigers of Tamil Eelam (LTTE) and its immediate rejection by the government have emphasised the starkness of the situation in which the guerrilla group finds itself, 37 years after first taking up arms for the cause of a Tamil homeland and 26 years after the start of all-out war. Masters of communication, the Tigers were quick to disseminate their message to journalists all over Colombo and overseas, too. But to many it seemed like a cry of desperation from the losing side.",The Liberation Tigers of Tamil Eelam is a guerrilla group.,entailment
2166,"""Tony Shalhoub won best actor in a comedy for """"Monk"""", and James Spader won best actor in a drama for """"Boston Legal.""""""","""James Spader won best actor for """"Boston Legal.""""""",entailment
2377,"""Mr. Bush warned opposition Democrats in Congress against raising taxes, saying that is the worst thing lawmakers could do. But he did urge them to pass legislation that could help more Americans refinance their homes. """"When Congress comes back, I look forward to working with them to deal with the economic realities of the moment and to ensure the American people that we will do everything we can to make sure we remain a prosperous country,"""" he added.""",The Congress wants to boost the economy.,not_entailment
1272,"On this particular trip, Airbus, in cooperation with its partners, organized a trip for 80 children between the ages of 9 and 16 years from nearby National Children's Homes to visit EuroDisney for a day.",EuroDisney is located nearby National Children's Homes.,not_entailment
2309,"Among the fascinating sites in the city are Independence Hall where the Declaration of Independence was signed, and one of America's principal symbols of freedom, The Liberty Bell, located in Congress Hall.",The US Declaration of Independence is located in America.,not_entailment
26,"""Lin Piao, after all, was the creator of Mao's """"Little Red Book"""" of quotations.""","""Lin Piao wrote the """"Little Red Book"""".""",entailment
2155,"Total coal stocks with the thermal power stations came down to 9.6 million tonnes on March 3, 2003 from 11 million tonnes on October 1, 2002.",Coal stocks rise.,not_entailment
1509,"Tuesday, January 30, 2007 The Suns had been on fire for the entire month of January. Unfortunately for them, Kevin Garnett was holding the extinguisher when the Suns came into the Target Center on Monday night. Garnett posted a double-double, scoring 44 points and snaring 11 rebounds, as the Minnesota Timberwolves defeated the Phoenix Suns 121-112. The loss prevented the Suns from posting a perfect record in the month of January, and ended the Suns' season-high 17-game winning streak. The Suns had problems answering Garnett's scoring prowess, but it was the Minnesota defense that doomed the Suns, limiting them to 17 points in the final quarter after allowing 95 from Phoenix in the first three periods. Steve Nash had 20 points and 18 assists, but in the fourth quarter he was only able to score 3 points and provide one assist.",Kevin Garnett was born in Minnesota.,not_entailment
286,"Claes denied categorically that they had ever known of the existence of an Agusta proposal, and told the NATO ambassadors that he did not know anything about an Agusta payment to the Socialist Party.",NATO Secretary General Willy Claes resigned.,not_entailment
791,"""At the time, neither """"USA Today"""" nor """"The Observer"""" was able to verify which of the sixty-plus candidates it was.""","""USA Today is a subsidiary of """"The Observer.""""""",not_entailment
1379,"""On Friday, Michael Mukasey was confirmed by the United States Senate as the next Attorney General, succeeding Alberto Gonzales. Mukasey took the oath of office with his family attending in a private ceremony that was administered by Assistant Attorney General Lee Lofthus. The nomination of Mukasey, by President George W. Bush, hit a rough spot over the issue of interrogations, in particular about waterboarding. """"This man has been a judge for 18 years,"""" said Senator Dianne Feinstein, who along with Senator Chuck Schumer provided the essential votes to pass Mukasey through the Senate Judiciary Committee. """"Maybe he likes to consider the facts before he makes a decision.""""""",Michael Mukasey is the U.S. Attorney General.,entailment
1966,"If you suffer from certain genetic illnesses, or carry a gene for that illness, scientists can take one or two cells to check for those genes and transfer only healthy embryos.",Scientists can determine whether an embryo has genetic illnesses or is a carrier of them.,entailment
624,"By law, Mexico can only export half the oil it produces to the United States.",Mexico produces more oil than any other country.,not_entailment
2353,"There are suppositions that the US Democratic Congress may re-establish the luxury taxes, which were already once introduced in the 1990s. The suppositions resulted in the National Association of Watch and Clock Collectors commissioning a report on various tax issues. Material goods such as jewelry, watches, expensive furs, jet planes, boats, yachts, and luxury cars had already been subjected to additional taxes back in 1990. After 3 years these taxes were repealed, though the luxury automobiles tax was still active for the next 13 years.",The US Congress may re-establish luxury taxes.,entailment
39,Edward VIII became King in January of 1936 and abdicated in December.,King Edward VIII abdicated in December 1936.,entailment
404,Another French daily newspaper talks about PixVillage.,PixVillage is a French newspaper.,not_entailment
891,"""The prosecutor told the court that the incident had caused """"distress"""" to one of the children.""","""The prosecutor told the court that """"distress"""" in one of the children is associated with the incident.""",entailment
1310,"As with the Babylonian New Year, the Chinese New Year, which occurred on the 1st of February in 2003, the day before Groundhog Day, is correlated to the beginning of spring.",The Chinese New Year's Day falls on the 1st of February in 2003.,entailment
1856,"Mount Olympus, the highest mountain in the Olympic Range, rises to a height of 7,965 feet (2,428 meters) and is less than 25 miles (40 kilometers) from the Strait of Juan de Fuca.",Mount Olympus is near the Strait of Juan de Fuca.,entailment
484,"An investigation has found that Unity Party presidential candidate, Mrs. Ellen Johnson-Sirleaf, United Democratic standard bearer, Charles Brumskine, and Liberian National Union standard bearer, John Morlue, have been in the position of U.S. permanent residency or green card.",Mrs. Ellen Johnson-Sirleaf is the leader of Unity party.,not_entailment
666,"Janet Elaine Adkins, 54, used a controversial machine to commit suicide in Michigan.",An Alzheimer patient was in Michigan for an assisted suicide.,not_entailment
1437,"In 1869 Sumner resigned his see, but continued to live at the official residence at Farnham until his death on the 15th of August 1874.",Sumner died at Farnham.,entailment
299,Kerry hit Bush hard on his conduct on the war in Iraq.,Kerry shot Bush.,not_entailment
2165,"In 1997, insurance companies paid out $51.6 billion for prescription drugs.",Insurance companies cover prescription drugs.,entailment
329,"Since 1974, Cyprus has been divided, de facto, into the government-controlled southern two-thirds of the island and the Turkish-Cypriot northern one-third.",Cyprus was divided in 1974.,entailment
941,"You rifle through your visual memory and there it is: Vermeer, the 17th-Century Dutch artist who painted extraordinary portraits of women engaged in the ordinary -- writing a letter, making lace or putting on a necklace of pearls.",Vermeer is a 17th-Century Dutch artist.,entailment
79,"More than 150 dolphins, marine turtles and beaked whales have been washed up dead on beaches in Africa.","Dead dolphins, turtles and whales have been found on African beaches.",entailment
1398,"Tuesday, famed ocean liner, Queen Elizabeth 2, popularly known as the QE2, arrived in her home port of Southampton, England for the final time. The Cunard Line ship has been in service since 1969, and is to become a floating hotel in Dubai. The homecoming was marred as the vessel ran aground on a sandbank near Calshot at the mouth of Southampton Water. The ship hit the sandbank at around 0530 GMT, and five tugs took around 30 minutes to pull the QE2 clear. The 70,000 tonne vessel was towed into port and eventually docked at 0730 GMT according to the Solent coastguard. Around a thousand crew and 1,700 passengers were aboard the ship, which was returning from a cruise around the Mediterranean.",Elizabeth II is the queen of England.,not_entailment
2179,"Rising house and stock prices have made many people feel more wealthy and have helped to support consumer spending, a key ingredient of the economy's good health.",A long spell of low interest rates and low risks for investors has especially encouraged investment in homes.,not_entailment
63,"""The name for the newest James Bond film has been announced today. The 22nd film, previously known only as """"Bond 22"""", will be called """"Quantum of Solace"""". EON Productions who are producing the film made the announcement today at Pinewood Studios, where production for the film has been under way since last year. The name of the film was inspired by a short story (of the same name) from For Your Eyes Only by Bond creator, Ian Fleming.""",James Bond was created by Ian Fleming.,entailment
1018,"Athletics' governing body, the IAAF, last week cleared Ottey of accusations of steroid use and lifted a two-year ban after their arbitration panel said the IOC-accredited lab in Lausanne improperly tested Ottey's urine sample.",Sportswomen have been accused of doping.,not_entailment
1713,"By 45,000 years ago, humans had weathered the comings and goings of a number of ice ages, had spread themselves throughout most of Africa, Europe and Asia, and had reached a population of roughly a million.","Humans existed 10,000 years ago.",entailment
2007,"Carelessness by contractors is a common cause of fire, including many fires that result in serious financial loss. It has been estimated that perhaps 20-25% of all non-domestic fires result from 'on-going work', such as refurbishment, repair and construction.",Domestic fires are the major cause of fire death.,not_entailment
652,"A male rabbit is called a buck and a female rabbit is called a doe, just like deer.",A female rabbit is called a doe.,entailment
1074,The first Windows DNA lab outside Microsoft was established in suburban Philadelphia in June 1998.,Microsoft was established in June 1998.,not_entailment
774,"""Manuel Rosales, who ran against Mr Chavez in the 2006 presidential election, faces corruption charges he says are baseless. He had been in hiding since the charges were filed last month. Venezuela's Interior Minister Tareck el-Aissami said Mr Rosales was a criminal on the run. """"If he doesn't appear before the appropriate courts, he would be a fugitive from justice, and as a result the court will activate mechanisms for his international capture,"""" said Mr Aissami, denying that the charges were political.""",Manuel Rosales was mayor of Maracaibo.,not_entailment
585,"He tried to persuade a local banker to loan more money to the villagers, but the banker refused, insisting they didn't qualify for credit. So, Yunus started his own bank to help the poorest of the poor lift themselves up.",Yunus started his own bank to loan money to the villagers.,entailment
92,The Auburn High School Athletic Hall of Fame recently introduced its Class of 2005 which includes 10 members.,The Auburn High School Athletic Hall of Fame has ten members.,not_entailment
219,"Of all the national park lands in the United States, none is closer to a major urban area or more beset with problems than the Everglades, a shallow, 50-mile-wide river of grass that flows south from Lake Okeechobee to Florida Bay. For more than a generation, this fragile natural wonder has been held hostage by a web of special interests -- farmers, sportsmen and about 6 million South Florida residents in need of drinking water and flood control -- that is as complex as the ecosystem itself.",The Everglades is 50-mile wide.,entailment
2349,Cyrillic is an alphabet form that is derived from the Greek alphabet. The characters in the script look substantially different from the Latin alphabet that is used throughout Western Europe.,"Cyrillic is an alphabet used for certain Slavic languages, such as Russian.",not_entailment
1723,"""Three months after the FBI raided the offices of the Dorean Group in Union City, California, neighboring companies in the same office park have received letters claiming that rent for the office park should now be paid to the Dorean Group. The owner of the office park, Hanover Properties, insists that they have not sold the park and called the Dorean Group's claim fraudulent. The first letter from the Dorean Group, dated May 2nd, 2005, purported to """"inform [the tenants] of the change in ownership of the property [the tenants] now occupy,"""" and asked that """"payment of rents be sent"""" to the principals of the Dorean Group. The letter also included notarized documents authorizing the sale by an alleged agent of the current owner, Hanover Properties, a """"Julia Pantibratyuk.""""""",Hanover Properties owns the Dorean Group.,not_entailment
1980,"Following a steady flow of leaks and statements on apparently incriminating discoveries, her office has been gagged by senior legal authorities.","Because of leaks, a gag was placed on Holland's office.",not_entailment
733,"The Pharos, a monumental lighthouse built around 280 BC and standing 330 ft high, lit the entrance to Alexandria harbour for centuries, but archeologists have never been able to identify positively any remains.",The Pharos Lighthouse was built around 280 BC.,entailment
2275,"In Africa today, the majority of infected people acquire HIV by the time they are in their 20s or 30s and, on average, die within ten years.",20-30 percent of people infected with HIV live in Africa.,not_entailment
825,"Nevertheless, 58 percent of Americans expressed their satisfaction with the President's job performance. 44 percent supported Nixon at the very beginning of the investigation into Watergate.",58% of Americans are unsatisfied with Clinton's job performance.,not_entailment
1425,Increased storage isn't all Microsoft will be offering its Hotmail users--they can also look forward to free anti-virus protection.,Microsoft will provide free anti-virus protection.,entailment
1797,"One day after pledging to undertake one of history's largest reconstruction efforts, President Bush served notice yesterday, that rebuilding the hurricane-ravaged Gulf Coast will require spending cuts elsewhere in the federal budget","Amid growing concern among congressional Republicans about the huge cost of the planned reconstruction effort, Bush said the federal government could foot the bill without resorting to a tax increase.",not_entailment
2241,"The White House pressure, reported by Iraqi officials in Baghdad and an American official in Washington, on Sunday, was a change in the administration's hands-off approach to Iraqi politics.","Washington is pressing Iraq's leaders to end weeks of political deadlock and to form a new government as soon as possible, US officials say.",not_entailment
2054,"""Macedonian Milcho Manchevski's """"Before the Rain"""" and Taiwanese Tsai Ming-liang's """"Aiqing Wansui/Vive L'Amour"""" shared the Golden Lion award for best film.""","""Before the Rain and """"Vive L'Amour"""" won the Golden Lion.""",entailment
2465,"""However, the Greens applauded the WA EPA's advice. Greens Senator Rachel Siewert said in a media release: """"This is the second time the WA EPA has knocked back this proposal. The proponents should review their options to put the project on the mainland, which will ultimately be a win for the regional economy and a win for the unique environment of Barrow Island."""" """"This is a proposal that should always have been located on the mainland. Proposing to build something on this scale inside Australia's most precious island nature reserve was deeply flawed from the beginning,"""" said Senator Siewert. """"The island has been dubbed 'Australia's Ark' for its unique cargo of endangered species, many of them now extinct or endangered on mainland Australia. He must take strong action to look after the island.""""""",Barrow Island is a part of Australia.,entailment
1233,"""John Wilkes Booth assassinated Abraham Lincoln as he sat in the presidential box of Ford's Theater watching the light comedy, """"Our American Cousin.""""""",Lincoln was assassinated in the presidential box of Ford's Theater.,entailment
