Quality,#1 ID,#2 ID,#1 String,#2 String
1,1456822,1456536,Rep. Dennis Kucinich of Ohio is expected to raise more than $ 1 million .,Ohio Rep. Dennis Kucinich passed $ 1 million last week and was still counting money .
1,1239045,1239030,One of the most well studied facets of temperament is how people respond to novelty .,One of the defining and well-studied characteristics of temperament is how people react to novelty .
1,2458876,2459076,The hospital where she is staying is being guarded by about a dozen undercover police and military intelligence officers .,"The hospital has been guarded by more than a dozen undercover police and military intelligence officers , said officials ."
0,2690149,2690096,Unemployment across the state fell a half of a percentage point last month to 6.1 percent from August 's mark of 6.6 percent .,"The unemployment rate in San Joaquin County dipped last month to 8.5 percent , down nearly a full percentage point from August ."
1,304482,304430,"El Watan , an Algerian newspaper , reported that the kidnappers fiercely resisted the army assault this morning , firing Kalashnikov rifles .","El Watan , an Algerian newspaper , reported that the kidnappers put up fierce resistance during the army assault , firing Kalashnikov rifles ."
0,2009313,2009334,"Democrats argue they are not constitutionally required to redraw the lines , and that proposed maps would disenfranchise minorities and rural Texas .",They argue that proposed congressional redistricting maps reviewed by the Legislature would disenfranchise minorities and rural Texas .
1,2269545,2269531,"Abplanalp used plastic in a model that could be mass-produced , lowering the price per valve from 15 cents to 2 1 / 2 cents .","Mr. Abplanalp used plastic in a model that could be mass produced , lowering the price per valve , to 2 1 / 2 cents from 15 cents ."
0,1509312,1509246,"French special police raided a farm in Corsica on Friday , capturing the top suspect in the 1998 murder of France 's highest official on the Mediterranean island , officials said .","Police arrested on Friday the chief suspect in the murder of the top state official on the unruly French island of Corsica , Interior Minister Nicolas Sarkozy said ."
1,3442417,3442438,"However , disability declined by more than 10 percent for those 60 to 69 , the study said .","Meanwhile , for people aged 60 to 69 , disability declined by more than 10 percent ."
1,781342,781555,"Xerox shares closed at $ 11.45 , up 2 cents on the New York Stock Exchange .",Xerox shares rose 2 cents to close at $ 11.45 on the New York Stock Exchange .
0,2512785,2512881,"Earlier this month , RIM had said it expected to report second-quarter earnings of between 7 cents and 11 cents a share .",Excluding legal fees and other charges it expected a loss of between 1 and 4 cents a share .
1,1722074,1721807,The number of injured dropped to 2.92 million in 2002 from 3.03 million a year earlier .,"At the same time , the number of injuries dropped , from 3.03 million in 2001 to 2.92 million in 2002 ."
0,2384840,2385182,"""There are more surprises than you can possibly imagine , """" Gov. Gray Davis told reporters at a campaign stop in Compton .""","""There are more surprises than you can possibly imagine , """" Davis said after appearing with former U.S. president Bill Clinton at a school dedication ."""
1,1973651,1973712,"On Sunday August 3 , the House of Deputies voted nearly 2-1 in favor of the Reverend Gene Robinson of New Hampshire .","On Tuesday in Minneapolis , the House of Bishops gave final approval on a 62-43 vote for the Rev. V. Gene Robinson of New Hampshire to become bishop ."
1,2114433,2114474,South Africa has the world 's highest caseload with 4.7 million people infected with HIV or AIDS .,"With 4.7 million people infected with HIV or AIDS , South Africa has the world 's highest AIDS caseload ."
0,1158835,1158012,RJR spends an estimated $ 30 million annually on NASCAR .,NASCAR will get an estimated $ 75 million a year in cash and promotional concessions .
1,3200940,3201393,"Jackson , 45 , posted a $ 3 million bond and returned to Las Vegas , where he is filming a music video .","After posting $ 3 million bail , Jackson flew to Las Vegas , where he had been working on a video ."
1,218945,218868,He also had management jobs at three space centers before being named director of Stennis .,Parsons held engineering management positions at three space centers before being named director of the Stennis center last August .
1,153219,153202,"Those involved were allegedly told to never speak of the incident again , according to the letter .",The letter said staff was told to never speak of the incident .
0,3391270,3391280,FBI spokesman Steve Lazarus did not immediately return a phone call for comment on Friday .,Adaptable and Carter 's Trading Co. did not immediately return calls seeking comment on Wednesday .
0,339203,339611,That package included increases to both the city 's sales and income taxes .,He also objects to the sales and personal income tax increases in the package .
1,2605599,2605635,"Five alternate jurors were also chosen , with a final one set to be selected Friday morning from the panel .","Five alternate jurors also were selected , with a sixth alternate to be picked on Friday ."
0,2056769,2056762,"Actor Noah Wyle , who has played Dr. John Carter since the shows inception in 1994 , extended his contract with the show through the 2004-2005 season .","Noah Wyle , who has played Dr. John Carter since the series launched in 1994 , has inked a one-year extension to his deal with producer Warner Bros. TV ."
1,2281835,2281720,"PC-related products were the strongest sector in July , with microprocessors up 5.6 % and DRAMs up 8.2 % from June , the industry group said .","PC-related products were the strongest sellers , with microprocessors up 5.6 percent and DRAMs up 8.2 percent , the SIA said ."
0,2582380,2582198,Shaklee spokeswoman Jenifer Thompson said the company is continuing to work with authorities .,Shaklee spokeswoman Jenifer Thompson referred all calls to the FBI .
0,1798982,1799475,"She has a boyfriend , too , officials said : Sgt. Ruben Contreras , who sat with her family Tuesday .","She also thanked her boyfriend , Sgt. Ruben Contreras , who was sitting next to the stage ."
1,1599728,1599554," We acted because we saw the existing evidence in a new light , through the prism of ... Sept . 11th . "," We acted because we saw the evidence in a dramatic new light , through the prism of our experience on 9 / 11 . "
0,2238105,2238012,And the First Amendment doesn 't say that the free exercise of religion is allowed — except in government buildings .,The amendment deals with the free exercise of religion versus the government establishment of a religion .
0,1842916,1842855,"After Mao 's death in 1976 , Madame Mao was sentenced to life imprisonment for her role in the oppressive Cultural Revolution .","After Mao 's death in 1976 , she was tried and sentenced to death , later commuted to life ."
0,3119349,3119343," We 're just dealing with bragging rights here , who wins and who loses . "," Leaving aside attorney fees , we 're dealing with bragging rights of who wins and who loses ,  said Gammerman ."
1,516157,516020,The budget analysis comes as negotiations between the City Council and the Bloomberg administration heat up .,Budget negotiations between the mayor and the City Council are entering high gear .
0,1578836,1578673,"A senior air force official and a member of parliament were also on board , state radio report said .","A senior air force official and a member of Parliament also died in the crash , it said ."
1,1367262,1366598,The AP quotes a local policeman as saying the British troops were targeted by townspeople angry over civilian deaths during a demonstration yesterday in the town of Majar Al-Kabir .,Associated Press quotes a local policeman as saying that the British troops were targeted by townspeople angry over civilian deaths during an earlier demonstration in the town of Majar al-Kabir .
1,2173122,2173166,"Easynews Inc. was subpoenaed late last week by the FBI , which was seeking account information related to the uploading of the virus to the ISP 's Usenet news group server .",Easynews Inc. said Monday that it was cooperating with the FBI in trying to locate the person who uploaded the virus to a Usenet news group hosted by the ISP .
1,2240384,2240134,He planned Monday to formally announce the effort alongside several union presidents .,He plans to announce the effort formally tomorrow in Cincinnati alongside several union presidents .
0,3138806,3138863," It seems to be following the sun ,  said Graham Cluley , senior technology consultant at antivirus vendor Sophos ."," This is a clear attempt to pinch money ,  said Graham Cluley , senior technology consultant with U.K.-based Sophos PLC ."
1,2524160,2524303,"A former candidate for governor of New York , he styled himself an advocate of better corporate governance .","Mr. McCall , who ran unsuccessfully for governor of New York in 2002 , styled himself an advocate of better corporate governance ."
1,171025,171076,"Some 14,000 customers were without power in the area , Oklahoma Gas and Electric said .","About 38,000 OGE Energy Corp. customers are without power , the company said on its Web site ."
1,2953368,2953320,He urged member states that contribute police and soldiers to U.N. peacekeeping operations to provide more women .,Undersecretary-General for Peacekeeping Jean-Marie Guehenno urged member states contributing police and soldiers to U.N. peacekeeping operations to provide more women .
1,2440664,2440782,"The UAW earlier this week reached tentative agreements , also for four years , with Ford Motor Co . , DaimlerChrysler AG 's Chrysler Group and supplier Visteon Corp.","The union earlier this week announced tentative agreements with Ford Motor Co . , DaimlerChrysler AG 's Chrysler Group and supplier Visteon Corp."
1,185929,186026,Low-income earners would pay a 5 percent tax on both types of investment income .,Low-income earners would pay a 5 percent rate for both capital gains and corporate dividends .
1,218969,218921," It 's probably not the easiest time to come in and take over the shuttle program , but I look forward to the challenge ,  Parsons told reporters at NASA headquarters ."," It 's probably not the easiest time to come in and take over the shuttle program ,  Mr. Parsons said at a news conference at NASA headquarters ."
1,2055323,2055336,The department also sent water and soil samples to the state health laboratory .,Water samples are being sent to the state health department for analysis .
1,2284830,2284862," Our party will never be the choice of the NRA - and I am not looking to be the candidate of the NRA ,  he said .","""Our party will never be the choice of the N.R.A. , and I 'm not looking to be the candidate of the N.R.A. , """" a reference to the National Rifle Association ."""
1,1941671,1941684,"At present , the FCC will not request personal identifying information prior to allowing access to the wireless network .",The FCC said that it won 't request personal identifying information before allowing people to access the wireless network .
0,883265,883025,"They found no blood and no bones , he said .","No one has found blood , bones or any other trace of the child ."
1,3119492,3119462,The G + J executive was testifying in Manhattan 's State Supreme Court where O 'Donnell and G + J are suing each other for breach of contract .,"He spoke in Manhattan 's State Supreme Court , where O 'Donnell and G + J sued each other for breach of contract ."
1,3010424,3010442,"In a conference call with reporters , RNC Chairman Ed Gillespie said he sent the request to CBS Television President Leslie Moonves .",Republican National Committee Chairman Ed Gillespie issued a letter Friday to CBS Television President Leslie Moonves .
1,2221994,2222004,YES filed suit yesterday in the Supreme Court of New York County in Manhattan .,The suit was filed in the Supreme Court of New York County .
1,1043007,1043209," For customers to get the most of the Internet , several factors are crucial ,  Pierre Danon , CEO of BT 's retail unit ."," For customers to get the most out of the internet , several factors are crucial ,  Mr Danon said ."
1,2338968,2339109,"A nationally known computer hacker is being sought on a federal arrest warrant stemming from a sealed complaint in New York , a federal defender in California said Friday .","SACRAMENTO A nationally known itinerant computer hacker faces a federal arrest warrant on a sealed federal complaint in New York , a federal defender in California said Friday ."
1,716600,716885,"Nick Markakis , a left-hander from Young Harris Junior College in Georgia , went to the Orioles with the seventh pick .","Next , Baltimore took Nick Markakis , a left-handed pitcher and outfielder from Young Harris Junior College in Georgia ."
1,1463213,1463171,"American has laid off 6,500 of its Missouri employees since Dec. 31 , according to Driskill .","Since October 2001 , American has laid off 6,149 flight attendants , according to George Price , a union spokesman ."
1,949346,949874,"As of Wednesday , there were 65 probable SARS cases in the Toronto region .","As of Monday , there were 66 probable cases in and around Toronto , a city of 4 million people ."
1,1211287,1210972,"The first biotechnology treatment for asthma , the constriction of the airways that affects millions around the world , received approval from the US Food and Drug Administration yesterday .","The first biotechnology treatment for asthma , the constriction of the airways that affects millions of Americans , received approval from the U.S. Food and Drug Administration on Friday ."
1,2497070,2497346,"In the entire fiscal year , the company lost a record $ 1.27 billion , or $ 2.11 a share , on sales of nearly $ 3.1 billion .","For the entire fiscal year , Micron lost a record $ 1.27 billion on sales of just under $ 3.1 billion ."
1,723744,723573," Ms. Stewart is being prosecuted not because of who she is , but because of what she did ,  Comey said .", Martha Stewart is not being prosecuted for who she is but for what she did . 
0,1701278,1701371,"All three had criminal records for stealing cattle , the statement said .",It said they all had criminal records for stealing cattle and Lamas was twice imprisoned for armed robbery .
1,2225692,2225652,"The other 18 people inside the building - two visitors and 16 employees , including Harrison 's ex-girlfriend - escaped without injury , Aaron said .","The other 18 people in the building , including Harrison 's ex-girlfriend , were not injured , police spokesman Don Aaron said ."
1,3120087,3120252,Civil liberties groups protested and a US district judge ruled that the monument was an unconstitutional promotion of religion .,"Civil liberties groups filed suit , and U.S. District Judge Myron Thompson ordered the monument moved last October , calling it an unconstitutional promotion of religion by government ."
1,381280,381254,"Available in June , Bare Metal Restore 4.6 costs $ 900 per Windows client and $ 1,000 per Unix client for new customers .","Bare Metal Restore 4.6 will be available in mid-June , said Veritas , and will cost $ 900 per Windows client and $ 1,000 per Unix client ."
0,2606133,2605961,"Without admitting or denying the S.E.C. ' s allegations , Mr. Markovitz agreed to a permanent ban from associating with an investment adviser or mutual fund .",He has agreed to a lifetime ban from association with an investment adviser or mutual fund .
1,3264637,3264648,"The quick conviction followed a 21 / 2-week trial , during which Waagner represented himself .","The quick conviction followed a 2 1 / 2 week trial , during which the Venango County man represented himself ."
1,3419852,3419777,"Researchers at Sweden 's Karolinska Institute reanalyzed data from more than 2,000 infants who had been treated with radiation for a benign birthmark condition between 1930 and 1959 .","Researchers at Sweden 's Karolinska Institute recently went over data from more than 2,000 children treated with radiation for a harmless birthmark condition between 1930 and 1959 ."
0,2079192,2079450,"On Wall Street , trading resumed with some glitches from the blackout that continued to affect parts of New York City .",Stocks barely budged Friday as trading resumed with some glitches from the blackout in New York .
1,3127902,3127435,"Tonight , 21-year-old Morgan and as many as 1,200 fellow students at Wheaton College will gather in the gym for the first real dance in the school 's 143-year history .","As many as 1,200 students at Wheaton College will gather in the gym Friday night for the first real dance in the Christian school 's 143-year history ."
1,2711479,2711576,"The tendency to feel rejection as an acute pain may have developed in humans as a defensive mechanism for the species , said Eisenberger .","Feeling rejection as an acute pain may have developed as a defence mechanism for the species , Eisenberger said ."
0,1076887,1076865,"On Jan. 10 , Shawanda Denise McCalister , who was also pregnant , was found bound and strangled in her apartment in the same neighbourhood .","On Jan. 1 , Nikia Shanell Kilpatrick , who was pregnant , was found bound and strangled in her apartment ."
1,1635934,1636048,Belgium said Saturday it has decided to scrap a controversial war crimes law which has seen cases launched against President Bush and Israeli Prime Minister Ariel Sharon .,Belgium said yesterday that it has decided to scrap a war crimes law used to launch cases against President Bush and Prime Minister Ariel Sharon of Israel .
0,2808363,2808393,Seven people were taken to hospital today after a second derailment on the London Underground in less than 48 hours .,The leader of the country ’ s biggest rail union threatened industrial action today following the second derailment on the London Underground in less than 48 hours .
1,741026,740969,An international warrant for his arrest was issued both to the Ghanaian authorities and to Interpol .,A warrant for Taylor 's arrest has been served on the Ghanaian authorities and sent to Interpol .
1,799342,799270,"Mr. Bergonzi was the finance chief from 1995 until his departure in 1999 , and was intimately involved in the alleged scheme to pump up Rite Aid 's earnings .","Mr. Bergonzi was the chief financial officer from 1995 until his departure , and was intimately involved in many of the alleged schemes to pump up Rite Aid 's earnings ."
1,3209548,3209513,""" Here 's what happened : I go to their Web site and start complaining to them , would you please , please , please stop bothering me ,  he said . """""""," I go to their website and start complaining to them , would you please , please , please stop bothering me ,  Mr. Booher told a reporter ."
0,2124306,2124457,"The Globe reported that Smiledge hasn 't spoken with his son , Joseph Druce , in eight years .",Smiledge said he hasn 't spoken with his son in eight years and wants nothing to do with him .
0,543292,543234,"Russia had closed checkpoints on parts of the border with China and Mongolia until June 4 , Itar-Tass news agency said .","Russia has closed dozens of checkpoints on the border with China and Mongolia , which has also reported SARS cases , until June 4 , Itar-Tass news agency said ."
1,149798,149596,Comcast Class A shares were up 8 cents at $ 30.50 in morning trading on the Nasdaq Stock Market .,The stock rose 48 cents to $ 30 yesterday in Nasdaq Stock Market trading .
0,2564069,2564090,The official would not name the leakers for the record and said he had no indication that Mr Bush knew about the calls .,The official would not name the leakers for the record and would not name the journalists .
1,2857105,2857138," The impact of increased prices has only begun to be seen in the financial numbers of the company ,  Noranda president and chief executive officer Derek Pannell said ."," The impact of increased prices has only begun to be seen in the financial numbers of the company ,  president and CEO Derek Pannell said in a statement ."
0,2636610,2636828,"Sixty players and five coaches from the school attended the training camp in August in Preston Park , about 125 miles north of Philadelphia .","Sixty players and five coaches from Mepham High School in Bellmore , Long Island attended the training camp in August ."
1,869770,870219,PeopleSoft 's board now has 10 business days to evaluate the Oracle offer and make a recommendation to its shareholders .,"Nevertheless , PeopleSoft must review Oracle 's tender offer and make a recommendation to shareholders ."
1,3137979,3137950,"SARS , the deadly respiratory disease first detected in China last November , gave the agency its first real test of a new state-of-the-art emergency operations center .","And SARS , the deadly respiratory disease first detected in China last November , tested the agency 's new state-of-the-art emergency operations center ."
1,264284,264662,"Since March 11 , when the market 's major indexes were at their lowest levels since hitting multi-year lows in October , the Nasdaq has barreled back 21.2 percent .","Since March 11 , when the market 's major indices were at their lowest levels since hitting multi-year lows in October , the tech-laden Nasdaq has climbed nearly 20 per cent ."
0,2653949,2653997,The parents want her kept alive ; her husband says she never wanted to be kept alive artificially .,Michael Schiavo has argued that his wife never wanted to be kept alive artificially .
1,1478919,1478601,"""The U.S. government and private technology experts warned Wednesday that hackers plan to attack thousands of Web sites Sunday in a loosely co-ordinated """" contest """" that could disrupt Internet traffic .""","""THE US government and private technology experts have warned that hackers plan to attack thousands of websites on Sunday in a loosely co-ordinated """" contest """" that could disrupt Internet traffic ."""
0,377408,377367,You can reach her at ( 248 ) 647-7221 or send e-mail to lberman @ detnews.com.,You can reach George Hunter at ( 313 ) 222-2027 or ghunter @ detnews.com.
0,1091318,1091268,"The 30-year bond US30YT = RR jumped 20 / 32 , taking its yield to 4.14 percent from 4.18 percent .",The 30-year bond US30YT = RR dipped 14 / 32 for a yield of 4.26 percent from 4.23 percent .
1,1914694,1914703,The company claims it 's the largest single Apple VAR Xserve sale to date .,The company claimed it is the largest sale of Xserves by an Apple retailer .
1,1362859,1363247,"Although Prempro pills were used in the study , the researchers said they had no evidence that other brands were safer .","Athough Prempro pills were used in the study , the researchers say they have no evidence that other brands are safer ."
0,992998,992963,Friends said Frank Riva worked in construction in Manhattan and recently helped his son get into the construction workers union .,"Riva had recently helped his son , Frank Riva Jr . , get into a construction workers ' union and land a job ."
1,1114356,1114165,"According to the 2000 Census , Long Beach 's Hispanic or Latino population was listed at 35.8 percent .","According to the Census Bureau , the Hispanic population increased by 9.8 percent from the April 2000 census figures ."
1,3317938,3317904," The sentence reflects the seriousness with which our office and the courts views these crimes ,  Spitzer said in a statement .","""Mr. Spitzer said in a statement that the sentence """" reflects the seriousness with which our office and the courts view these crimes . """""""
1,1814559,1814485," People who are high in positive emotions sleep better , they have better diets , they exercise more , they have lower levels of these stress hormones ,  Cohen said ."," Happy people sleep better , have better diets , exercise more and have less levels of stress hormones ,  Cohen said ."
1,1211461,1211115,"Between 50 and 100 persons die annually from these allergies , and thousands more suffer severe reactions such as constricted breathing and dramatic swelling .","Between 50 and 100 people die a year due to these allergies , and thousands more suffer severe reactions such as constricted breathing and dramatic swelling ."
0,2849263,2849208,"On July 10 , a team of 32 Singaporean police officers was sent to Baghdad .",In July 32 Singaporean police officers were sent to Baghdad to help train Iraqi police forces and returned home last month .
1,1383244,1383329,"In a landmark ruling yesterday , the Court of Appeals ordered the Legislature and Gov. George Pataki to fix the funding system by July 30 , 2004 .","In the landmark ruling regarding New York City schools , the Court of Appeals ordered the Legislature and Gov. George Pataki to fix the funding system by July 30 , 2004 ."
1,1018965,1019063,"Oracle shares were also higher , trading up 12 cents at $ 13.60 .",Shares of Redwood Shores-based Oracle rose 14 cents to $ 13.62 .
1,2049268,2049336,Memories also live on of the bloody debacle in Somalia 10 years ago -- the last major US military involvement in Africa .,Memories also live on of a bloody debacle in Somalia a decade ago -- the last major U.S. military involvement in Africa .
1,1924261,1924210,But U.S. troops will not shrink from mounting raids and attacking their foes when their locations can be pinpointed .,But American troops will not shrink from mounting raids in the locations of their foes that can be pinpointed .
1,1641980,1642291,That state will not emerge until the interim government decides on a process for writing a new constitution and for holding the first democratic elections .,That state will not emerge until the interim government decides on a process to write a new constitution and to hold the first democratic elections .
