index,sentence1,sentence2,label
1226,"Johansson was also in Milan to attend the Dolce & Gabbana autumn/winter 09/10 catwalk show and appear as one of the red-carpet stars at last night's gala opening of Extreme Beauty, an exhibition celebrating 80 years of photography in American Vogue, supported by the mayor of Milan, Letizia Moratti, and the Dolce & Gabbana duo. We meet in the swish Bulgari Hotel. Johansson is self-assured and looking extremely grown-up in a tailored, brown silk dress and snakeskin stilettos. But the blonde bombshell is nowhere in sight. Her hair is as dark as the wood-panelled walls of the suite. Why did she dye it? .",Letizia Moratti is the mayor of Milan.,entailment
770,"""O.J. Simpson has been arrested at the Palms Hotel and Casino on charges related to an alleged armed robbery on Thursday. Simpson is accused of taking items from memorabilia dealers at the Palace Station casino-hotel in Las Vegas. Simpson claims that the items belonged to him and were """"things he hadn't seen in years or that had been stolen."""" Simpson denies guns were involved and that the incident was a robbery. The exact charges are currently unknown.""",O.J. Simpson was released in Las Vegas.,not_entailment
1472,"""Mr Gregory's conclusion in 1994 was that the ceremony, transferred to the more convenient nearest Sunday, was dying out. However, that year the Conservative government proclaimed """"festivities"""" to celebrate the 50th anniversary of the Normandy landings.""",50th Anniversary of Normandy Landings lasts a year.,not_entailment
2163,Christoffer's family was identified only as an Air Force family living in Southern California.,Air Force is an organisation based in Southern California.,not_entailment
1923,"The chain of events which led to the collapse of Barings, Britain's oldest merchant bank, is a demonstration of how not to manage a derivatives operation.",Barings was Britain's oldest merchant bank.,entailment
1587,"The American House of Representatives is due to vote today, on a resolution submitted by the Chairman of the Judicial Committee, Henry Hyde, asking Congress to launch an investigation over charges brought forward by Independent Prosecutor-General Kenneth Star against President Clinton in the Monica Lewinsky affair.","Voting will take place in the American House of Representatives today, on the President Clinton-Monica Lewinsky scandal.",entailment
2343,"By 1979, the literacy rate in Cuba was higher than 90%, comparable to the rates in the United States and other developed countries.",The literacy rate in Cuba is 90%.,not_entailment
953,"Mozambique's Maria Mutola and Israel's Alex Averbukh produced the best performances of the year, in the women's 800 metres and men's pole vault, at the Super Grand Prix in Madrid on Saturday.",The women's ten thousand metres champion is from Mozambique.,not_entailment
1179,"""The development application for a McDonald's restaurant at Minyama, on Queensland's Sunshine Coast in Australia, has been rejected by the Sunshine Coast Regional Council. """"We knocked back a Hungry Jack's on Nicklin Way because of the nuisance code,"""" said divisional councilor Chris Thompson. """"We already have a 24-hour McDonald's at Mooloolaba, only one kilometre away, and there are already [anti-social] issues at that site.""""""",Sunshine Coast Regional Council accepted McDonald's Australia development plans.,not_entailment
686,"""Glue sniffing is most common among teenagers. They generally grow out of it once other drugs such as alcohol and cannabis become available to them. Seven-year-olds have been known to start """"glue sniffing"""". Because of the social stigma attached to """"glue sniffing"""" most snifters stop around 16 or 17 years, unless they are seriously addicted.""",Glue-sniffing is common among youngsters.,entailment
1368,"Mars has the smallest confirmed moon, Deimos, which is about 7.5 miles in diameter.",The terrestrial moon has a diameter of 3746 kilometers.,not_entailment
1627,"""Mr Roughan claims that children from the age of nine and up are drinking late at night. """"You don't know what the hell's going to happen."""" Mr Nant has apologised to the affected, inconvenienced residents. New Zealand Post state they are going to continue to monitor the situation, however and also have on-going discussion with the local council and police """"to make sure we're abreast of any developments in the area."""" The gang violence/activity New Zealand Post are referring to is, on the previous Thursday the Armed Offenders Squad was called out where they raided three homes following a shooting, eight people were arrested, and a large number of firearms were seized. Despite post not being delivered, newspapers were still being delivered, waste collection was still happening, and electricity meter readers were also going around house to house, checking the meters.""",Mr. Roughan is a member of the Armed Offenders Squad.,not_entailment
2108,The city continued to grow through much of the 20th century.,"The city continued to grow, but its services deteriorated.",not_entailment
2390,"The voluntary recall is considered a Class II recall since it covers products that might cause a temporary health problem or pose only a slight threat of a serious nature, the FDA said.",A Class II recall covers products that might cause a temporary health problem.,entailment
33,"A former employee of the company, David Vance of South Portland, said Hooper spent a lot of time on the road, often meeting with customers between Portland and Kittery.",Hooper is a citizen of Portland.,not_entailment
2317,"China yesterday threw down a challenge to America's 50-year dominance of the global economy as it proposed replacing the dollar as the world's main reserve currency with a new global system under the control of the International Monetary Fund. In a muscle-flexing move that will be seen as an attempt to exploit the big shifts in economic power created by the recession sweeping the West, Beijing said that the dollar's role could eventually be taken over by the IMF's so-called Special Drawing Right (SDR), a quasi-currency that was created in 1969.",The Special Drawing Right is a quasi-currency.,entailment
1990,"The petrol price reductions seen across most of Australia have been short-lived for those living in the regional New South Wales city of Bathurst. An investigation by Wikinews has discovered retailers in Bathurst were late to lower petrol pricing and have been amongst the first to increase them. Following a threat by the Australian Competition and Consumer Commission (ACCC) to publically shame fuel retailers and oil companies, most fuel outlets across Australia reduced prices by 5 to 10 cents per litre. The ACCC argued that the wholesale cost of petrol was around 10 cents per litre higher than the Singapore market, which Australia benchmarks itself against. On January 24, the price of Unleaded fuel in Bathurst dropped only 2 cents from 119.9 cents to 117.9 cents. Today, Coles Express on Durham Street has increased the price of their unleaded fuel to the previous level of 119.9 cents.",Bathurst is located in New South Wales.,entailment
1220,"In Bosnia, diplomatic determination combined with military muscle to create an opportunity to secure a peace rather than permit instability to undermine this fragile region and U.S. interests.",The Dayton Peace Treaty was formulated to end the war in Bosnia.,not_entailment
2402,Greenspan's stance has underpinned predictions the Fed will raise rates steadily this year.,The position of Greenspan has propped up the predictions that the Fed will gradually elevate the east interest rates year.,not_entailment
305,"""The biopic of wannabe actor, Johnny Stompanato, may be directed by Adrian Lyne of """"Fatal Attraction"""" and """"Indecent Proposal"""" fame.""","""Adrian Lyne is the director of """"Indecent Proposal"""".""",entailment
443,"Lastly, the author uses the precedent of marijuana legalization in other countries as evidence that legalization does not solve any social problems, but instead creates them.",Drug legalization has benefits.,not_entailment
