index,sentence1,sentence2,label
1909,"Investigators in Venezuela have been combing the grisly wreck of a Colombian plane which crashed on Tuesday, killing all 160 people on board.","A chartered jet, filled with tourists returning home to the French Caribbean island of Martinique, crashed Tuesday in Venezuela, killing all 160 people on board.",not_entailment
52,"The soldiers, who were said to have been wearing Arab headdress, were accused of firing at Iraqi police when stopped at a road block.",The soldiers were driving a civilian car and were dressed in civilian clothes when a shooting took place between them and Iraqi patrols.,not_entailment
590,"Congress leader Sonia Gandhi and BJP prime ministerial candidate LK Advani are among candidates whose seats are holding voting in the third phase. Results are due on 16 May and no party is expected to win a clear majority.  Voters in the states of Bihar, Gujarat, Jammu and Kashmir, Karnataka, Madhya Pradesh, Maharashtra, Sikkim, Uttar Pradesh and West Bengal are casting ballots on Thursday. Voting is also being held in the federally-administered territories of Dadra and Nagar Haveli, and Daman and Diu.",Sonia Gandhi is winning in the Uttar Pradesh state.,not_entailment
461,"""Mr Roughan claims that children from the age of nine and up are drinking late at night. """"You don't know what the hell's going to happen."""" Mr Nant has apologised to the affected, inconvenienced residents. New Zealand Post state they are going to continue to monitor the situation, however and also have on-going discussion with the local council and police """"to make sure we're abreast of any developments in the area."""" The gang violence/activity New Zealand Post are referring to is, on the previous Thursday the Armed Offenders Squad was called out where they raided three homes following a shooting, eight people were arrested, and a large number of firearms were seized.""",Roughan has nine children.,not_entailment
385,"The Actors Studio offering will be based on Simon's female version of the play which was premiered in 1985 in New York, at the Broadhurst Theatre, with the characters' names being Florence Unger and Olive Madison, played by Sally Struthers and Rita Moreno respectively.",Broadhurst Theatre is located in New York.,entailment
