index,sentence1,sentence2,label
1631,"New Delhi: More than 100 Nobel prize winners, two US congressmen, and leading labour organizations have expressed concern over threats against the life of Kailash Satyarthi, India's leading opponent of child labour.","Kailash Satyarthi, India's leading opponent of child labour.",entailment
1316,"SCI, Houston's largest funeral services company, was headed by Robert Waltrip--a close associate of the Bush family.",Robert Waltrip works for the Bush family.,not_entailment
1834,Profits nearly doubled to nearly $1.8 billion.,Profits nearly doubled from nearly $1.8 billion.,not_entailment
864,The most surprising news story of the past week must be the 'wonderful' story that the AIDS epidemic in India is under control.,Polio is under control in the world.,not_entailment
754,"""During that time, Wilson received the best-play Tony Award for """"Fences,"""" plus best-play Tony nominations for six of his other plays, the Pulitzer Prize for both """"Fences"""" and """"The Piano Lesson,"""" and (a record) seven New York Drama Critics' Circle prizes.""",Wilson was awarded the Pulitzer Prize.,entailment
2314,"He endeared himself to artists by helping them in lean years and following their careers, said Henry Hopkins, chairman of UCLA's art department, director of the UCLA/Armand Hammer Museum and Cultural Center and former director of the Weisman foundation.",The UCLA/Hammer Museum is directed by Henry Hopkins.,entailment
2048,"""British newsreader Natasha Kaplinsky gave birth to a baby boy earlier this morning at around 08:30 BST. She had been on maternity leave since August 21. Kaplinsky had only been working with Five News just over a month when she announced she was pregnant. Her husband of three years, investment banker Justin Bower announced """"We're absolutely thrilled."""" Kaplinsky first started to work for the BBC in 2002 after a two year tenure with Sky News. She started on the BBC Breakfast show but later moved onto the BBC Six O'Clock News and later became only the third woman to present the BBC Ten O'Clock News. She left the BBC in October 2007. She also spent a short time with ITV News. Five News released a statement saying """"Her colleagues here at Five News are delighted too - and we've sent our best wishes."""" They also said both Kaplinsky and the baby are doing fine.""",Natasha Kaplinsky and Justin Bower  got married three years ago.,entailment
590,"Congress leader Sonia Gandhi and BJP prime ministerial candidate LK Advani are among candidates whose seats are holding voting in the third phase. Results are due on 16 May and no party is expected to win a clear majority.  Voters in the states of Bihar, Gujarat, Jammu and Kashmir, Karnataka, Madhya Pradesh, Maharashtra, Sikkim, Uttar Pradesh and West Bengal are casting ballots on Thursday. Voting is also being held in the federally-administered territories of Dadra and Nagar Haveli, and Daman and Diu.",Sonia Gandhi is winning in the Uttar Pradesh state.,not_entailment
1813,Fake prehistoric rock art of a caveman with a shopping trolley has been hung on the walls of the British Museum.,Prehistoric art discovered in South Africa.,not_entailment
2118,"GUS on Friday disposed of its remaining home shopping business and last non-UK retail operation with the €390m (£265m) sale of the Dutch home shopping company, Wehkamp, to Industri Kapital, a private equity firm.",Wehkamp cost €390m.,entailment
1781,"On Aug. 6, 1945, an atomic bomb was exploded on Hiroshima with an estimated equivalent explosive force of 12,500 tons of TNT, followed three days later by a second, more powerful, bomb on Nagasaki.","In 1945, an atomic bomb was dropped on Hiroshima.",entailment
1434,"Oil prices, notoriously vulnerable to political events, spiked as high as $40 a barrel during the Gulf War in 1991.",The Gulf War was fought in 1991.,entailment
483,"The pills were sold under store brands by Wal-Mart, CVS, Safeway and more than 120 other major retailers, the Food and Drug Administration said.",The pills were commercialized by major retailers.,entailment
1550,"The galaxy, measuring just 2,000 light-years across, is a fraction of the size of our own Milky Way, which stretches 100,000 light-years in diameter.","The Milky Way measures 2,000 light-years across.",not_entailment
805,"The 500,000 eligible, Muslim voters are likely to reward Chancellor Gerhard Schroeder's Social Democrats (SPD) in the September 18 parliamentary election, for its anti-Iraq war position and pro-Muslim policies.",The parliamentary election takes place on September 18.,entailment
1849,"The Commission, designated to shed light on crimes and human rights violations during the apartheid period, accuses the African National Congress of carrying out torture and executions without trials in concentration camps, and also of playing an active role in the political violence incidents that took place between 1990 and 1994.","The Commission accused the ANC of violence, executions and human rights violations.",entailment
1616,"Most of the life of Petko Kiryakov was not unveiled by historians but by the prominent Bulgarian writer Nikolai Haitov, who wrote a novel and a script which was turned into a TV series, which became a favourite of most Bulgarians.",Nikolai Haitov is a historian.,not_entailment
2170,"Martin was taken to New Orleans Ochsner Foundation Hospital, where nurse Jinny Resor said he was treated for dehydration.",Jinny Resor is employed at Ochsner Foundation Hospital.,entailment
260,"There is no way Marlowe could legally leave Italy, especially after an arrest warrant has been issued for him by the authorities. Assisted by Zaleshoff, he succeeds in making his escape from Milan.",Marlowe was arrested by Italian authorities.,not_entailment
2489,"Turkey is unlikely to become involved in, or allow U.S. forces to use Turkish territory in a Middle East war that does not threaten her territory directly.",U.S. to use Turkish military bases.,not_entailment
2090,"The spread of AIDS in Africa is driven not by unsafe sex but by unsafe medical practice, according to research published last week.",AIDS spreads in Africa.,entailment
2128,"""UK Foreign Secretary Jack Straw said Iraqis had """"shown again their determination to defy the terrorists and take part in the democratic process"""".""",Jack Straw holds the position of UK Foreign Secretary.,entailment
688,"The city is twinned with Glasgow, Dortmund, Pleven, and Le Mans.",Dortmund is twinned with Glasgow.,not_entailment
